user_input,retrieved_contexts,response,reference,faithfulness,answer_relevancy
What is the penalty for beating the red light in the Philippines?,"[""the Philippine Information Agency (PIA), the Department of Education (DepEd), the Department of the Interior and Local Government (DILG), the Philippine National Police (PNP), and private agencies and organizations shall undertake Information, Education and Communication (IEC) campaign for a period of three (3) months from the effectivity of this IRR. RULE 4 - PENALTIES Section 8. Penalties Any person who shall violate any provision of this IRR shall be penalized with: a. A fine of five thousand pesos (P5,000.00) for the first offense; b. A fine of ten thousand pesos (P10,000.00) for the second offense; c. A fine of fifteen thousand pesos (P15,000.00) and suspension of driver's license for three (3) months, for the third offense; and d. A fine of twenty thousand pesos (P20,000.00) for the fourth offense"", 'third and succeeding offenses. Moreover, for the third offense, the driver\'s license of the offender shall be suspended for a period of one (1) month. Violation of these provisions beyond the third time shall result to automatic revocation of the offender\'s driver\'s license. Section 9. Qualifying Circumstances If, in violation of the provisions of this Act, death shall have resulted or serious or less serious injuries shall have been inflicted upon the child or any other person, a penalty of one (1) year imprisonment shall be imposed upon the motorcycle rider or operator of the motorcycle involved without prejudice to the penalties provided under Act No. 3815, otherwise known as ""The Revised Penal Code of he Philippines,"" as amended. Section 10. Review of Penalties The Land Transportation Office (LTO) us hereby empowered to increase or adjust the amount of fines herein imposed, provided that: a. The increases or adjustment is made after public consultation once every three (3) E-Library -', '11:16 PM proper conduct of field sobriety tests, which guidelines shall be made available to the public and made available for download through the official LTO website. SEC. 12. Penalties.  A driver found to have been driving a motor vehicle while under the influence of alcohol, dangerous drugs and/or other similar substances, as provided for under Section 5 of this Act, shall be penalized as follows: (a) If the violation of Section 5 did not result in physical injuries or homicide, the penalty of three (3) months imprisonment, and a fine ranging from Twenty thousand pesos (Php20,000.00) to Eighty thousand pesos (Php80,000.00) shall be imposed; (b) If the violation of Section 5 resulted in physical injuries, the penalty provided in Article 263 of the Revised Penal Code or the penalty provided in the next preceding subparagraph, whichever is higher, and a fine ranging from One hundred thousand pesos', 'FINES and PENALTIES First Offense - Php 1,000.00 Second Offense - Php 2,000.00 Third and Succeeding Offenses - Php 5,000.00 and suspension of the drivers license for a period of one (1) year 63 Republic Act No. 11229 Manufacturers, Distributors Importers, Retailer and Sellers  Must secure PS mark license or Import Clearance Certificate License  Must not use, import, sell, distribute or market the use of substandard or expired child restraint system  Php 50,000.00 but not more than Php 100,000.00 - for each and every child restraint system product,  Other penalties imposed in Republic Act No. 7394 or the Consumer Act of the Philippines: Tampering, Alteration, Forgery and Imitation of the PS mark or the ICC Stickers in the Child Restraint System  Php 50,000.00 but not more than Php 100,000.00  For each and every child restraint system product,  Other penalties imposed in Republic Act No. 7394', 'PNP shall conduct periodic training seminars for their LEOs with regard to the proper conduct of field sobriety tests and ABA tests. Within four (4) months from the effectivity of this Act, the LTO shall publish the guidelines and procedures for the proper conduct of field sobriety tests, which guidelines shall be made available to the public and made available for download through the official L TO website. RULE VI - PENAL TIES Section 1. A driver found to have been driving a motor vehicle while under the influence of alcohol, dangerous drugs and/or other similar substances, as provided for under Section 5 of RA 10586, shall be penalized as follows: a. b. C. If the violation did not result in physical injuries or homicide, the penalty of three (3) months imprisonment, and a fine ranging from Twenty thousand pesos (Php 20,000.00) to Eighty thousand pesos (Php 80,000.00) shall be imposed; If the violation resulted in physical', 'fire truck, and other vehicles providing emergency assistance, in the course and scope of his or her duties. SEC. 7. Nationwide Public Information Campaign.  The DOTC-LTO, in coordination with the Philippine Information Agency (PIA), the Department of Education (DepEd), the Department of the Interior and Local Government (DILG), the Philippine National Police (PNP) and private agencies and organizations shall undertake a nationwide information, education and communication (IEC) campaign for a period of six (6) months from the effectivity of this Act. SEC. 8. Penalties.  Any person who shall violate any provision of this Act shall be penalized with: (a) A fine of five thousand pesos (P5,000.00) for the first offense; (b) A fine of ten thousand pesos (P10,000.00) for the second offense; (c) A fine of fifteen thousand pesos (P15,000.00) and', 'the increase or adjustment; and (d) The increases or adjustment shall only become effective fifteen (15) days after its publication in two (2) newspapers of general circulation. SEC. 8. Qualifying Circumstances.  If, in violation of the provisions of this Act, death shall have resulted or serious or less serious injuries shall have been inflicted upon the child or any other person, a penalty of one (1) year imprisonment shall be imposed upon the motorcycle rider or operator of the motorcycle involved without prejudice to the penalties provided under Act No. 3815, otherwise known as The Revised Penal Code of the Philippines, as amended. SEC. 9. Authority to Deputize Traffic Enforcers and Local Government Units (LGUs).  To effectively implement the provisions of this Act, the LTO is hereby given the authority to deputize members of the Philippine National Police (PNP), the Metropolitan Manila Development Authority (MMDA) and the LGUs to carry out enforcement functions and duties.', 'which the law attaches the capital punishment or penalties which in any of their periods are afflictive, in accordance with article 25 of this Code. Less grave felonies are those which the law punishes with penalties which in their maximum period are correctional, in accordance with the abovementioned article. Light felonies are those infractions of law for the commission of which the penalty of arresto menor or a fine not exceeding to 200 pesos or both, is provided. 68 Republic Act No. 11235 Use of a Motorcycle in the Commission of the Crime VIOLATION PENALTY If a motorcycle is used in the commission of a crime constituting a grave felony under the Revised Penal Code (owner, driver and backrider or passenger) Reclusion Temporal (12 yrs. and 1 day to 20 yrs.) to Reclusion Perpetua (imprisonment for at least 30 yrs.) If a motorcycle is used in the commission of a crime constituting a less grave felony', '41. How can you avoid wasting fuel? Through correct and proper driving habit Having the vehicle properly serviced and maintained 42. At an intersection, it is more dangerous to turn left than to turn right because _______________________. vehicles coming from opposite direction are faster 167 Nonprofessional  Motorcycle (A, A1) QUESTION ANSWER 43. What is one of the mandates of LTO? Register roadworthy and emission compliant motor vehicles 44. If the violation of the Republic Act No. 10666 on Safety of Children aboard Motorcycles resulted in death or serious or less serious injuries, what penalty will be imposed to the motorcycle rider or motorcycle operator? One (1) year imprisonment without prejudice provided for under Revised Penal Code of the Philippines 45. If this sign is disregarded, it will constitute an offense. Regulatory Sign Directional Sign (e.g., left lane must turn left, one-way sign)', 'physical injuries, the penalty provided in Article 263 of the Revised Penal Code or the penalty provided in the next preceding subparagraph, whichever is higher, and a fine ranging from One hundred thousand pesos (Php100,000.00) to Two hundred thousand pesos (Php200,000.00) shall be imposed; (c) If the violation of Section 5 resulted in homicide, the penalty provided in Article 249 of the Revised Penal Code and a fine ranging from Three hundred thousand pesos (Php300,000.00) to Five hundred thousand pesos (Php500,000.00) shall be imposed; and (d) The nonprofessional drivers license of any person found to have violated Section 5 of this Act shall also be confiscated and suspended for a period of twelve (12) months for the first conviction and perpetually revoked for the second conviction. The professional drivers license of any person found to have violated Section 5 of this Act shall also be confiscated and', '9 of 14 10/17/2025, 10:17 PM e. In front of a private driveway f. On the roadway side of any unmoving or parked MV at the curb or edge of the highway g. At any place where signs of prohibitions have been installed * Allowing passengers on top/cover of MV vehicle within such intersection or turning therein to the left across the line of travel of the first mentioned vehicle when such vehicle has given a plainly visible signal of intention to turn *Smoke belching [Section 46, R.A. 8749 (Philippine Clean Air Act of 1999)] - 3rd offense * Failure to dim headlights when approaching another motor vehicle * Failure to provide canvass cover to cargoes or freight of trucks requiring the same2/ * Axle Overloading (Violation of R.A. 8794) * Hitching or permitting a person or a bicycle, motorcycle, tricycle or skate roller to hitch to a motor vehicle increasing speed when being overtaken', ""month's suspension of the registration for each subsequent conviction. l. For violation of any provisions of this Act or regulations promulgated pursuant hereto, not hereinbefore specifically punished, a fine of not less than ten or more than fifty pesos shall be imposed. m. In the event an offender cannot pay any fine imposed pursuant to the provisions E-Library - Information At Your Fingertips: Printer Friendly https://elibrary.judiciary.gov.ph/thebookshelf/showdocsfriendly/2/26188 28 of 31 10/17/2025, 11:21 PM of this Act, he shall be made to undergo subsidiary imprisonment as provided for in the Revised Penal Code. n. If, as the result of negligence or reckless or unreasonable fast driving, any accident occurs resulting in death or injury of any person, the motor vehicle operator at fault shall, upon conviction, be punished under the provisions of the Revised Penal Code."", 'R.A. No. 4136 - Land Transportation and Traffic Code B. R.A. No. 8749 - Philippine Clean Air Act of 1999 C. R.A. No. 8750 - Seat Belts Use Act of 1999 D. R.A. No. 8794 - Motor Vehicle Users Charge Law E. R.A. No. 10586 - Anti-Drunk and Drugged Driving Act of 2013 F. R.A. No. 10913 - Anti-Distracted Driving Act G. R.A. No. 10916 - Road Speed Limiter Act of 2016 H. R.A. No. 10930 - Rationalizing and Strengthening the Policy Regarding Drivers License Amending Sec. 23 of R.A No. 4136 I. R.A. No. 11229 - Child Safety on Motor Vehicles Act 7) Traffic Violations, Fines and Penalties (JAO 2014-01) A. Violations in Connection with Licensing B. Violations in Connection with Motor Vehicle', ""44. Lien Upon Personal and Immovable Properties of Violators. - Fines and penalties imposed pursuant to this Act shall be liens upon personal and immovable properties of the violator. Such lien shall, in case of insolvency of the respondent violator, enjoy preference subsequent to laborer's wages under Articles 2241 and 2242 of Republic Act No. 386, otherwise known as the New Civil Code of the Philippines. CHAPTER6 FINES AND PENALTIES SEC. 45. Violation of Standards for Stationary Sources. - For actual exceedance of any pollution or air quality standards under this Act or its rules and regulations, the Department, through the Pollution Adjudication Board (PAB), shall impose a fine of not more than One hundred thousand pesos (P100,000) for every day of violation against the owner or operator of a stationary source until such time that the standards have been complied with. For purposes of the application of the fines, the PAB"", 'be punished with a fine of not less than Fifty thousand pesos (P50,000.00) but not more than One hundred thousand pesos (P100,000.00) for each and every child restraint system product manufactured, distributed, importer and/or sold, without prejudice to other penalties imposed under Republic Act No. 7394 or the ""Consumer Act of the Philippines"". E-Library - Information At Your Fingertips: Printer Friendly https://elibrary.judiciary.gov.ph/thebookshelf/showdocsfriendly/2/95785 3 of 6 10/17/2025, 11:06 PM (c) Any driver who allows the use of substandard and/or expired child restraint system or permits the use of child restraint system that does not bear the PS mark or the ICC sticker and certificate, shall be fined One thousand pesos (P1,000.00) for the first offense;', 'plus confiscation of the driver\'s license for the fourth and succeeding offenses. (b) Any seller and/or dealer who violates Section 5 of this Act shall be punished with a fine of not lees than Ten thousand pesos (Php10,000.00) but not more than Twenty thousand pesos (Php20,000.00). (c) Any person who uses, sells and distributes substandard motorcycle helmets or those which do not bear the PS mark or the ICC certificate shall be punished with a fine of not less than Three thousand pesos (Php3,000.00) for the first offense; and Five thousand pesos (Php5,000.00) for the second offense, without prejudice to other penalties imposed in Republic Act No. 7394 or the ""Consumer Act of the Philippines"". (d) Tampering, alteration, forgery and imitation of the PS mark and the ICC certificates in the helmets shall be', 'Code of the Philippines 45. If this sign is disregarded, it will constitute an offense. Regulatory Sign Directional Sign (e.g., left lane must turn left, one-way sign) 46. Why should the driver always yield to emergency vehicles with blinkers and sirens on? Because they have a priority right-of-way 47. The Right-Of -Way rule signifies: the rights of drivers on when to yield or give way to others while driving 48. When making a right turn, you should: reduce speed and stay on the outermost lane of the road then signal your intention to turn right 49. When approaching a crosswalk or pedestrian lane, you should: slow down and stop to yield to pedestrians 50. What should you do if you are stopped by an enforcer even when you believe that you did not violate any traffic rules and regulations? Stop at the roadside and politely ask the reason why you were being stopped 168 Nonprofessional  Light (B,', 'use of child restraint system that does not bear the PS mark or the ICC sticker and certificate, shall be fined One thousand pesos (P1,000.00) for the first offense; Three thousand pesos (P3,000.00) for the second offense; and Five thousand pesos (P5,000.00) and the suspension of the driver\'s license for a period of one (1) year for the third and succeeding offenses. (d) Tampering, alteration, forgery and imitation of the PS mark or the ICC stickers in the child restraint system shall be punished with a fine of not less than Fifty thousand pesos (P50,000.00) but not more than One hundred thousand pesos (P100,000.00), for each and every child restraint system product, without prejudice to other penalties imposed in Republic Act No. 7394 or the ""Consumer Act of the Philippines"": Provided, That the', 'of a second and subsequent offenses, the offender shall be prosecuted for violation of this Decree before the military tribunal and, upon conviction thereof, shall suffer the penalty of imprisonment for six months and/or a fine of 600 pesos. In addition, the certificate of registration of the motor vehicle on which the unauthorized gadget or device herein mentioned is installed, mounted or used shall be cancelled or revoked. The Commissioner of Land Transportation shall draw and promulgate such rules and regulations necessary to give effect to this Decree. Done in the City of Manila, this 13th day of January, in the year of Our Lord, nineteen hundred and seventy-three. The Lawphil Project - Arellano Law Foundation', 'heavy volume of vehicles; - there is a high density of fast moving vehicles; or - where a speed limit of more than 60/kph is imposed * Commission of a crime in the course of apprehension upon conviction by a regular court of competent jurisdiction * Colorum violation * Driving a motor vehicle while under the influence of alcohol, dangerous drugs and/or similar substance upon final conviction by a regular court of competent jurisdiction [Sec. 12 of R.A. No. 10586 (Anti-Drunk and Drugged * 2nd offense of Sec. 4 of R.A. 10913 (Anti-Distracted Driving Act) for acts in a motor vehicle in motion, or temporarily stopped at a traffic light or any intersection, whether diplomatic, public or private: * 1st offense of Sec. 4 of R.A. 10913 (Anti-Distracted Driving Act) for acts in a motor vehicle in motion, or temporarily stopped at a traffic light or any intersection, whether diplomatic, public or private:', '23-B. Penalties.- Without prejudice to the penalties provided under the Revised Penal Code and other applicable laws, the penalties corresponding to the following acts shall be imposed by the appropriate agency or officer: ""(a) Any officer who, in any manner, issues a driver\'s license without the necessary examinations, connives with the applicant for the irregular issuance of a license, or who, by gross negligence, issues a driver\'s license to an unqualified applicant shall suffer a penalty of removal from the service with all the accessory penalties attached thereto; E-Library - Information At Your Fingertips: Printer Friendly https://elibrary.judiciary.gov.ph/thebookshelf/showdocsfriendly/2/78456 2 of 5 10/17/2025, 10:21 PM ""(b) A fine in the amount of Twenty thousand pesos (P20,000.00) shall be imposed upon an applicant for', 'S. No. 3365; H. No. 4251; 109 OG No. 37, 6182 (September 16, 2013); Manila Bulletin; Philippine Star, June 6, 2013 [ REPUBLIC ACT NO. 10586, May 27, 2013 ] AN ACT PENALIZING PERSONS DRIVING UNDER THE INFLUENCE OF ALCOHOL, DANGEROUS DRUGS, AND SIMILAR SUBSTANCES, AND FOR OTHER PURPOSES Be it enacted by the Senate and House of Representatives of the Philippines in Congress assembled: SECTION 1. Short Title.  This Act shall be known as the Anti-Drunk and Drugged Driving Act of 2013?. SEC. 2. Declaration of Policy.  Pursuant to the Constitutional principle that recognizes the protection of life and property and the promotion of the general welfare as essential for the enjoyment of the blessing of democracy, it is hereby declared the policy of the State to ensure road safety through the observance of the citizenry of responsible and ethical driving standards. Towards this end, the State shall penalize the acts of driving under', 'vehicle while under the influence of alcohol, dangerous drugs and/or other similar substances shall be penalized as follows: If the violation did not result in physical injuries or homicide Twenty thousand pesos (Php 20,000.00) to Eighty thousand pesos (Php 80,000.00) fine and three (3) months imprisonment; If the violation resulted in physical injuries The penalty provided in Article 263 of the Revised Penal Code or the penalty provided in the next preceding paragraph whichever is higher and a fine of One Hundred Thousand (Php 100,000.00) to Two Hundred Thousand (Php 200,000.00) shall be imposed; If the violation has resulted in homicide A penalty provided in Article 249 of the Revised Penal Code and a fine ranging from Three Hundred Thousand (Php 300,000.00) to Five Hundred Thousand (Php 500,000.00) shall be imposed. FOR NON-PROFESSIONAL DRIVERS: 1st Conviction Confiscation and suspension of license for a period of 12', ""and a fine ranging from Twenty thousand pesos (Php 20,000.00) to Eighty thousand pesos (Php 80,000.00) shall be imposed; If the violation resulted in physical injuries, the penalty provided in Article 263 of the Revised Penal Code or the penalty provided in the next preceding subparagraph, whichever is higher, and a fine ranging from One hundred thousand pesos (Php 100,000.00) to Two hundred thousand pesos (Php 200,000.00) shall be imposed; If the violation resulted in homicide, the penalty provided in Article 249 of the Revised Penal Code and a fine ranging from Three hundred thousand pesos (Php 300,000.00) to Five hundred thousand pesos (Php 500,000.00) shall be imposed; and Implementing Rules and Regulations I RA 10586 10 d. The non-professional driver's license of any person found to have violated the law shall also be confiscated and suspended for a period of twelve"", ""prejudice to the penalties provided under the Revised Penal Code and other applicable laws, the penalties corresponding to the following acts shall be imposed by the appropriate agency or officer: a. Any officer who, in any manner, issues a driver's license without the necessary examination, connives with the applicant for the irregular issuance of a license, or who, by gross negligence, issues a driver's license, or who, by gross negligence, issues a E-Library - Information At Your Fingertips: Printer Friendly https://elibrary.judiciary.gov.ph/thebookshelf/showdocsfriendly/2/96764 5 of 14 10/17/2025, 10:17 PM driver's license to an unqualified applicant shall suffer a penalty of removal from the service with all the accessory penalties attached thereto; b. A fine in the amount of Twenty thousand pesos (P20,000.00) shall be imposed upon an"", 'of all the Armed Forces of the Philippines, do hereby order and decree: 1. That it shall be unlawful for the owner or possessor of any motor vehicle to use or attach to his vehicle any siren, bell, horn, whistle, or other similar gadgets that produce exceptionally loud or startling sound, including domelights, blinkers and other similar signalling or flashing devices. 2. The gadgets or devices mentioned above may be attached to and use only on motor vehicles designated for official use by the Armed Forces of the Philippines, National Bureau of Investigation, Land Transportation Commission, Police Departments, Fire Departments, and hospital ambulances. Any device or gadget installed or mounted on any motor vehicle or otherwise used in violation of this decree shall be subject to immediate confiscation and, in cases of a second and subsequent offenses, the offender shall be prosecuted for violation of this Decree before the military tribunal and, upon conviction thereof, shall suffer the penalty of imprisonment for six months and/or a', 'years. Provided, That in no case shall be increase be more than five percent (5%) of the fine sought to be increased. RULE V - RESPONSIBILITIES OF IMPLEMENTING AGENCIES Section 22. Repository of Records. - The Land Transportation Office shall serve as the central repository of all traffic violation records. Section 23. Reportorial Requirements. - In consonance with the preceding section, the local government units (LGUs), the Metropolitan Manila Development Authority (MMDA) or other agencies lawfully issuing traffic violation receipts shall upload the apprehension report online to the LTO facility to be developed for this purpose. In the meantime, the local government units (LGUs), the Metropolitan Manila Development E-Library - Information At Your Fingertips: Printer Friendly https://elibrary.judiciary.gov.ph/thebookshelf/showdocsfriendly/2/96764 6 of 14 10/17/2025, 10:17 PM Authority', 'use thereof, insanity, imbecility, impotence or blindness, or incapacity to work for more than ninety (90) days, the license of the offending driver shall be revoked for a period of four (4) years, after a finding by the court that such driver was negligent or at fault. ""The Department of Transportation (DOTr) and the LTO shall, in coordination with the Land Transportation Franchising and regulatory Board (LTFRB) and other concerned agencies and private stakeholders, aggressively and regularly conduct a nationwide information, education and communication (IEC) campaign on road safety, including the list of measures implemented pursuant to and violations punishable under this Act."" SEC. 5. Review of Penalties.- The secretary of the DOTr. upon the recommendation of the LTO, after due hearing and publication, shall have the power to increase or adjust the fine herein imposed once every five (5) years: Provided, That in no', ""penalty of removal from the service with all the accessory penalties attached thereto; b. A fine in the amount of Twenty thousand pesos (P20,000.00) shall be imposed upon an applicant for a driver's license found to have committed any of the following acts: 1. Willful misrepresentation with respect to material information in one's application; 2. Connivance with the officer in the irregular conduct of examination or issuance of license; 3. Falsification of documents; or 4. Cheating during examinations. Any or all the acts abovementioned shall be punished whether or not a license was granted by reason of such misrepresentation, connivance, and falsification or cheating. In addition to the abovementioned fine, the driver's license of erring applicant, if one is granted by reason of such misrepresentation, connivance, falsification or cheating, shall be revoked, and the applicant shall be"", 'or his passengers are in pursuit of a criminal; 6. A law-enforcement officer who is trying to overtake a violator of traffic laws; and 7. The driver officially operating a motor vehicle of any fire department, provided that exemption shall not be construed to allow useless or unnecessary fast driving of drivers afore-mentioned. SEC. 36. Speed limits uniform throughout the Philippines.No provincial, city or municipal authority shall enact or enforce any ordinance or resolution specifying maximum allowable speeds other than those provided in this Act. SEC. 37. Driving on right side of highway.Unless a different course of action is required in the interest of the safety and the security of life, person or property, or because of unreasonable difficulty of operation in compliance herewith, every person E-Library - Information At Your Fingertips: Printer Friendly https://elibrary.judiciary.gov.ph/thebookshelf/showdocsfriendly/2/26188', 'Act. The following shall be the basis in defining fine and penalty provisions of the IRR to be promulgated pursuant to Section 11 hereof, provided that six (6) months grace period shall be allowed to lapse to conduct a nationwide information campaign: (1) On the driver (a) For failure to wear the prescribed seat belt devices and/or failure to require his passengers to wear the prescribed seat belt device, a minimum fine of One hundred pesos (P100) but not to exceed One thousand pesos (P1,000) for the first E-Library - Information At Your Fingertips: Printer Friendly https://elibrary.judiciary.gov.ph/thebookshelf/showdocsfriendly/2/5294 3 of 5 10/17/2025, 11:20 PM violation; a minimum fine of Two hundred pesos (P200) but not to exceed Two thousand pesos (P2,000) for', 'black alphanumeric characters. c. Government Motorcycle - with white background and red alphanumeric characters. d. Diplomatic Motorcycle - with white background and blue alphanumeric characters. The number plates shall be kept clean and cared for, and shall be firmly affixed to the motorcycles. FINES and PENALTIES Failure to Register or to Report Sale or Disposition VIOLATION PENALTY Failure of the buyer to register the motorcycle to LTO within five (5) days from acquisition of ownership. Failure of the subsequent seller to notify the LTO within three (3) days from the sale of motorcycle Fine of P20,000.00 - P50,000.00 or, Arresto Mayor (1 month and 1 day to 6 months) to Prision Correccional (6 months and 1 day to 6 yrs.), or both Driving without a Number Plate or Readable Number Plate VIOLATION PENALTY Driving without a number plate or a readable number plate Fine of P50,000.00 -', '4 of R.A. 10913 (Anti- Distracted Driving Act) for acts in a motor vehicle in motion, or temporarily stopped at a traffic light or any intersection, whether diplomatic, public or private: - Using a mobile communications device to write, send, or read a text - based communication, or to make or receive calls, and other similar acts; and - Using an electronic entertainment or computing device to play games, watch movies, surf the internet, compose messages, read e-books, perform calculation, and other similar acts * Failure to wear the prescribed seat belt device (2nd offense) in violation of R.A. 8750 (Seat Belts Used Act of 1999) * Failure to wear the standard protective motorcycle helmet or failure to require the back rider to wear the standard protective motorcycle helmet, under R.A. 10054 (Motorcycle Helmet Act of 2009) - 2nd offense * Smoke belching [Section 46, R.A. 8749 (Philippine Clean Air Act of', 'as required by this Act. After December 31, 2019, the penal provisions regarding the use of bigger, readable and color-coded number plates as required under this Act shall take effect. SEC. 20. Repealing Clause. - All laws, decrees, orders, rules and regulations or other issuances or parts thereof inconsistent with the provisions of this Act are hereby repealed or modified accordingly. SEC. 21. Separability Clause. - If any portion or provision of this Act is declared unconstitutional, the remainder of this Act or any provision not affected thereby shall remain in force and in effect. SEC. 22. Effectivity. - This Act shall take effect the after fifteen (15) days following the completion of its publication either in the Official Gazette or in a newspaper of general circulation in the Philippines. Approved, (SGD.) GLORIA MACAPAGAL-ARROYO Speaker of the House of Representatives (SGD.) VICENTE C. SOTTO III President of the Senate This Act which', 'Number Plate. - If the number plate or readable number plate of a motorcycle is lost, damaged, or stolen, the owner of such motorcycle shall immediately report the same to the LTO and the PNP through the Joint PNP and LTO Operations and Control Center, and request a replacement number plate. Failure of the owner to report the same shall subject the owner to a fine of not less than Twenty thousand pesos (P20,000.00) but not more than Fifty thousand pesos (P50,000.00). However, if the lost, damaged, or stolen number plate or readable plate is used in the commission with an offense penalized under the Revised Penal Code or special penal laws, the failure of the owner to report within three (3) days that the motorcycle is lost, damaged, or stolen, shall subject the owner to a penalty of imprisonment of arresto mayor or prison correccional. SEC. 12. Erasing,', 'No. 4136 2. A yellow traffic light means: you must slow down and prepare to stop Disregarding the yellow traffic light will constitute beating the red light tantamount to reckless driving 3. You must check your vehicle thoroughly before making a long trip to: prevent the inconvenience of vehicle breakdown 4. What is the primary responsibility of a driver who has been involved in a road crash? Assess the situation and if possible, assist the injured person and call for help 5. What should you do before making a U-turn? Check for traffic behind and indicate intention with a left turn signal Give way to oncoming vehicles 6. The blind spot is the area to your right or left that you do not see on the side view mirror. What will you do before you reverse? Look around to see that the way is clear 7. After making a left turn at the intersection, you should: switch off the signal light and proceed to the proper lane with care 8. This is one', 'and Penalties for Violations of Other Provisions in the Act. - For violations of all other provisions provided in this Act and of the rules and regulations thereof, a fine of not less than Ten thousand pesos (P10,000) but not more than One hundred thousand pesos (P100,000) or six (6) months to six (6) years imprisonment or both shall be imposed. If the offender is a juridical person, the president, manager, directors, trustees, the pollution control officer or the officials directly in charge of the operations shall suffer the penalty herein provided. SEC. 48. Gross Violations. - In case of gross violation of this Act or its implementing rules and regulations, the PAB shall recommend to the proper government agencies to file the appropriate criminal charges against the violators. The PAB shall assist the public prosecutor in the litigation of the case. Gross violation shall mean: (a) three (3) E-Library - Information At Your Fingertips:', 'and not more than Six thousand pesos, (P6,000). Any violation of the provisions of Section 21 paragraph (d) with regard to national inspection and maintenance program, including technicians and facility compliance shall be penalized with a fine of not less than Thirty thousand pesos (P30,000) or cancellation of license of both the technician and the center, or both, as determined by the DTI. All law enforcement officials and deputized agents accredited to conduct vehicle emissions testing and apprehensions shall undergo a mandatory training on emission standards and regulations. For this purpose, the Department, together with the DOTC, DTI, DOST, Philippine National Police (PNP) and other concerned agencies and private entities shall design a training program. SEC. 47. Fines and Penalties for Violations of Other Provisions in the Act. - For violations of all other provisions provided in this Act and of the rules and regulations thereof, a fine of not less than Ten thousand pesos', 'Connivance with the officer in the irregular conduct of examinations or issuance of license; ""(3) Falsification of documents; or ""(4) Cheating during examinations. Any or all of the acts abovementioned shall be punished whether or not a license was granted by reason of such misrepresentation, connivance, falsification or cheating. In addition to the abovementioned fine, the driver\'s license of an erring applicant, if one is granted by reason of such misrepresentation, connivance, falsification or cheating shall be revoked, and the applicant shall be prohibited from applying for a period of two (2) years. The repetition of such offense shall warrant the perpetual disqualification from being granted a driver\'s license in addition to the fine above-stated; and A holder of a driver\'s license who acts in violation of the provisions of Republic Act No. 4136 and other existing traffic laws shall suffer corresponding penalties as may', 'any motor vehicle to determine whether such motor vehicle is registered, or is unsightly, unsafe, overloaded, improperly marked or equipped, or otherwise unfit to be operated because of possible excessive damage to highways, bridges and/or culverts. 7. The Philippine Constabulary and the city and municipal police forces are hereby given the authority and the primary responsibility and duty to prevent violations of this Act, and to carry out the police provisions hereof within their respective jurisdictions: Provided, That all apprehensions made shall be submitted for final disposition to the Commissioner and his deputies within twenty-four hours from the date of apprehension. 8. All cases involving violations of this Act shall be endorsed immediately by the apprehending officer to the Land Transportation Commission. Where such violations necessitate immediate action, the same shall be endorsed to the traffic court, city or municipal court for summary investigation, hearing and disposition, but in all such cases, appropriate notices of the apprehensions and the dispositions thereof']","Disregarding the yellow traffic light will constitute beating the red light tantamount to reckless driving. However, the specific penalty for beating the red light is not explicitly stated in the provided context.","The penalty is usually a Php1,000 fine for the first offense, with higher fines or possible suspension of the driver’s license for repeated offenses. It’s also considered reckless driving if done deliberately or dangerously.",1.0,0.0
When can a driver be issued a 10-year license?,"[""Except for the student-driver's permits, all drivers' licenses shall be valid for five (5) years reckoned from the birthdate of the licensee, unless sooner E-Library - Information At Your Fingertips: Printer Friendly https://elibrary.judiciary.gov.ph/thebookshelf/showdocsfriendly/2/96764 2 of 14 10/17/2025, 10:17 PM revoked or suspended. Provided, however, That subject to Section 26 of Republic Act No. 4136, as amended by Batas Pambansa Blg. 398, any holder of a professional or nonprofessional driver's license who has not committed any violation of Republic Act No. 4136 and other traffic laws, rules and regulations shall be entitled to a renewal of such license for ten (10) years. Section 7. Safeguards against Falsities and Forgeries. - In the issuance of"", '- Information At Your Fingertips: Printer Friendly https://elibrary.judiciary.gov.ph/thebookshelf/showdocsfriendly/2/78456 1 of 5 10/17/2025, 10:21 PM create an online process for the renewal of professional and nonprofessional licenses within one (1) year from the effectivity of this Act. ""Except for student permits, all drivers\' licenses shall be valid for five (5) years reckoned from the birthdate of the licensee, unless sooner revoked or suspended: Provided, however, That subject to Section 26 hereof, any holder of a professional or nonprofessional driver\'s license who has not committed any violation of Republic Act No. 4136 and other traffic laws, rules and regulations during the five (5)-year period shall be entitled to a renewal of such license for ten (10) years, subject to the restrictions as may be imposed', ""laws, rules and regulations shall be entitled to a renewal of such license for ten (10) years. Section 7. Safeguards against Falsities and Forgeries. - In the issuance of licenses, the LTO shall use such process or adopt such measures as will prevent any alteration or falsification of a license or will enable the LTO to detect any unauthorized license. RULE III - PREREQUISITES AND GUIDELINES FOR THE ISSUANCE OF DRIVER'S LICENSES Section 8. Establishment of Stricter Rules Before the Issuance of Driver's License. - Pursuant to Section 23-A of Republic Act No. 4136, as amended by Republic Act No. 10930, the Land Transportation Office shall promulgate prerequisites and guidelines to ensure that driver's licenses are issued only to deserving applicants with sufficient driving skills and knowledge on road safety and proper road courtesy. The conduct of theoretical and practical examinations, among others, shall be designed to sufficiently measure the competency"", ""invalid thereafter. Failure of the driver to settle his case within fifteen days from the date of apprehension will cause suspension and revocation of his license. E-Library - Information At Your Fingertips: Printer Friendly https://elibrary.judiciary.gov.ph/thebookshelf/showdocsfriendly/2/26188 17 of 31 10/17/2025, 11:21 PM SEC. 30. Student-driver's permit.Upon proper application and the payment of three pesos, the Commissioner or his deputy may issue student-driver's permits, valid for six months to persons not under eighteen years of age who desire to learn to operate motor vehicles. No application for driver's license shall be received unless the applicant has undergone instruction in the operation of motor vehicles for at least a month and has a valid student-driver's permit: Provided, however, That any person who has a license to operate motor vehicles in other countries may,"", ""driver may be held answerable while operating motor vehicles. SEC. 29. Confiscation of driver's licenses.Law enforce-met and peace officers duly designated by the Commissioner shall, in apprehending any driver for violations of this Act or of any regulations issued pursuant thereto, or of local traffic rules and regulations, confiscate the license of the driver concerned and issue a receipt prescribed and issued by the Commission therefor which shall authorize the driver to operate a motor vehicle for a period not exceeding seventy-two hours from the time and date of issue of said receipt. The period so fixed in the receipt shall not be extended, and shall become invalid thereafter. Failure of the driver to settle his case within fifteen days from the date of apprehension will cause suspension and revocation of his license. E-Library - Information At Your Fingertips: Printer Friendly"", 'is valid for five (5) years reckoned from the date of birth of the licensee, unless sooner revoked or suspended. A DL holder who has not committed any violation/s during the five (5) year period preceding its expiration is entitled to a renewal of such license valid for ten (10) years. 14 Qualifications and Documentary Requirements RENEWAL OF DRIVERS LICENSE Item Qualifications Requirements NPDL PDL PDL A, A1, B, B1, B2 C, CE, D, BE 1 Holder of DL Drivers License    2 Physically and Mentally Fit to drive Medical Certificate from Accredited Medical Clinic    3 No unsettled Traffic Violation    4 DL not renewed for more than two (2) years after the expiry date - Passed the Automated Theoretical Examination and Practical Driving Test    5 Completed the Driving Enhancement Program (DEP) prior to initial renewal of the five (5) year DL    6 Other Requirements: Duly accomplished APL Form    7 Foreigners - Valid Working Visa n/a   8 Completed training in the operation', '(CL) - A new CL is valid for five (5) years reckoned from the date of birth of the licensee, unless sooner revoked or suspended. A holder of CL who has not committed any violation/s during the five (5) year period preceding its expiration is entitled to renewal of such license valid for ten (10) years. - Renewal of CL after two (2) years from the expiry date shall require the holder to take and pass the written examination and pay the corresponding penalty in addition to the basic fee. 4 Permits and Licenses DRIVERS LICENSE (DL) An authority in the form prescribed by the LTO granted to a person to operate motor vehicle that is either nonprofessional or professional drivers license. NONPROFESSIONAL DL (NPDL)  an authority in the form prescribed by the LTO granted to a person to operate a private motor vehicle. PROFESSIONAL DL (PDL)  an authority in the form prescribed by the LTO granted to', ""payment of the fee prescribed in accordance with law but prior to the issuance of said license, the applicant shall present himself/herself in person and have his/her photograph taken by the LTO. All driver's licenses issued shall be signed in the presence of the PTO head or his/her deputies and shall bear, among others, the full name, date of birth, height, weight, sex, color of eyes, blood type, complete current address, biometrics, license number, and its date of issue and expiration. Section 5. Prescribed Fees. - The LTO shall collect reasonable fees to cover the cost and expenses of regulation. However, such fees shall not cost more than the government's procurement expense. Section 6. Validity of Driver's License. - Except for the student-driver's permits, all drivers' licenses shall be valid for five (5) years reckoned from the birthdate of the licensee, unless sooner E-Library -"", 'penalty within fifteen (15) days from the date of apprehension shall cause automatic suspension of his drivers license for a period of thirty (30) days from the date of apprehension, in addition to the fines and penalties prescribed hereunder. The LTO shall resolve a contested case within five (5) days from receipt of said written contest. The imposition of the fines and penalties shall be without prejudice to any criminal action that may be instituted under existing laws, rules and regulations. VIOLATIONS IN CONNECTION WITH LICENSING A. DRIVING WITHOUT A VALID DRIVERS LICENSE / CONDUCTORS PERMIT This includes driving within an expired, revoked, suspended, inappropriate drivers license restriction code, inappropriate drivers license classification, fake drivers license, tourist driving a motor vehicle with a valid foreign driving license beyond the 90-day maximum allowable period and a student driver driving without being accompanied by a duly licensed driver. Php 3,000.00 In addition, the unlicensed or improperly licensed driver shall be disqualified from being granted a drivers license and driving', 'the atmosphere and weather, or so to endanger the property of the safety or rights of any person or so as to cause excessive or unreasonable damage to the highway. This includes driving with an improperly registered motor vehicle or a motor vehicle with expired, revoked, suspended, or invalid registration, unregistered of fake substitute or replacement engine, engine block or chassis. F. SUBMISSION OF FAKE DOCUMENTS IN RELATION TO THE APPLICATION FOR A DRIVERS LICENSE (NEW/RENEWAL) Anti-Drunk and Drugged Driving Act of 2013 First offense Php 2,000.00 Second offense Php 3,000.00 Subsequent offense Php10,000.00 In addition, the drivers license shall be suspended for a period of three (3) months for the second offense and six (6) months for the third offense from payment of fine and revocation of drivers license on the succeeding offense. A revoked non-professional driver shall be disqualified from being granted a drivers license for a period of two (2) years counted from', ""Information, Education and Communication Campaign. - The Department of Transportation (DOTr) and the LTO shall, in coordination with the Land Transportation Franchising and Regulatory Board (LTFRB) and other concerned agencies and private stakeholders, aggressively and regularly conduct a nationwide information, education and communication (IEC) campaign on road safety, including the list of measures implemented pursuant to and violations punishable under Republic Act No. 4136 and other existing traffic laws. Section 26. Research and Development. - The LTO shall conduct continuing research and development to ensure the efficient administration of the driver's licensing system. RULE VI - TRANSITORY AND FINAL PROVISIONS Section 27. Transitory Provisions. - After the effectivity of this IRR, all driver's licenses with a validity of three (3) years shall be entitled to a renewal valid for five (5) years. All holders of driver's licenses with 5-year validity shall undergo comprehensive driver's education on road safety and proper road courtesy"", 'to be released by a regular court of competent jurisdiction after payment of appropriate fines and penalties. Php 10,000.00 In addition, the drivers license shall be confiscated, and revoked upon conviction for the crime. The driver shall be disqualified from being granted a drivers license for a period of 5 years counted from the date of payment of appropriate fines and penalties The motor vehicle driven by the violator shall likewise be impounded until ordered to be released by a regular court of competent jurisdiction after payment of appropriate fines and penalties. 74 D. Refer to R.A. No. 10586 E. RECKLESS DRIVING No person shall operate a motor vehicle on any highway recklessly or without reasonable caution considering the width, traffic, grades, crossing, curvatures, visibility and other conditions of the highway and the conditions of the atmosphere and weather, or so to endanger the property of the safety or rights of any person or so as to cause excessive or unreasonable damage to the highway. This includes driving with an improperly', 'the abovementioned fine, the driver\'s license of an erring applicant, if one is granted by reason of such misrepresentation, connivance, falsification or cheating, shall be revoked, and the applicant shall be prohibited from applying for a period of two (2) years. The repetition as such offense shall warrant the perpetual disqualification from being granted a driver\'s license in addition to the fine above-stated; and ""(c) A holder of a driver\'s license who acts in violation of the provisions of Republic Act No. 4136 and other existing traffic laws shall suffer corresponding penalties as may be provided by law and other issuances. ""In case of death or physical injuries resulting in the loss of any part of the victim\'s body or the use thereof, insanity, imbecility, impotence or blindness, or incapacity to work for more than ninety (90) days, the license of the offending driver shall be', ""the fee prescribed in accordance with law but prior to the issuance of said license. The applicant shall present himself/herself in person and have his/her photograph taken by the LTO. All drivers licenses issued shall be signed in the presence of the LTO Head or his/her deputies and shall bear, among others, the full name, date of birth, height, weight, sex, color of eyes, blood type, complete current address, biometrics, license number, and its date of issue and expiration. 56 Republic Act No. 10930 All drivers' licenses shall be valid for five (5) years reckoned from the birthdate of the licensee, unless sooner revoked or suspended However, any holder of a professional or nonprofessional driver's license who has not committed any violation of Republic Act No. 4136 and other traffic laws, rules and regulations shall be entitled to a renewal of such license for ten (10) years. The LTO shall"", 'driver driving without being accompanied by a duly licensed driver. Php 3,000.00 In addition, the unlicensed or improperly licensed driver shall be disqualified from being granted a drivers license and driving a motor vehicle for a period of one (1) year from the payment of the fine. 73 B. DRIVING A MOTOR VEHICLE USED IN THE COMMISSION OF A CRIME UPON CONVICTION BY A REGULAR COURT OF COMPETENT JURISDICTION C. COMMISSION OF A CRIME IN THE COURSE OF APPREHENSION UPON CONVICTION BY A REGULAR COURT OF COMPETENT JURISDICTION Php 10,000.00 In addition, the drivers license shall be confiscated and upon conviction for the crime, revoked and the driver shall be perpetually disqualified from being granted a drivers license and driving a motor vehicle. The motor vehicle driven by the violator shall likewise be impounded until ordered to be released by a regular court of competent jurisdiction after payment of appropriate fines and penalties. Php 10,000.00 In addition, the drivers license shall be confiscated, and revoked upon conviction for the', ""and Implementing Rules and Regulations I RA 10586 10 d. The non-professional driver's license of any person found to have violated the law shall also be confiscated and suspended for a period of twelve (12) months for the first conviction and perpetually revoked for the second conviction. The professional driver's license shall also be confiscated and perpetually revoked for the first conviction. The perpetual revocation of a driver's license shall disqualify the person from being granted any kind of driver's license thereafter. Section 2. The prosecution for any violation of this Act shall be without prejudice to criminal prosecution for violation of the Revised Penal Code, Republic Act No. 9165 and other special laws and existing local ordinances, whenever applicable. Section 3. Direct Liability of Operator and/or Owner of the Offending Vehicle The owner and/or operator of the motor vehicle driven by the offender shall be directly and principally held liable together with the offender for the fine and the award against the offender"", ""suspension of driver's license for three (3) months, for the third offense; and d. A fine of twenty thousand pesos (P20,000.00) for the fourth offense and succeeding offenses, and revocation of driver's license. Provided, that a driver of a public utility vehicle, a school bus, a school service vehicle, a common carrier hauling volatile, flammable or toxic material, or a driver who commits an act classified herein as distracted driving within a fifty (50)-meter radius from the school premises shall be subject to a penalty of thirty thousand pesos (P30,000.00) and suspension of one's driver's license for three (3) months. Provided, that the implementation of Section 8(c) hereof, an offender operating a conveyance or machinery which do not require a driver's license, the penalty shall be impoundment of the conveyance or machinery in lieu of the"", 'the desired type of motor vehicle. VALIDITY OF STUDENT-DRIVERS PERMIT (SP) - The SP is valid for one (1) year from the date of its issuance. After one (1) year, it cannot be used for purposes of the practical driving course. However, it can be used to apply for NPDL if the practical driving course has been completed within the one (1) year validity period. - After two (2) years from the date of issuance of SP, the holder is required to acquire a new SP bearing the same SP number and undergo the required apprenticeship period reckoned from the date of issuance of the new SP. All records of training courses are retained. - SP may be renewed on or before the expiry date if the holder is not ready to apply for DL. Except for settlement of penalties due to traffic violations, only the basic fee is to be collected for the renewal of SP after the expiry date. The holder must be accompanied by', ""payment of fine and revocation of drivers license on the succeeding offense. A revoked non-professional driver shall be disqualified from being granted a drivers license for a period of two (2) years counted from date of revocation. A revoked professional driver shall be perpetually disqualified from getting any drivers license. Php 3,000.00 In addition, the drivers license shall be put on alarm, revoked and the driver shall be disqualified from being granted a drivers license and driving a motor vehicle for a period of one (1) year from the payment of the fine without prejudice to the filing of appropriate criminal charges. 75 G. Refer to R.A. No. 8750 H. Refer to R.A No. 10054 I. FAILURE TO CARRY DRIVER'S LICENSE, CERTIFICATE OF REGISTRATION OR OFFICIAL RECEIPT WHILE DRIVING A MOTOR VEHICLE J. ALL OTHER VIOLATIONS OF TRAFFIC RULES AND REGULATIONS Seat Belts Use Act of 1999 Motorcycle Helmet Act of 2009 Php 1,000.00 Php 1,000.00 This"", ""operation of motor vehicles for at least a month and has a valid student-driver's permit: Provided, however, That any person who has a license to operate motor vehicles in other countries may, upon presentation of appropriate evidence of such license, be allowed to pay for a driver's license without presenting a student driver's permit. A student driver who fails in the examination shall continue as a student driver for at least one additional month. No student driver shall operate a motor vehicle unless accompanied by a duly licensed driver. The licensed driver acting as instructor to the student driver shall likewise be responsible and liable for any violation of the provisions of this Act and for any injury or damage done by the motor vehicle on account or as a result of its operation by a student driver under his direction. ARTICLE II.Illegal Use of Licenses, Number Plates, Etc. SEC. 31. Imitation and false representations.No person shall make or use or attempt to make or use a driver's license, badge,"", ""issuance of said license, the applicant shall furnish three copies of his recent photograph to be securely attached to the license, and two copies to be filed and kept as provided by this Act. All driver's licenses shall bear the signature and right-hand thumb print of the licensee. SEC. 24. Use of driver's license and badge.Every license issued under the provisions of this Act to any driver shall entitle the holder thereof, while the same is valid and effective and not suspended or revoked, to operate the motor vehicles described in such license: Provided, however, That every licensed professional driver, before operating: a public service motor vehicle registered under classifications (d) to (j) inclusive of Section seven hereof, shall secure from the Commissioner, upon payment of the sum of one peso, a driver's badge which he shall, at all times while so operating a motor vehicle, display in plain sight on the band of his cap or on his coat or"", ""five pesos, and shall contain such information respecting the applicant and his ability to operate motor vehicles, as may be required by the Commission. The Commissioner or his deputies shall also ascertain that the applicant's sight and hearing are normal, and may in their discretion, require a certificate to that effect, signed by a reputable physician. An examination or demonstration to show any applicant's ability to operate motor vehicles may also be required in the discretion of the Commissioner or his deputies. SEC. 23. Issuance of driver's license.If, after such examination, the Commissioner or his deputy believes that the applicant possesses the necessary qualifications and is proficient in the operation of motor vehicles, a license shall be issued to such applicant upon payment of five pesos, but prior to the issuance of said license, the applicant shall furnish three copies of his recent photograph to be securely attached to the license, and two copies to be filed and kept as provided by this Act. All"", ""be firmly affixed to the motor vehicle in such a manner as will make it entirely visible and always legible. Except in the case of dealer's number plates which may be used successively on various motor vehicles in stock, no person shall transfer number plates from one motor vehicle to another. No dealer's number plate shall be used on any motor vehicle after said vehicle has been sold and delivered to a purchaser, and no dealer shall allow such dealer's number plates to be used on any motor vehicle after its sale and delivery to a purchaser. CHAPTER III.OPERATION OF MOTOR VEHICLES ARTICLE I.License to Drive Motor Vehicles SEC. 19. Duty to procure license.Except as otherwise specifically provided in this Act, no person shall operate any motor vehicle without first procuring a license drive a motor vehicle for the current year, nor while such license is delinquent, invalid, suspended or revoked. The license shall be carried by the driver at all times when operating a motor"", ""license of erring applicant, if one is granted by reason of such misrepresentation, connivance, falsification or cheating, shall be revoked, and the applicant shall be prohibited from applying for a period of two (2) years. The repetition of such offense shall warrant the perpetual disqualification from being granted driver's license in addition to the fine above-stated; and c. A holder of the driver's license who acts in violation of the provisions of Republic Act No. 4136 and other existing traffic laws shall suffer corresponding penalties as may be provided by law and other issuances. In case of death or physical injuries resulting in the loss of any part of the victim's body or the use thereof, insanity, imbecility, impotence or blindness, or incapacity to work for more than ninety (90) days, the license of the offending driver shall be revoked for a period of four (4) years, after a finding by"", ""hereof, an offender operating a conveyance or machinery which do not require a driver's license, the penalty shall be impoundment of the conveyance or machinery in lieu of the confiscation of the driver's license. Provided, further, that in the event the fine imposed is not settled within six (6) months from the date of apprehension, the implementing agency shall exhaust all available legal remedies to implement this Section. The foregoing penalties shall be imposed without prejudice to other liabilities under the Revised Penal Code or any special law, arising out or on occasion of the herein prohibited acts. The implementing agency may increase the amount of fine herein imposed once every five (5) years in the amount not exceeding ten percent (10%) of the existing rates sought to be increased which shall take effect only upon publication in at least two (2) newspapers of general circulation. Section 9. Liability of Owner and/or Operator of the Vehicle Driven by the Offender"", 'of twelve (12) months for the first conviction and perpetually revoked for the second conviction. The professional drivers license of any person found to have violated Section 5 of this Act shall also be confiscated and perpetually revoked for the first conviction. The perpetual revocation of a drivers license shall disqualify the person from being granted any kind of drivers license thereafter. The prosecution for any violation of this Act shall be without prejudice to criminal prosecution for violation of the Revised Penal Code, Republic Act No. 9165 and other special laws and existing local ordinances, whenever applicable. SEC. 13. Direct Liability of Operator and/or Owner of the Offending Vehicle.  The owner and/or operator of the vehicle driven by the offender shall be directly and principally held liable together with the offender for the fine and the award against the offender for civil damages unless he or she is able to convincingly prove that he or she has exercised extraordinary diligence in the selection and supervision of his or her drivers in', ""immediately inform the said tourist or transient in writing that he shall no longer be permitted to operate a motor vehicle. After ninety days, any tourist or transient desiring to operate motor vehicles shall pay fees and obtain and carry a license as hereinafter provided. SEC. 22. Driver's license, fees, examination.Every person who desires personally to operate any motor vehicle shall file an application to the Commissioner or his deputies for a license to drive motors vehicles: Provided, however, That no person shall be issued a professional driver's license who is suffering from highly contagious diseases, such as, advanced tuberculosis, gonorrhea, syphilis, and the like. Each such application except in the case of enlisted men operating government owned vehicles, shall be accompanied by a fee of five pesos, and shall contain such information respecting the applicant and his ability to operate motor vehicles, as may be required by the Commission. The Commissioner or his deputies shall also ascertain that the"", 'A, A1, B, B1, B2 1 At least 17 years old Valid SP  Parental or guardians consent (with valid government ID with photo and signature) if applicant is 17 years old  Foreigners At least 18 years old Valid SP  2 Able to read and write in Filipino, English or any major dialect  3 SP holder for at least one (1) month Valid SP  4 Attended and passed the practical driving course (PDC) from LTO accredited instructor, LTO Drivers Education Center or LTO accredited Driving School/LTO Accredited TESDA Training Center  5 Physically and Mentally Fit to drive Medical Certificate from Accredited Medical Clinic  6 No unsettled Traffic Violation  7 Passed the Automated Theoretical Examination  8 Passed the Practical Driving Test  9 Other Requirements: TIN, if employed  10 Duly accomplished APL Form  A new DL is valid for five (5) years reckoned from the date of birth of the licensee, unless sooner revoked or suspended. A DL holder who has not committed any violation/s during the five', ""violation is committed for at least three (3) times during the validity of the driver's license. Provided, further, That in addition to the foregoing reorientation course, a public utility vehicle driver who has committed any franchise-related violation shall undergo the training seminar conducted by the PUV Driver's Academy of the LTFRB. Failure of the driver to complete the said intervention program within thirty (30) days from the date of the last apprehension shall cause the suspension of the driver's license upon prior notice until the required attendance to the course is complied with. Section 16. Outright Revocation. - Without prejudice to the authority of the court in appropriate cases and except as otherwise provided in Republic Act No. 4136 as amended and other laws and issuances, the driver's license of a person who has accumulated at least forty (40) demerit points, even if confiscated by, and/or in the possession of, any other law enforcement agencies, shall"", ""for hire and used to carry or transport passengers or goods. RULE II - GENERAL PROVISIONS Section 1. Driver's Education Every applicant of a motor vehicle driver's license shall complete a course of instruction that provides information on safe driving including, but not limited to, the effects of the consumption of alcoholic beverages on the ability of a person to operate a motor vehicle, the hazards of driving under the influence of alcohol, dangerous drugs and/or other similar substances, and the penalties attached for violation thereof. Modules for driver's education shall include modules on effects and hazards of consumption of alcohol and drugs to driving, and the penalties for violating this Act. Questions from these modules will also be included in the written examination for driver's license application. a. For professional drivers, every applicant for a driver's license or those applying for renewal thereof shall undergo the driver's education herein stated. b. The training course for all applicants of driver's license, whether new or renewal, shall"", ""sum of one peso, a driver's badge which he shall, at all times while so operating a motor vehicle, display in plain sight on the band of his cap or on his coat or shirt. Such driver's badge shall be of metal with a plainly readable number assigned to the licensee stamped thereon. It shall be unlawful for any duly licensed driver to transfer, lend or otherwise allow any person to use license for the purpose of enabling such person to operate a motor E-Library - Information At Your Fingertips: Printer Friendly https://elibrary.judiciary.gov.ph/thebookshelf/showdocsfriendly/2/26188 15 of 31 10/17/2025, 11:21 PM vehicle. No owner of a motor vehicle shall engage, employ, or hire any person to operate such motor vehicle, unless the person sought to be employed is a duly licensed professional driver. SEC. 25. Driver's"", ""upon the recommendation of the LTO, after due hearing and publication, shall have the power to increase or adjust the fine herein imposed once every five (5) years: Provided, That in no case shall the increase be more than five percent (5%) of the fine sought to be increased. E-Library - Information At Your Fingertips: Printer Friendly https://elibrary.judiciary.gov.ph/thebookshelf/showdocsfriendly/2/78456 3 of 5 10/17/2025, 10:21 PM SEC. 6. Research and Development.- The LTO shall conduct continuing research and development to ensure the efficient administration of the driver's licensing system. SEC. 7. Implementing Rules and Regulations.- Within sixty (60) days from the effectivity of this Act, the Secretary of the DOTr, with the assistance of the LTO, the LTFRB, and the MMDA, shall"", ""him whenever he has reason to believe that the holder thereof is an improper person to operate motor vehicles, or in operating or using a motor vehicle in, or as an accessory to, the commission of any crime or act which endangers the public. Any deputy of the Commissioner may, for the same cause, suspend for a period not exceeding three months any E-Library - Information At Your Fingertips: Printer Friendly https://elibrary.judiciary.gov.ph/thebookshelf/showdocsfriendly/2/26188 16 of 31 10/17/2025, 11:21 PM driver's license issued under the provisions of this Act: Provided, That such suspension may be appealed to the Commissioner who may, after reviewing the case, confirm, reverse or modify the action taken by such deputy. b. Whenever during any twelve-month period a driver shall have been convicted at least three times for the violations of any provisions of this Act or of"", ""LICENSE BY EXTENDING THE VALIDITY PERIOD OF DRIVERS LICENSES, AND PENALIZING ACTS IN VIOLATION OF ITS ISSUANCE AND APPLICATION, AMENDING FOR THOSE PURPOSES SECTION 23 OF REPUBLIC ACT NO. 4136, AS AMENDED BY BATAS PAMBANSA BLG. 398 AND EXECUTIVE ORDER NO. 1011, OTHERWISE KNOWN AS THE LAND TRANSPORTATION AND TRAFFIC CODE ISSUANCE OF DRIVER'S LICENSE, FEES AND VALIDITY The Land Transportation Office (LTO) Head or his/her deputies find that the applicant possesses the necessary qualifications and proficiency in the operation of motor vehicles, is able to read and write any of the official languages or a major dialect and knows how to read and interpret various traffic signs, signals and road markings, a professional or nonprofessional license may be issued to such applicant upon payment of the fee prescribed in accordance with law but prior to the issuance of said license. The applicant shall present himself/herself in person and have his/her photograph taken by the LTO. All drivers"", ""a period of not less than one year nor more than three years: Provided, however, That upon written application to the Commissioner for release from such a bond, the Commissioner may after revoking or suspending the driver's license, authorize the release of the bondsmen from further responsibility thereunder: Provided, further, That should the Commissioner decide not to revoke the license of a driver who has been convicted of homicide through reckless imprudence, or of the violation of the speed limit or of reckless driving at least three times within a twelve-month period, the said driver shall post a bond in the sum of not less than two thousand pesos, conditioned upon the payment of any claim which may be filed or any execution which may be issued against him in any case wherein said driver may be held answerable while operating motor vehicles. SEC. 29. Confiscation of driver's licenses.Law enforce-met and peace officers duly designated by the Commissioner shall, in"", 'capability to bear and showcase a readable number plate required under section 5 of this IRR. Owners of existing motorcycle units which do not have space for front plate are required to provide a bracket or any other provision where the same shall be installed. 71  Violations in Connection with Licensing  Violations in Connection with Motor Vehicle Registration / Renewal / Operation  Violations in Connection with Dimensions, Specifications, Weight and Load Limits  Violations in Connection with Franchise 72 Chapter III Fines and Penalties for Violations of Laws, Rules and Regulations Governing Land Transportation TEMPORARY OPERATORS PERMIT (TOP) Serves as a permit to operate a motor vehicle for a period of seventy- two (72) hours only. All apprehensions are deemed admitted unless contested by filling a written contest within five (5) days from date of apprehension. Failure of the driver to pay the corresponding penalty within fifteen (15) days from the date of apprehension shall cause automatic suspension of his drivers license for a period of thirty (30) days from the date of apprehension, in addition to the fines', ""period shall be required to complete a driver's reorientation course to be conducted by LTO or a duly accredited service provider. Subject to the examination requirement under Section 26 of Republic Act No. 4136, a driver who shall accumulate ten (10) or more total demerit points shall, in addition to the completion of the driver's reorientation course, be required to pass the theoretical examination before he/she may be allowed to renew his/her driver's license. Section 15. Intervention Program. - The driver, after notification from the LTO, shall be required to undergo a mandatory driver's reorientation course to be conducted by the Land Transportation Office or a duly accredited service provider for every ten (10) accumulated demerit points or whenever the same violation is committed for at least three (3) times during the validity of the driver's license. Provided, further, That in addition to the foregoing reorientation course, a public utility"", 'reverse or modify the action taken by such deputy. b. Whenever during any twelve-month period a driver shall have been convicted at least three times for the violations of any provisions of this Act or of any regulation issued by the Commissioner or any municipal or city ordinance relating to motor vehicle traffic not in, conflict with any of the provisions of this Act, the Com-missioner may, in his discretion, revoke or suspend the license of such driver for a period not exceeding two years. c. The license suspended or revoked under the provisions of subsections (a) and (b) of this section shall not be reinstated unless the driver has furnished a bond in accordance with Section twenty-nine of this Act and only after the Commissioner has satisfied himself that such driver may again safely be permitted to operate a motor vehicle. d. A decision of the Commissioner revoking or refusing the reinstatement of a license under the provisions of this Section may be appealed to the Secretary of Public Works and', 'ensure that drivers licenses are issued only to deserving applicants with sufficient driving skills and knowledge on road safety and proper road courtesy. The conduct of theoretical and practical examinations, among others, must sufficiently measure the competency of drivers and must be designed to the type of license applied for its corresponding restrictions: Provided. That for professional drivers, the tests must be appropriated the vehicle and type of service the applicant intends to operate."" 57 Republic Act No. 10930 FINES and PENALTIES A. APPLICANT A fine in the amount of Twenty thousand pesos (P20,000.00) shall be imposed upon an applicant for a driver\'s license found to have committed any of the following acts: ""(1) Willful misrepresentation with respect to material information in one\'s application; ""(2) Connivance with the officer in the irregular conduct of examinations or issuance of license; ""(3) Falsification of documents; or ""(4) Cheating during examinations. Any', 'other traffic laws, rules and regulations during the five (5)-year period shall be entitled to a renewal of such license for ten (10) years, subject to the restrictions as may be imposed by the LTO. ""The local government units (LGUs), the Metropolitan Manila Development Authority (MMDA) or other agencies lawfully issuing traffic violation receipts shall report within a reasonable time, to be determined in the implementing rules and regulations (IRR), the details of the traffic violation to the LTO, which shall serve as the repository of all traffic violation records."" SEC. 3. A new section is hereby added after Section 23 of the same Act and numbered as Section 23-A, to read as follows: ""SEC. 23-A. Establishment of Stricter Rules Before the Issuance of Driver\'s License.- The LTO shall promulgate prerequisites and guidelines before the grant of driver\'s licenses to ensure that these are issued only']","A driver can be issued a 10-year license if they have not committed any violation of Republic Act No. 4136 and other traffic laws, rules, and regulations during the five (5)-year period.",Drivers who have not committed any traffic violation during the validity of their 5-year license are eligible to renew for a 10-year license. This law encourages safe driving behavior and compliance with traffic rules.,1.0,0.9209034974074123
When is it illegal to carry a child on a motorcycle?,"['It shall be unlawful for any person to drive a two (2)-wheeled motorcycle with a child on board on public roads where there is heavy volume of vehicles, there is a high density of fast moving vehicles or where a speed limit of more than 60/kph is imposed, unless: (a) The child passenger can comfortably reach his/her feet on the standard foot peg of the motorcycle; E-Library - Information At Your Fingertips: Printer Friendly https://elibrary.judiciary.gov.ph/thebookshelf/showdocsfriendly/2/63318 1 of 3 10/17/2025, 10:59 PM (b) The childs arms can reach around and grasp the waist of the motorcycle rider; and (c) The child is wearing a standard protective helmet referred to under Republic Act No. 10054, otherwise known the Motorcycle Helmet Act of 2009. SEC. 5. Exception.  Notwithstanding the prohibition provided in the preceding', ""Law); and l. Temporary Operators Permit (TOP) refers to the citation ticket issued by an authorized LTO. RULE II  PROHIBITION Section 3. Prohibition It shall be unlawful for any person to drive a two (2)-wheeled motorcycle with a child on board on public roads where there is heavy volume of vehicles, there is a high density of fast moving vehicles or where a speed limit of more than 60/kph is imposed, unless: a. The child passenger can comfortable reach his/her feet on the standard foot peg of the motorcycle; b. The child's arm can reach around and grasp the waist of the motorcycle rider; and c. The child is wearing a standard protective helmet referred to under Republic Act No. 10054, otherwise known as the Motorcycle Helmet Act of 2009, and other protective gears as required by Section 4. Exception Notwithstanding the prohibition provided in the preceding section, this Act shall not apply to cases where the child to be transported requires immediate medical attention. RULE"", 'to Five Hundred Thousand (Php 500,000.00) shall be imposed. FOR NON-PROFESSIONAL DRIVERS: 1st Conviction Confiscation and suspension of license for a period of 12 months. 2nd Conviction Revocation of license. FOR PROFESSIONAL DRIVERS: 1st Conviction Confiscation and perpetual revocation of license. 46 REPUBLIC ACT NO. 10666 CHILDRENS SAFETY ON MOTORCYCLES ACT OF 2015 AN ACT PROVIDING FOR THE SAFETY OF CHILDREN ABOARD MOTORCYLES It is the policy of the State to defend the right of children to assistance, including proper care and nutrition, and special protection from all forms of neglect, abuse, cruelty, exploitation, and other conditions prejudicial to their development. Towards this end, the State shall pursue a more proactive and preventive approach to secure the safety of passengers, especially children, by regulating the operation of motorcycles along roads and highways. PROHIBITION It shall be unlawful for any person to drive a two (2)-wheeled motorcycle with a child on board on public', 'especially children, by regulating the operation of motorcycles along roads and highways. PROHIBITION It shall be unlawful for any person to drive a two (2)-wheeled motorcycle with a child on board on public roads where there is heavy volume of vehicles, there is a high density of fast-moving vehicles or where a speed limit of more than 60/kph is imposed, unless: (a) The child passenger can comfortably reach his/her feet on the standard foot peg of the motorcycle; (b) The childs arms can reach around and grasp the waist of the motorcycle rider; and (c) The child is wearing a standard protective helmet referred to under Republic Act No. 10054, otherwise known as the ""Motorcycle Helmet Act of 2009."" 47 Republic Act No. 10666 EXEMPTIONS FINES and PENALTIES First Offense - Three Thousand Pesos (Php 3,000.00) Second Offense - Five Thousand Pesos (Php 5,000.00) Third Offense - Ten Thousand Pesos', ""and other protective gears as required by Section 4. Exception Notwithstanding the prohibition provided in the preceding section, this Act shall not apply to cases where the child to be transported requires immediate medical attention. RULE III  ENFORCEMENT AND ADJUDICATION E-Library - Information At Your Fingertips: Printer Friendly https://elibrary.judiciary.gov.ph/thebookshelf/showdocsfriendly/2/98410 2 of 5 10/17/2025, 10:59 PM Section 5. LTO Law Enforcement Officer (LEO) shall have the authority to flag down a two (2)-wheeled motorcycle with a child on board on public roads where there is heavy volume, there is a high density of fast moving vehicles or where a speed limit of more than 60/khp is imposed. Section 6. The rider, upon lawful demand by the LTO Leo, shall surrender his/her driver's license and present the Certificate of Registration (CR) and current"", 'The child is wearing a standard protective helmet referred to under Republic Act No. 10054, otherwise known the Motorcycle Helmet Act of 2009. SEC. 5. Exception.  Notwithstanding the prohibition provided in the preceding section, this Act shall not apply to cases where the child to be transported requires immediate medical attention. SEC. 6. Penalties.  Any person who operates a motorcycle in violation of Section 4 of this Act shall be fined with an amount of three thousand pesos (P3,000.00) for the first offense; five thousand pesos (P5,000.00) for the second offense; and ten thousand pesos (P10,000.00) for the third and succeeding offenses. Moreover, for the third offense, the drivers license of the offender shall be suspended for a period of one (1) month. Violation of these provisions beyond the third time shall result to automatic revocation of the offenders drivers license. SEC. 7. Review of Penalties.  The Land Transportation Office', '[ IRR of REPUBLIC ACT NO. 10666, April 04, 2017 ] IMPLEMENTING RULES AND REGULATIONS (IRR) OF REPUBLIC ACT NO. 10666 ""AN ACT PROVIDING FOR THE SAFETY OF CHILDREN ABOARD MOTORCYCLES"" I. INTRODUCTION Pursuant to Section 11 of Republic Act No. 10666, otherwise known as the Children\'s Safety on Motorcycles Act of 2015 and in order to pursue a more proactive and preventive approach to secure the safety of passengers, especially children, by regulating the operation of motorcycles along roads and highways, the following Implementing Rules and Regulations are hereby promulgated. RULE 1  PRELIMINARY PROVISIONS Section 1. Coverage These Rules shall cover all acts of driving/riding a two (2)-wheeled motorcycles with a child on board. Section 2. Definition of Terms a. Act refers to Republic Act No. 10666; b. Child refers to any person below eighteen (18) years of age; c. Foot peg refers to a flat form attached to the motorcycles on which to', ""in Motor Vehicles. - It shall be unlawful for the driver of a covered vehicle not to properly secure at all times a child, in a child restraint system while the engine is running or transporting such child on any road, street or highway unless the child is at least one hundred fifty (150) centimeters or fifty-nine (59) inches in height and is properly secured using the regular seat belt. The child restraint system shall be appropriate to the child's age, height and weight, and approved in accordance with Section 6 of this Act. The requirements of this section shall not apply to circumstances where the child restraint system would put such child in a greater danger, such as: (1) During medical emergencies; (2) Other analogous circumstances prescribed under the implementing rules and regulations (IRR). Notwithstanding the child being secured in a child restraint system, at no instance shall such child be left unaccompanied by an adult in a motor vehicle. SEC. 5. Children in Rear"", 'H. No. 4462; Manila Bulletin (August 5, 2015); 111 OG No. 37, 5381 (September 14, 2015) [ REPUBLIC ACT No. 10666, July 21, 2015 ] AN ACT PROVIDING FOR THE SAFETY OF CHILDREN ABOARD MOTORCYLES Be it enacted by the Senate and House of Representatives of the Philippines in Congress assembled: SECTION 1. Short Title.  This Act shall be known as Childrens Safety on Motorcycles Act of 2015. SEC. 2. Declaration of Policy.  It is the policy of the State to defend the right of children to assistance, including proper care and nutrition, and special protection from all forms of neglect, abuse, cruelty, exploitation, and other conditions prejudicial to their development. Towards this end, the State shall pursue a more proactive and preventive approach to secure the safety of passengers, especially children, by regulating the operation of motorcycles along roads and highways. SEC. 3. Definitions.  For purposes of this Act,', 'Pregnant Women and Senior Citizens in properly designated seats. Provide fare discount if applicable. 7. Instruct the passenger to fasten their seat belt if such is provided. 8. Inform the passenger on the prohibition of SMOKING on a public utility vehicle. 9. Instruct the passenger not to distract the driver while the vehicle is in motion. 10. Pick and drop passenger at the correct loading/unloading zone. 11. Be polite and courteous. 12. Assist passengers who need immediate emergency response. 153 Specific Responsibilities of a Driver MOTORCYCLES 1. Always wear Standard Protective Motorcycle Helmet and other safety protective gears (R.A. No. 10054). 2. The back rider must also wear protective helmet and safety gear (R.A. No. 10054/10666). 3. Ensure that a child below 18 years old (R.A. No. 10666): a. is able to reach around and grasp the waist of the rider; b. is wearing a standard', 'more proactive and preventive approach to secure the safety of passengers, especially children, by regulating the operation of motorcycles along roads and highways. SEC. 3. Definitions.  For purposes of this Act, the following terms shall mean: (a) Motorcycle refers to any two (2)-wheeled motor vehicle having one (1) or two (2) riding saddles; (b) Public roads refer to roads designed by the national government or local government units as roads for public use such as, but not limited to, national highways, provincial roads, city, municipal and barangay streets; (c) Foot peg refers to a flat form attached to the motorcycles on which to stand or brace the feet; and (d) Rider refers to the driver of a motorcycle. SEC. 4. Prohibition.  It shall be unlawful for any person to drive a two (2)-wheeled motorcycle with a child on board on public roads where there is heavy volume of vehicles, there is a high density of fast', 'harness straps and lap belt are firmly buckled and not twisted; 4) The shoulder strap crosses the center of the childs chest and not the childs neck; and 5) The lap belt fits across the childs thighs and hips and not across the abdomen. 62 Republic Act No. 11229 EXEMPTIONS This circumstances where the use of the child restraint system would put a child in greater danger, such as: 1) During medical emergencies; 2) When the child being transported has a medical, mental, psychological, psychiatric or developmental condition; or 3) Other analogous circumstances as may be determined by the DOTr in consultation with the DOH. The child being secured in a child restraint system, at no instance shall such child be left unaccompanied by an adult in a motor vehicle. FINES and PENALTIES First Offense - Php 1,000.00 Second Offense - Php 2,000.00 Third and Succeeding Offenses - Php 5,000.00 and suspension of the drivers license for a', 'the Child Restraint System  Php 50,000.00 but not more than Php 100,000.00  For each and every child restraint system product,  Other penalties imposed in Republic Act No. 7394 or the Consumer Act of the Philippines: 64 REPUBLIC ACT NO. 11235 MOTORCYCLE CRIME PREVENTION ACT AN ACT PREVENTING AND PENALIZING THE USE OF MOTORCYCLES IN THE COMMISSION OF CRIMES BY REQUIRING BIGGER, READABLE AND COLOR-CODED NUMBER PLATES AND IDENTIFICATION MARKS, AND FOR OTHER PURPOSES It is hereby declared the policy of the State to secure and safeguard its citizenry from crimes committed with the use of motorcycles through bigger, readable and color-coded number plates and identification marks. REGISTRATION BY THE OWNER Initial registration of a motorcycle shall be made with the LTO by the owner or the dealer, if authorized by the former, within five (5) days from the date of the sales invoice for brand new locally purchased motorcycles, or from the Certificate of Stock Reported (CSR) report date for new', 'to Republic Act No. 10666; b. Child refers to any person below eighteen (18) years of age; c. Foot peg refers to a flat form attached to the motorcycles on which to stand or brace the feet; d. LEO refers to law enforcement officers or deputies of the LTO to enforce this provisions of this Act; e. LTO refers to the Land Transportation Office f. Motorcycle refers to any two (2)-wheeled motor vehicle having one (1) or two (2) riding saddles; g. Motor vehicle refers to any vehicle propelled by any power other than muscular power using the public highways but excepting road rollers trolleys cars street sweepers, sprinklers, lawn movers, bulldozers, graders, fork-lifts, amphibian trucks, E-Library - Information At Your Fingertips: Printer Friendly', 'Ensure that a child below 18 years old (R.A. No. 10666): a. is able to reach around and grasp the waist of the rider; b. is wearing a standard protective helmet or gear; and c. can comfortably reach his/her feet on the foot peg. 4. For safety reasons, SWITCH ON the headlights when riding the motorcycle. 5. Ensure that the accessories conform with the standard: a. Custom-made top box (e.g. pizza or fast food deliveries) does not exceed 2 feet x 2 feet x 2 feet and is duly inspected by and registered to LTO and does not obstruct the view of side mirrors. b. Top box can only carry a maximum capacity of two (2) helmets. c. Saddle bags are not higher than the seat of the motorcycle and must follow the correct width of no more than 14 inches from the sides of the motorcycle and its length shall not exceed the tail end or tail lights. 154', ""a) No driver/rider shall operate a motorcycle or scooter while under the influence of liquor or narcotic drug. b) The driver/rider shall not use a cellular phone or other gadgets while operating a motorcycle or scooter. c) Adriver/rider shall observe the rule and on one lane per one vehicle only. Lane splitting is prohibited along a road or a highway. Motorcycles or scooters shall not be operated on sidewalks. SECTION X. Accreditation of Motorcycle Riding School. Any person may establish a motorcycle riding school according to law, provided accreditation is secured from the LTO. The LTO may waive the practical driving test for a student permit holder applying for driver's license with Restriction Code No 1 who has completed a rider's course from a LTO accredited motorcycfe riding school, provided the certificate of completion and graded results of the riding test of said applicant are submitted to the LTO. SECTION XI. Penal and Other Provisions. The"", ""is imposed. Section 6. The rider, upon lawful demand by the LTO Leo, shall surrender his/her driver's license and present the Certificate of Registration (CR) and current Official Receipt (OR) of the motorcycle. Section 7. Adjudication All apprehensions pursuant to the Act shall be adjudicated in accordance with LTO Rules and Regulations. RULE IV  FINES AND PENALTIES Section 8. Penalties Any person who operate a motorcycle in violation of Section 3 and 8 hereof shall be fined with an amount of: a. Three Thousand Pesos (P3,000.00) for the first offense; b. Five Thousand Pesos (P5,000.00) for the second offense; c. Ten Thousand Pesos (P10,000.00) for the third and succeeding offenses. Moreover, for the third offense, the driver's license of the offender shall be suspended for a period of one (1) month. Violation of these provisions beyond the third"", 'Notwithstanding the child being secured in a child restraint system, at no instance shall such child be left unaccompanied by an adult in a motor vehicle. SEC. 5. Children in Rear Seats. - No child twelve (12) years and below of age shall be allowed to sit in a front seat of a motor vehicle with a running engine or while such child is being transported on any road, street or highway, unless the child meets the height requirement set forth in Section 4 of this Act and is properly secured using the regular seat belt in the front seat. SEC. 6. Safety Standards for Child Restraint Systems. - The Department of Trade and Industry (DTI) is mandated to use standards set forth in United Nations Regulation 44 and United National Regulation 129 including its evolving standards and other acceptable international standards in the approval or disapproval of child restraint E-Library - Information At Your Fingertips: Printer Friendly', ""Drugged Driving Act of 2013  Republic Act No. 10666 - Children's Safety on Motorcycles Act of 2015  Republic Act No. 10913 - Anti-Distracted Driving Act  Republic Act No. 10916 - Road Speed Limiter Act of 2016  Republic Act No. 10930 - Rationalizing and Strengthening the Policy Regarding Driver's License Amending Section 23 of Republic Act No. 4136  Republic Act No. 11229 - Child Safety in Motor Vehicles Act  Republic Act No. 11235 - Motorcycle Crime Prevention Act 29 REPUBLIC ACT NO. 4136 LAND TRANSPORTATION AND TRAFFIC CODE AN ACT TO COMPILE THE LAWS RELATIVE TO LAND TRANSPORTATION AND TRAFFIC RULES, TO CREATE A LAND TRANSPORTATION COMMISSION AND FOR OTHER PURPOSES This act shall control the registration and operation of all types of motor vehicle and the licensing of owners, dealers, conductors, drivers and similar matters. CHAPTER I - PRELIMINARY PROVISIONS ARTICLE CHAPTER II - REGISTRATION OF MOTOR VEHICLES CHAPTER III - OPERATION OF MOTOR VEHICLES CHAPTER IV - TRAFFIC RULES CHAPTER V - PENAL AND OTHER PROVISIONS 30 REPUBLIC"", 'designated ""through streets."" 30 kms. per hour 30 kms. per hour 4. Through crowded streets, approaching intersections at ""blind corners,"" passing school zones, passing other vehicles 20 kms. per hour 20 kms. per hour which are stationary, or for similar dangerous circumstances. SECTION VI. Passenger and Cargo Load. Only one (1) back rider shall be allowed on a motorcycle or scooter who must be provided with a seat and footrest. The motorcycle or scooter shall not carry cargo other than the saddle bags or tugga9 carriers specifically designed and approved by the DTI. SECTION VII. Wearing of Standard Helmet. It shall be the duty of the motorcycle scooter driver/rider to ensure that he/she and the back rider wear standard helmets. SECTION VIII, Motorcycle and Scooter Accessories. Motorcycles or scooters shall equipped with required accessories such as headlight, tail light, signal light, brake raht side mirror and', ""Points) c. LIGHT VIOLATIONS (1 Demerit Points) * Driving a motor vehicle used in the commission of a crime upon conviction by regular court or competent jurisdiction * 2nd offense of Sec. 3 of R.A. 10666 (Children's Safety on Motorcycles Act of 2015) for driving a two (2)-wheeled motorcycle with a child on board on public roads where: - there is heavy volume of vehicles; - there is a high density of fast moving vehicles; or - where a speed limit of more than 60/kph is imposed * 1st offense of Sec. 3 of R.A. 10666 (Children's Safety on Motorcycles Act of 2015) for driving a two (2)-wheeled motorcycle with a child on board on public roads where: - there is heavy volume of vehicles; - there is a high density of fast moving vehicles; or - where a speed limit of more than 60/kph is imposed * Commission of a crime in the course of"", 'a free required to secure a franchise from the LTFRB under LTFRB Memorandum Circular No. 98-027. 61 Republic Act No. 11229 MANDATORY USE OF CHILD RESTRAINT SYSTEMS IN MOTOR VEHICLES It is unlawful for the driver of a covered vehicle not to properly secure at all times a child, in a child restraint system while the engine is running or when transporting such child on any road, street or highway unless the child is at least one hundred fifty (150) centimeters or fifty-nine (59) inches in height and is properly secured using the regular seat belt. The driver must ensure that: 1) The child restraint system is correctly installed in the vehicle through proper anchorage points; 2) The child restraint system is appropriate for the childs age, height and weight; 3) The harness straps and lap belt are firmly buckled and not twisted; 4) The shoulder strap crosses the center of the childs chest and not the childs neck; and 5) The lap belt fits across', 'comply with all safety requirements prescribed by competent authorities; (vii) motorcycles shall travel with their headlights on at all times to improve their visibility to other toll road and limited access highway users; tail lights and turn signal lights must be operational; (viii) no cargo shall be allowed on motorcycles except for normally accepted saddlebags and luggage carriers designed for motorcycles; and (ix) motorcycles shall not be allowed to ""lane-split"" or overtake in between lanes. b. Speed limits for motorcycles shall be: Minimum speed - 60 km per hour Maximum speed - 100 km per hour c. Motorcycles shall pay the same rate as cars (motorcycle is a two axle vehicle). d. The motorcycle operator and its lone backrider shall each use a protective motorcycle helmet. The backrider shall be provided with a seat and footrest. e. Motorcycles are encouraged to avail of electronic toll collection equipment (E-Pass), if available. r _ ..__ ._--_', 'which shall be collected from and paid by the owner when registering the motor vehicle. PENALTY FOR OVERLOADING Owner of a truck or trailer which is loaded in excess of the maximum allowable gross vehicle weight (GVW) to pay a penalty in the amount equivalent to 25% of the MVUC applicable to the vehicle at the time if infringement, provided that the penalty shall be waived for the loading exceeding the GVW by a tolerance of less than 5%. No vehicle shall be permitted to proceed on the roadway if either a dual-wheeled axle load exceeds 13,500 kilograms or the vehicle load exceeds 150% of the maximum allowable GVW. 36 REPUBLIC ACT NO. 10054 MOTORCYCLE HELMET ACT OF 2009 AN ACT MANDATING ALL MOTORCYCLE RIDERS TO WEAR STANDARD PROTECTIVE MOTORCYCLE HELMETS WHILE DRIVING AND PROVIDING PENALTIES THEREFOR It is hereby declared the policy of the State to secure and safeguard its citizenry, particularly the operators or drivers of motorcycles and their passengers, from the ruinous and extremely', 'immediately inform and require the front seat passengers upon boarding a vehicle of running engine to wear the prescribed seat belts. Any passenger who refuses to wear a seat belt shall not be allowed to continue his/her trip. For special public service vehicles such as school services and other similar vehicles as may be determined by the IRR, seat belt devices should be provided and used by both drivers and front seat passengers as defined herein and the first row passengers immediately behind the driver at all times while inside a vehicle of running engine. Operational motor vehicles, both public and private, which are not equipped with the required seat belt devices, are given one (1) year from the issuance of the IRR by the Land Transportation Office (LTO) to retrofit appropriate seat belt devices in their vehicles. SEC. 5. Children Prohibited to Sit in Front Seat. - Infants and/or children with ages six (6) years and below shall be prohibited to sit in the front seat of any running motor', ""Blood Alcohol Content when driving: 0.00% If you drink, dont drive If you drive, dont drink 33. What is the exemption for a child to ride a motorcycle pursuant to R.A. No. 10666 Childrens Safety on Motorcycle Act? When the child to be transported requires immediate medical attention 34. What is the risk of driving alongside a car? It is prone to road crash due to blind spots 35. Sleeping early and being physically fit is a: good professional driver's trait 36. When driving a motorcycle with a back rider, one must anticipate: longer braking distance 37. An orange traffic sign means: there is roadwork ahead and you must follow the prescribed speed limit 38. If you are hesitant to overtake the vehicle in front, you must: NOT overtake 177 Professional  Motorcycle (A, A1) QUESTION ANSWER 39. A solid yellow line prohibits a motorist to ________ overtake 40. If two passengers"", 'risks while aboard motor vehicles. In order to guarantee the safety and welfare of infants and children and prevent traffic- related deaths and injuries, there is a need to adequately, consistently and objectively require, regulate, promote, and inform the public on the use of child restraint systems in motor vehicles and provide access to safe, appropriate, quality and affordable child restraint systems, in accordance with international standards accepted by the United Nations. Furthermore, there is also a need to study and determine appropriate safety measures for children being transported in public utility vehicles. SEC. 3. Definition of Terms. - For purposes of this Act, the term: (a) Adult refers to any person eighteen (18) years old and above; (b) Child refers to any person twelve (12) years old and below; (c) Covered vehicle refers to any private motor vehicle or public motor vehicle upon the determination of the Department of Transportation (DOTr) in accordance with Section 12 of this Act; (d) Motor vehicle', 'not higher than the seat of the motorcycle and must follow the correct width of no more than 14 inches from the sides of the motorcycle and its length shall not exceed the tail end or tail lights. 154 Specific Responsibilities of a Driver SCHOOL SERVICES 1. Safely transport students from home to school and/or vice versa. 2. See to it that all passengers are seated properly before moving off. 3. Ensure or check all students are on board before starting the trip. 4. Refrain from deviating with the authorized route as approved by the school administrator. 5. Completely check the vehicle for sleeping students or any passengers left behind before moving off to the garage. 6. Maintain a complete list of student passengers, parents, and guardians contact numbers. 7. Report to school coordinators all unusual instances that happened during the trip. 8. Never leave the ignition key whenever the school service is parked. 9. Maintain a roadworthy and emission compliant school service. TAXI, TNVS, TNCs, and UV EXPRESS', '115 OG No. 17, 4171 (April 29, 20219) [ REPUBLIC ACT NO. 11229, February 22, 2019 ] AN ACT PROVIDING FOR THE SPECIAL PROTECTION OF CHILD PASSENGERS IN MOTOR VEHICLES AND APPROPRIATING FUNDS THEREFOR Be it enacted by the Senate and House of Representatives of the Philippines in Congress assembled: SECTION 1. Short Title. - This Act shall be known as the ""Child Safety in Motor Vehicles Act"". SEC. 2. Declaration of Policy. - It is the policy of the State to ensure the safety of children while being transported in any form of motor vehicle. The State recognizes the right of children to assistance, including proper care, and special protection from all forms of neglect, abuse and other conditions prejudicial to their development, including exposure to safety risks while aboard motor vehicles. In order to guarantee the safety and welfare of infants and children and prevent traffic- related deaths and injuries, there is a need to adequately, consistently and objectively require,', 'third and succeeding offenses. Moreover, for the third offense, the driver\'s license of the offender shall be suspended for a period of one (1) month. Violation of these provisions beyond the third time shall result to automatic revocation of the offender\'s driver\'s license. Section 9. Qualifying Circumstances If, in violation of the provisions of this Act, death shall have resulted or serious or less serious injuries shall have been inflicted upon the child or any other person, a penalty of one (1) year imprisonment shall be imposed upon the motorcycle rider or operator of the motorcycle involved without prejudice to the penalties provided under Act No. 3815, otherwise known as ""The Revised Penal Code of he Philippines,"" as amended. Section 10. Review of Penalties The Land Transportation Office (LTO) us hereby empowered to increase or adjust the amount of fines herein imposed, provided that: a. The increases or adjustment is made after public consultation once every three (3) E-Library -', 'RECEIPT WHILE DRIVING A MOTOR VEHICLE J. ALL OTHER VIOLATIONS OF TRAFFIC RULES AND REGULATIONS Seat Belts Use Act of 1999 Motorcycle Helmet Act of 2009 Php 1,000.00 Php 1,000.00 This includes the following traffic violations: 1. Parking a. In an intersection b. Within 6 meters of the intersection c. In front of the driveway entrance d. Within 4 meters of a fire hydrant e. In front of a private driveway f. On the roadway side of any unmoving or parked MV at the curb or edge of the highway g. At any place where signs of prohibitions have been installed 2. Disregarding Traffic Signs. 3. Allowing passengers on top or cover of a motor vehicle except in a truck helper. 4. Failure to provide canvass cover to cargoes or freight of trucks requiring the same. 5. Permitting passenger to ride on running board, step board or mudguard of MV while the same in motion. 6. Failure to dim headlights when approaching another', 'heavy jackets, leather gloves and rain suit. h. ""Standard helmet"" shall mean the protective helmet approved by the Department of Trade and Industry (DTI) with PNS-UNECE 22 marking. i. ""School for motorcycle riders"" shall mean any and all motorcycle riding schools accredited by the Land Transportation Office. j. ""Saddle bag"" shall mean the Department of Trade and Industry approved built-in carrier of luggage in a motorcycle. k. ""Temporary Operator\'s Permit"" shall mean the citation ticket issued by LTO deputized agents to those who violates these Rules and Regulations. SECTION II. Compulsory Registration of Motorcycles and Scooters. Alt motorcycles and scooters used or operated on any highway of the Philippines must be registered with the Land Transportation Office for the current year, in accordance with R.A. No. 4136, as amended. SECTION III. Use of Number Plates. Every motorcycle or scooter shall, at all times display in conspicuous places,', '4136 - Land Transportation and Traffic Code B. R.A. No. 10054 - Motorcycle Helmet Act of 2009 C. R.A. No. 10586 - Anti-Drunk and Drugged Driving Act of 2013 D. R.A. No. 10913 - Anti-Distracted Driving Act E. R.A. No. 10666 - Childrens Safety on Motorcycle of 2015 F. R.A. No. 10930 - Rationalizing and Strengthening the Policy Regarding Drivers License Amending Section 23 of R.A No. 4136 G. R.A No. 11235 - Motorcycle Crime Prevention Act 7) Traffic Violations, Fines and Penalties (JAO 2014-01) A. Violations in Connection with Licensing B. Violations in Connection with Motor Vehicle Registration/Renewal/Operation C. Violations in Connection with Dimensions, Specifications, Weight and Load Limits D. Violations in Connection with Franchise IV. DEFENSIVE DRIVING 1) Defensive Driving  Attitude and Behavior 2) Driver Perception and Awareness A.', 'APPROPRIATING FUNDS THEREFOR It is the policy of the State to ensure the safety of children while being transported in any form of motor vehicle. The State recognizes the right of children to assistance, including proper; care, and special protection from all forms of neglect, abuse and other conditions prejudicial to their development, including exposure to safety risks while aboard motor vehicles. In order to guarantee the safety and welfare of infants and children and prevent traffic-related deaths and injuries., there is a need to adequately, consistently and objectively require, regulate, promote, and inform the public on the use of child restraint systems in motor vehicles and provide access to safe, appropriate, quality and affordable child restraint systems, in accordance with international standards accepted by the United Nations. Furthermore, there is also a need to study and determine appropriate safety measures for children being transported in public utility vehicles. 60 Republic Act No. 11229 DEFINITON OF TERMS (a) Adult refers to any person eighteen', 'black alphanumeric characters. c. Government Motorcycle - with white background and red alphanumeric characters. d. Diplomatic Motorcycle - with white background and blue alphanumeric characters. The number plates shall be kept clean and cared for, and shall be firmly affixed to the motorcycles. FINES and PENALTIES Failure to Register or to Report Sale or Disposition VIOLATION PENALTY Failure of the buyer to register the motorcycle to LTO within five (5) days from acquisition of ownership. Failure of the subsequent seller to notify the LTO within three (3) days from the sale of motorcycle Fine of P20,000.00 - P50,000.00 or, Arresto Mayor (1 month and 1 day to 6 months) to Prision Correccional (6 months and 1 day to 6 yrs.), or both Driving without a Number Plate or Readable Number Plate VIOLATION PENALTY Driving without a number plate or a readable number plate Fine of P50,000.00 -', '41. How can you avoid wasting fuel? Through correct and proper driving habit Having the vehicle properly serviced and maintained 42. At an intersection, it is more dangerous to turn left than to turn right because _______________________. vehicles coming from opposite direction are faster 167 Nonprofessional  Motorcycle (A, A1) QUESTION ANSWER 43. What is one of the mandates of LTO? Register roadworthy and emission compliant motor vehicles 44. If the violation of the Republic Act No. 10666 on Safety of Children aboard Motorcycles resulted in death or serious or less serious injuries, what penalty will be imposed to the motorcycle rider or motorcycle operator? One (1) year imprisonment without prejudice provided for under Revised Penal Code of the Philippines 45. If this sign is disregarded, it will constitute an offense. Regulatory Sign Directional Sign (e.g., left lane must turn left, one-way sign)', ""of its agencies, instrumentalities or political subdivisions, including government-owned or -controlled corporations or their subsidiaries for official use; and (3) Any diplomatic vehicle. (f) Public motor vehicle shall refer to public utility vehicle or vehicle for hire; (g) Driver refers to the individual operating a motor vehicle; and (h) Child Restraint System refers to a device, approved in accordance with Section 6 of this Act, capable of accommodating a child occupant in a sitting or supine position. It is so designed as to diminish the risk of injury to the wearer, in the event of a collision or of abrupt deceleration of the vehicle, by limiting the mobility of the child's body. SEC. 4. Mandatory Use of Child Restraint System in Motor Vehicles. - It shall be unlawful for the driver of a covered vehicle not to properly secure at all times a child, in a child restraint system while the engine is running or transporting such child"", 'imposed. If death or serious physical injuries, as defined under the Revised Penal Code, results from the unlawful use of a motorcycle in the commission of a crime, the penalty of reclusion perpetua as provided under the Revised Penal Code shall be imposed. SEC. 10. Impoundment and Forfeiture of a Motorcycle. - A motorcycle used in the E-Library - Information At Your Fingertips: Printer Friendly https://elibrary.judiciary.gov.ph/thebookshelf/showdocsfriendly/2/86631 3 of 7 10/17/2025, 11:08 PM commission of a crime or offense shall be impounded by the PNP as evidence in custodio legis in a secured impounding center provided by the LGU until the termination of the case. Such motorcycle shall then be forfeited in favor of the government, unless the court finds that the defendant is not guilty of the offense charged or such motorcycle', 'favor, and the same is renewable on or before the last working day of the month of his birth, attaching a readily recognizable photograph and after E-Library - Information At Your Fingertips: Printer Friendly https://elibrary.judiciary.gov.ph/thebookshelf/showdocsfriendly/2/26188 18 of 31 10/17/2025, 11:21 PM presentation of a medical certificate of fitness of applicant. Passenger trucks may be allowed to construct any cargo carrying device at the rear or at the side of the truck, subject to the approval of the Commissioner: Provided, however, That the total weight of the device, in-cluing the cargo, shall not exceed one hundred kilos. (b) Carrying of passengers and freight on top of vehicles.No person operating a motor vehicle shall allow any passenger to ride on the cover or top of such vehicles: Provided, however, That subject to such conditions as may be contained in', 'day to 20 yrs.) to Reclusion Perpetua (imprisonment for at least 30 yrs.) If a motorcycle is used in the commission of a crime constituting a less grave felony or light felony (e.g slight physical injuries; theft; alteration of boundary marks) under the Revised Penal Code Prision Correccional (6 months and 1 day to 6 yrs.) to Prision Mayor (6 yrs. and 1 day to 20 yrs.) If a seized motorcycle is used in the commission of a crime Maximum penalty of the relevant crime or offense If death or serious physical injuries (unlawful use of motorcycle) Reclusion Perpetua (imprisonment for at least 30 yrs.) Impoundment and Forfeiture of a Motorcycle A motorcycle used in the commission of a crime or offense shall be impounded by the PNP as evidence in custodia legis (property take into the courts custody during the pendency of litigation over it)']","According to the provided context, it is illegal to carry a child on a motorcycle in the following situations:

1. Where there is a heavy volume of vehicles.
2. Where there is a high density of fast-moving vehicles.
3. Where a speed limit of more than 60/kph is imposed.

Unless the child meets the following conditions:

1. The child passenger can comfortably reach his/her feet on the standard foot peg of the motorcycle.
2. The child's arms can reach around and grasp the waist of the motorcycle rider.
3. The child is wearing a standard protective helmet referred to under Republic Act No. 10054, otherwise known as the Motorcycle Helmet Act of 2009.

Additionally, the child restraint system shall be appropriate to the child's age, height, and weight, and approved in accordance with Section 6 of Republic Act No. 11229.","Carrying children on motorcycles along public roads where there is heavy traffic or high-speed vehicles is prohibited, unless the child can reach the foot peg, wrap their arms securely around the rider, and wear a standard helmet.",0.75,0.917380346689122
Is it a violation to use your phone while stopped at a red light?,"['even when you believe that you did not violate any traffic rules and regulations? Stop at the roadside and politely ask the reason why you were being stopped 168 Nonprofessional  Light (B, B1, B2) QUESTION ANSWER 1. If you are parking uphill on a road without a curb, turn the wheels toward the ___________ edge of the road 2. What does a flashing yellow light mean? You can proceed through the intersection with caution 3. When parking downhill, you must: turn your wheels toward the curb 4. When parking uphill, you must: turn your wheels away from the curb 5. A solid yellow or white line on the road means: passing/overtaking is NOT allowed 6. A red flag or red light must be attached to any load that extends over: one (1.0) meter from the body of the vehicle 7. What are the effects of alcohol in a driver? Poor coordination of body movements and', 'consequences of the unrestrained use of electronic mobile devices on road safety as to cause its regulation. A law prohibiting all motorists to use any communications device while the motor vehicle is in motion or temporarily stopped a traffic light or intersection whether diplomatic, public or private. WHAT ARE DISTRATCED DRIVING PROHIBITIONS? 49 Republic Act No. 10913 EXEMPTIONS The law shall not apply to the following: a. A motorist using mobile phone for an emergency call to:  A law enforcement agency or agent to report a crime or a prohibited act, accident, natural calamity, bomb threat/terrorist action, animal activism, infrastructure failure and biological, chemical, or radioactive hazard spill or release;  Government or non-government health care provider, or a medical practitioner, and emergency rescue units, in instances requiring immediate medical attention;  Fire department or non-government fire volunteers in the event of fire/explosion;  Other emergency services, agency or entity rendering electric, gas, water, chemical, towing and other', 'a flashing red light indicate? Stop, yield, and proceed when it is safe 46. While driving in a street with no pavement markings, what should you do? Proceed with caution and drive at the rightmost side of the road 47. What is the proper action if you see a person in a wheelchair who is about to cross the street? Stop and wait for the PWD to cross the street 48. Can an enforcer apprehend a motorist who is using his/her phone while driving? Yes, if the driver is not using hands-free device (R.A No. 10913) 49. Holders of a professional drivers license for light vehicles are allowed to drive: any motor vehicle exceeding to 5000 kgs GVW 50. In an uphill road, you must turn the wheels ___________ when parking. away from the curb 183 Road Traffic Signs QUESTION ANSWER 1. Identify the traffic sign: Traffic light ahead 2. Identify', 'you are allowed to cross only: when turning into a driveway 30. If you are driving and you need to use your mobile phone, you should: stop at a safe side of the road to answer or make a call 31. What should you do if the school service is parked on the other side of the highway while the hazard warning light is on? Slow down and prepare to stop Students are expected to cross the street 171 Nonprofessional  Light (B, B1, B2) QUESTION ANSWER 32. On a one-way road, overtaking is permitted: either on the right or the left lane if it is free from obstruction 33. What vehicles are allowed to use a red and blue flashing light (blinker)? Police patrols and authorized Traffic Enforcers vehicle 34. One of the prohibited driving acts that could place your life at risk is: using mobile phone while driving 35. In which lane should you take upon merging on the expressway? Rightmost lane 36. If a driver', 'TRAFFIC VIOLATIONS OF PUBLIC UTILITY VEHICLE DRIVERS THAT CAUSE HEAVY TRAFFIC 1. Stopping (loading and unloading passengers) outside of the stopping zone and ignoring other motorists right-of-way. 2. Beating the red light. 3. Distracted driving by talking or chatting with passengers, eating, receiving phone calls, or composing text messages. 4. Speeding as a result of inducing and convincing passengers that they will reach their destinations ahead of time. 5. Swerving through indiscriminate and unsafe changing lanes. 6. Tailgating on fast moving traffic. 7. Counterflowing or driving against the flow of traffic. 8. Stopping on a pedestrian crosswalk to wait for possible passengers. 9. Delaying movement on green signal traffic lights to wait for passengers. 10. Opening door while the vehicle is in motion. 11. Lane Straddling. 12. Stopping on a yellow box. 157  Conductors License  Nonprofessional Motorcycle (A, A1)  Nonprofessional Light', 'to ensure a clean air environment? Maintain an emission- compliant vehicle 182 Professional  Light (B, B1, B2) QUESTION ANSWER 39. In an intersection a steady red light means: all vehicles facing the red light must stop at the STOP line 40. Motor vehicle emissions can contribute to: air pollution 41. What is the prescribed standard color of uniform for taxi drivers? Red Pursuant to LTFRB Memorandum Circular No. 2011-004 42. Does answering phone calls contribute to road crashes? Yes, it will make you lose focus while driving 43. One of the effects of alcohol while driving is: it slows down your reaction time 44. Is overtaking permitted if there are two solid yellow lines? Overtaking and crossing is NEVER permitted if there are two solid yellow lines 45. What does a flashing red light indicate? Stop, yield, and proceed when it is safe 46. While driving in a street with no pavement markings, what should you do? Proceed with caution and drive at the', 'the prohibited driving acts that could place your life at risk is: using mobile phone while driving 35. In which lane should you take upon merging on the expressway? Rightmost lane 36. If a driver operates a motor vehicle with a blinking/running/flashing brake light, he/she will be apprehended for: illegal modification 37. Are you allowed to leave your motor vehicle while the engine is running at a complete stop on the road? NO, not in any time It may cause confusion to other motorists and it may cause road crash 38. This could be one of the possible causes of road crash, if neglected: low level or leaking brake fluid 39. Under R.A. No. 11229, a child twelve (12) years old and below cannot sit at the back seat of a moving vehicle without the use of a ________________ child restraint system 40. While driving on the road, the driver is', 'or are pulled over to the side of the road in compliance with a traffic regulation. SEC. 6. Exemptions.  The provisions of this Act shall not apply to the following: (a) A motorist using a mobile phone for emergency purposes, including, but not limited E-Library - Information At Your Fingertips: Printer Friendly https://elibrary.judiciary.gov.ph/thebookshelf/showdocsfriendly/2/70326 2 of 5 10/17/2025, 11:04 PM to, an emergency call to a law enforcement agency, health care provider, fire department, or other emergency services, agency or entity; and (b) A motorist using a mobile phone while operating an emergency vehicle such as an ambulance, a fire truck, and other vehicles providing emergency assistance, in the course and scope of his or her duties. SEC. 7. Nationwide Public Information Campaign.  The DOTC-LTO, in coordination with', 'park a vehicle, or permit it to stand, whether attended or unattended, upon a highway in any of the following places: a. Within an intersection b. On a crosswalk c. Within six meters of the intersection of curb lines. d. Within four meters of the driveway entrance to and fire station. e. Within four meters of a fire hydrant f. In front of a private driveway g. On the roadway side of any vehicle stopped or parked at the curb or edge of the highway h. At any place where official signs have been erected prohibiting parking. SEC. 47. Parked vehicle.Whenever a motor vehicle is parked unattended on any highway, the driver thereof must turn off the ignition switch and stop the motor and notch effectively the hand brake. ARTICLE V.Miscellaneous Traffic Rules SEC. 48. Reckless driving.No person shall operate a motor vehicle on any highway recklessly or without reasonable caution considering the width, traffic, grades, crossing, curvatures, visibility and', 'No. 4136 2. A yellow traffic light means: you must slow down and prepare to stop Disregarding the yellow traffic light will constitute beating the red light tantamount to reckless driving 3. You must check your vehicle thoroughly before making a long trip to: prevent the inconvenience of vehicle breakdown 4. What is the primary responsibility of a driver who has been involved in a road crash? Assess the situation and if possible, assist the injured person and call for help 5. What should you do before making a U-turn? Check for traffic behind and indicate intention with a left turn signal Give way to oncoming vehicles 6. The blind spot is the area to your right or left that you do not see on the side view mirror. What will you do before you reverse? Look around to see that the way is clear 7. After making a left turn at the intersection, you should: switch off the signal light and proceed to the proper lane with care 8. This is one', 'heavy volume of vehicles; - there is a high density of fast moving vehicles; or - where a speed limit of more than 60/kph is imposed * Commission of a crime in the course of apprehension upon conviction by a regular court of competent jurisdiction * Colorum violation * Driving a motor vehicle while under the influence of alcohol, dangerous drugs and/or similar substance upon final conviction by a regular court of competent jurisdiction [Sec. 12 of R.A. No. 10586 (Anti-Drunk and Drugged * 2nd offense of Sec. 4 of R.A. 10913 (Anti-Distracted Driving Act) for acts in a motor vehicle in motion, or temporarily stopped at a traffic light or any intersection, whether diplomatic, public or private: * 1st offense of Sec. 4 of R.A. 10913 (Anti-Distracted Driving Act) for acts in a motor vehicle in motion, or temporarily stopped at a traffic light or any intersection, whether diplomatic, public or private:', 'of the vehicle then continue looking back until you reach the desired clearance.  Make quick checks over left and right shoulder and look through the mirror or rear window.  Whenever possible, appreciate assistance from companions inside the vehicle or a person outside your vehicle to help you back up. For Motorcycle Riders  If a U-turn is not possible, get out of the seat and push back the motorcycle by holding the handlebar on one hand and back seat bracket with the other hand. Avoid turning using the side stand https//wikihow.com 109 Before Starting and Driving on the Road DRIVING ON THE ROAD TRAFFIC LIGHTS AND SIGNALS RED SIGNAL means you must bring your vehicle to a STOP at a marked line. FLASHING RED SIGNAL means bring your vehicle to a STOP and proceed only when it is safe. YELLOW / AMBER SIGNAL indicates that the RED signal is about to appear. FLASHING YELLOW LIGHT means slow down and proceed with caution. GREEN SIGNAL means you can proceed, provided you yield to pedestrian and traffic lawfully using the', 'Phil. Star, May 3, 2017 p.8 [ IRR of REPUBLIC ACT NO. 10913, April 04, 2017 ] IMPLEMENTING RULES AND REGULATIONS (IRR) OF REPUBLIC ACT NO. 10913 (DEFINING AND PENALIZING DISTRACTED DRIVING) RULE I - PRELIMINARY PROVISIONS Section 1. Short Title and Purpose The Implementing Rules and Regulations, hereinafter called the IRR, is promulgated pursuant to Section II of Republic Act 10913, otherwise known as An Act Defining and Penalizing Distracted Driving for the purpose of prescribing the necessary rules and regulations for its implementation. Section 2. Declaration of Policy It is hereby declared the policy of the State to safeguard its citizenry from the ruinous and extremely injurious effects of vehicular accidents. While the State recognizes the vital roles of information and communications technology in nation-building, the State also take cognizance of the inimical consequences of the unrestrained use of electronic mobile devices on road safety', 'intersection collisions occur because drivers fail to follow the right-of-way regulations. At an intersection Where there is no traffic sign or signal, the vehicle on the left shall yield to the vehicle on the right. At a give-way sign intersection When you approach such a sign at an intersection, you must give the right-of-way to any other vehicle in or closely approaching the intersection. At a stop sign intersection Vehicle approaching such sign must come to a full stop and yield the right-of-way to the vehicle in or approaching the intersection. If two vehicles stopped on a stop line at the same time, the vehicle on the left must yield to the vehicle on the right. Never do a rolling stop. At an intersection with a traffic control device If your light is green, you may proceed but only after yielding to other vehicles and pedestrians lawfully within the intersection. On intersections allowing a right turn on red light, proceed only after stopping and yielding to pedestrians and to cross-traffic', ""perform calculation, and other similar acts - Using a mobile communications device to write, send, or read a text - based communication, or to make or receive calls, and other similar acts; and - Using an electronic entertainment or computing device to play games, watch movies, surf the internet, compose messages, read e-books, perform calculation, and other similar acts * 3rd and succeeding offenses of Sec. 3 R.A. 10666 ((Children's Safety on Motorcycles Act of 2015) for driving two (2) wheeled with a child on board on public roads where: - there is a heavy volume of vehicles; - there is a high density of fast moving vehicles; or - where a speed limit of more than 60/kph is imposed * 3rd and succeeding offenses of Sec. 4 of R.A. 10913 (Anti- Distracted Driving Act) for acts in a motor vehicle in motion, or temporarily stopped at a traffic light or any intersection, whether diplomatic, public or"", 'Code of the Philippines 45. If this sign is disregarded, it will constitute an offense. Regulatory Sign Directional Sign (e.g., left lane must turn left, one-way sign) 46. Why should the driver always yield to emergency vehicles with blinkers and sirens on? Because they have a priority right-of-way 47. The Right-Of -Way rule signifies: the rights of drivers on when to yield or give way to others while driving 48. When making a right turn, you should: reduce speed and stay on the outermost lane of the road then signal your intention to turn right 49. When approaching a crosswalk or pedestrian lane, you should: slow down and stop to yield to pedestrians 50. What should you do if you are stopped by an enforcer even when you believe that you did not violate any traffic rules and regulations? Stop at the roadside and politely ask the reason why you were being stopped 168 Nonprofessional  Light (B,', ""be attached to any load that extends over: one (1.0) meter from the body of the vehicle 7. What are the effects of alcohol in a driver? Poor coordination of body movements and lack of self-judgment 8. In a toll gate, a red X light/sign means: you cannot drive through this lane 9. What does a flashing red light mean? You must stop and then go only when it is safe to do so 10. What hand signal must a driver give when he/she wants to turn right? Left arm bent at elbow, hand pointing up 11. At a normal speed, what is the safety rule when following behind another car? One car length apart 12. A driver of a vehicle approaching a crossing or intersection shall: slow down and stop 169 Nonprofessional  Light (B, B1, B2) QUESTION ANSWER 13. At a normal speed, keeping one's distance lessens the risk of road crash. One good rule is to leave"", '4 of R.A. 10913 (Anti- Distracted Driving Act) for acts in a motor vehicle in motion, or temporarily stopped at a traffic light or any intersection, whether diplomatic, public or private: - Using a mobile communications device to write, send, or read a text - based communication, or to make or receive calls, and other similar acts; and - Using an electronic entertainment or computing device to play games, watch movies, surf the internet, compose messages, read e-books, perform calculation, and other similar acts * Failure to wear the prescribed seat belt device (2nd offense) in violation of R.A. 8750 (Seat Belts Used Act of 1999) * Failure to wear the standard protective motorcycle helmet or failure to require the back rider to wear the standard protective motorcycle helmet, under R.A. 10054 (Motorcycle Helmet Act of 2009) - 2nd offense * Smoke belching [Section 46, R.A. 8749 (Philippine Clean Air Act of', 'a CPC from LTFRB prior to operating a tricycle for hire? NO Tricycle operators shall secure permits from concerned local government unit 21. The allowable motorcycle engine displacement for expressways is: 400cc and above 22. Can a motorcyclist stop in a yellow box? At any instance a rider is not allowed to stop inside a yellow box 23. Is it safe to use your handheld phone while driving a motorcycle? NO, it is against the law (R.A. No. 10913 Anti- Distracted Driving Act) 24. Broken yellow lines allow motorists: to overtake and cross when it is safe 25. When you see an intersection with a blank inverted triangle traffic sign, you should: slow down and give way to any vehicle in the intersection 26. One of the requirements of installing custom-made top box must be: 2 feet x 2 feet x 2 feet 27. Can a rider place a blinker taillight in his/her motorcycle? NO, it', 'motor vehicles which are not in motion, except those which are stopped momentarily at a traffic light or any intersection, or are pulled over to the side of the road in compliance with a traffic regulation. Section 6. Exemptions The provisions of this IRR shall not apply to the following: a) A motorist using a mobile phone an emergency call to; (i) a law enforcement agency or agent to report a crime or prohibited act, accident, natural calamity, bomb threat/terrorist action, animal activism, infrastructure failure and biological, chemical, or radioactive hazard spill or release; (ii) government or non-government health care provider, or a medical practitioner, and emergency rescue units, in instances requiring immediate medical attention; (iii) fire department or non-government fire volunteers in the event of fire/ explosion; (iv) other emergency services, agency or entity rendering electric, gas, water, chemical, towing and other similar services, in instances requiring immediate attention to save lives and', 'tilt the beams downward whenever the vehicle is being operated on well-lighted streets within the limits of cities, municipalities, and thickly populated barrios or districts, or whenever such vehicle meets another vehicle on any public highway. (d) Taillights.Every motor vehicle and trailer shall, during the above- mentioned hours, also bear on each side in the rear a lamp showing a red light visible at least one hundred meters from the rear of the vehicle and a lamp throwing a white light upon the number plate issued for such vehicle. (e) Stop lights.Every motor vehicle shall be equipped at the rear with at least one lamp which shall throw a sustained bright red light visible under all conditions, even under bright sunlight, when the brakes are applied. Each bus, truck, trailer, or similar vehicle shall be equipped as its stop light at or near its rear center, with a lamp at least twelve centimeters in diameter with the word ""stop"" inscribed in the center. E-Library - Information At', '9 of 14 10/17/2025, 10:17 PM e. In front of a private driveway f. On the roadway side of any unmoving or parked MV at the curb or edge of the highway g. At any place where signs of prohibitions have been installed * Allowing passengers on top/cover of MV vehicle within such intersection or turning therein to the left across the line of travel of the first mentioned vehicle when such vehicle has given a plainly visible signal of intention to turn *Smoke belching [Section 46, R.A. 8749 (Philippine Clean Air Act of 1999)] - 3rd offense * Failure to dim headlights when approaching another motor vehicle * Failure to provide canvass cover to cargoes or freight of trucks requiring the same2/ * Axle Overloading (Violation of R.A. 8794) * Hitching or permitting a person or a bicycle, motorcycle, tricycle or skate roller to hitch to a motor vehicle increasing speed when being overtaken', 'of the road then proceed with caution if clear (stop, look and listen) 12. When do you have to make a complete/full stop? At a red traffic light 13. To protect motorcycle riders at all times, they should wear: standard protective helmets (ICC and PS stickers) and full body gear for additional protection 14. A driver must not park or stop at the side of the road with a ""Stop"" sign or a traffic control signal within: 6 meters Pursuant to R.A. No. 4136 15. A driver on a highway shall yield the right-of-way to: police vehicles, fire trucks, and ambulances Pursuant to R.A. No. 4136 16. What should you do if you want to slow down or stop? Press on your brakes lightly to activate brake lights 17. To avoid suspension, the driver must settle their apprehension within: 15 days Pursuant to R.A. No. 4136 and JAO-2014-01 164', 'SIGNAL indicates that the RED signal is about to appear. FLASHING YELLOW LIGHT means slow down and proceed with caution. GREEN SIGNAL means you can proceed, provided you yield to pedestrian and traffic lawfully using the intersection. FLASHING GREEN SIGNAL means proceed with caution and be prepared for pedestrians who might cross the street. This signal is usually seen on intersections where pedestrian crossing button is available. 110 Before Starting and Driving on the Road BRAKING PROPER BRAKING Avoid tailgating. Staying too close to the vehicle in front of you leaves no room to maneuver whenever there is obstruction on your lane. Maintain a safe distance when following a vehicle. This will give you adequate space, time to react and to stop safely. Give motorcycles the same distance you would give to any other vehicle. Motorcycles are entitled to the same full length and width as all other vehicles on the road. BRAKING DISTANCE It is the distance travelled from the time you start to activate the brakes until you bring the vehicle to a stop. The vehicle running at 100 kph in', 'RECEIPT WHILE DRIVING A MOTOR VEHICLE J. ALL OTHER VIOLATIONS OF TRAFFIC RULES AND REGULATIONS Seat Belts Use Act of 1999 Motorcycle Helmet Act of 2009 Php 1,000.00 Php 1,000.00 This includes the following traffic violations: 1. Parking a. In an intersection b. Within 6 meters of the intersection c. In front of the driveway entrance d. Within 4 meters of a fire hydrant e. In front of a private driveway f. On the roadway side of any unmoving or parked MV at the curb or edge of the highway g. At any place where signs of prohibitions have been installed 2. Disregarding Traffic Signs. 3. Allowing passengers on top or cover of a motor vehicle except in a truck helper. 4. Failure to provide canvass cover to cargoes or freight of trucks requiring the same. 5. Permitting passenger to ride on running board, step board or mudguard of MV while the same in motion. 6. Failure to dim headlights when approaching another', 'shall be equipped as its stop light at or near its rear center, with a lamp at least twelve centimeters in diameter with the word ""stop"" inscribed in the center. E-Library - Information At Your Fingertips: Printer Friendly https://elibrary.judiciary.gov.ph/thebookshelf/showdocsfriendly/2/26188 20 of 31 10/17/2025, 11:21 PM (f) Motorcycle and other vehicle lights.Every motor vehicle of less than one meter of projected width shall be subject to the preceding provisions of this section except that one headlight and one taillight shall be required. No signal light shall be necessary. Additional lamps may be carried provided they comply with the preceding provisions of this section. Every other vehicle, or whatever style, kind, make, character, or nature, when upon a highway during the hours above-mentioned, whether in motion or not, shall have one or more lights so arranged that the', 'into the muffler 19. A steady green traffic light means: vehicles can proceed 20. What should you do if you make a wrong turn on a one-way road? Back up if possible or safely make a U-turn 21. If you are in doubt while approaching an intersection, you must: yield the right-of-way to avoid road crash 180 Professional  Light (B, B1, B2) QUESTION ANSWER 22. Can a motorist park in a pedestrian lane? NO, not in any circumstances Parking in a pedestrian lane or crosswalk is in violation of traffic rules and regulations (R.A. No. 4136) 23. Is driving a private vehicle on a yellow bus lane allowed? No, except when turning or going into the garage within 100 meters upon entering the yellow bus lane 24. If your cargo exceeded one (1) meter from the body of your vehicle, you must: hang a red flag with at least 30x30 centimeters at the edge of the', ""when your vehicle is approaching a crest? Prepare to slow down and stay on your lane for a safer travel 24. Drinking any amount of alcohol while driving may: decrease your reaction time, impair your judgment, and give you a false sense of confidence 25. A green arrow traffic light means: vehicles turning on that direction shall proceed 26. Motor vehicle's horn is used to: warn other road users of your presence 27. Which vehicles have the right-of- way at a rotunda or roundabout? The vehicles within the roundabout 28. What could be a reason for a driver to lose his concentration in driving? Listening to loud music, using mobile phone or gadget, watching videos, rubbernecking, and engaging in long conversations with passenger/s 29. In a single solid yellow line, you are allowed to cross only: when turning into a driveway 30. If you are driving and you need to use your mobile phone, you should: stop at a safe side of the road to"", 'read e-books, perform calculation, and other similar acts. Section 5. Extent of Coverage a. The operation of a mobile communications device is not considered to be distracted driving if done using the aid of a hand-free function or similar device such as, but not limited to, a speaker phone, earphones and microphones or other similar devices which allow a person to make and receive calls without having to hold the mobile E-Library - Information At Your Fingertips: Printer Friendly https://elibrary.judiciary.gov.ph/thebookshelf/showdocsfriendly/2/97655 2 of 6 10/17/2025, 11:02 PM communications device: Provided, That the placement of the mobile communications device or the hands-free device does not interfere with the line of sight of the driver. b. Wheeled agricultural machineries such as tractors and construction equipment such as graders, roller, backhoes, pay loaders, cranes,', '(ABC).  If you cannot stop the fire, leave the vehicle. ROAD CRASH 1. Stop. 2. Turn on hazard flashers. 3. Check yourself and your passengers or other road users. 4. Take photos of the road crash. 5. Call the local law enforcement officers. Source: Canva Photos Source: Canva Photos Source: Canva Photos Source: Canva Photos 145 Dealing with Emergency Situations AVOIDING COLLISION WITH VEHICLE AHEAD SEARCH the road ahead, around and at the rear of the vehicle IDENTIFY the potential and immediate hazard on the road PREDICT the actions of other road users DECIDE what to do to avoid an unsafe situation EXECUTE the action based on your decision 146 Dealing with Emergency Situations AVOIDING COLLISION WITH VEHICLE BEHIND PAVEMENT DROP-OFF Your effort to steer back onto the road if your front wheel has dropped off the pavement can send you swerving into the path of an oncoming vehicle unless you follow these steps:  Signal your intention. Use your brake lights and signal lights to communicate. Give time', ""real threat of serious injury to the driver, his/ her passengers or the general public, or which may cause undue ruin or substantial damage to property as listed in the Violation Demerit Point Schedule (Appendix 1). ii. Less Grave Violation - a traffic violation identified as having been committed so as to endanger or to be likely to endanger any person or property which is not so serious as to qualify under the immediately preceding classification as enumerated in the Violation Demerit Point System (Appendix 1). iii. Light Violation - may refer to a minor or simple infraction of traffic laws, rules, regulations and ordinances and those not otherwise classified as grave or less grave. h. Suspension - the temporary withdrawal of the Land Transportation Office of a driver's license or privilege to operate a motor vehicle on public roads or highways. i. Revocation - the termination by formal action of the Land Transportation Office of a driver's license or privilege to operate a motor vehicle"", 'approved mechanical or electrical signal device. For Motorcycle Riders  Use of hand, head or foot signals that are not mentioned in this topic are not recognized as a lawful signal.  Other international signs may be used for group riding only.  Avoid using other signals that may tend to confuse other motorists. Example, raising your left foot to turn left is not a recognized and lawful signal. Besides, it is not safe. The driver of any vehicle upon a highway, before starting, stopping or turning from a direct line, shall first see that such movement can be made in safety, and if any pedestrian may be affected by such movement, shall give a clearly audible signal by sounding the horn, and whenever the operation of any other vehicle approaching or following may be affected by such movement, shall give a signal plainly visible to the driver of such other vehicles of the intention to make such movement. Source: Canva Photos 121 Before Starting and Driving on the Road OVERTAKING AND PASSING RESTRICTIONS 1. The driver of a vehicle shall', 'out for motorcycles, bicycles, pedestrians, and obstructions. 5. Keep to the left-most lane while turning. LEFT TURN FROM ONE-WAY STREET TO ONE-WAY STREET (VEHICLE A) 1. Signal your intention to turn left. 2. Look ahead for traffic to check if the way is clear. 3. Position your vehicle nearest to the curb upon reaching the intersection. 4. Watch out for motorcycles, bicycles, pedestrians, and obstructions. TURNING FROM ONE-WAY STREET TO ONE-WAY STREET ON RED SIGNAL 1. Check if you are allowed to make a turn on a Red Signal. If yes, safely proceed. Otherwise, STOP and wait for a Green Traffic Light. 2. Position your vehicle nearest to the curb of the intersection. 3. Signal your intention to turn. 119 Before Starting and Driving on the Road MAKING A U-TURN U-turns are risky and prohibited in some areas. When doing a U-turn: 1. Start turning from the right side of', 'seat of a moving vehicle without the use of a ________________ child restraint system 40. While driving on the road, the driver is allowed to use warning (hazard) lights if needed: to warn a hazard ahead (such as vehicle being towed, and road works ahead) 172 Nonprofessional  Light (B, B1, B2) QUESTION ANSWER 41. When following a student-driver, you should: be patient, expect them to make mistakes 42. You are driving on a single-lane road with passing places only at the right, you should: pull and stop into a passing place when loading or unloading 43. You are approaching a busy junction with several lanes that has road markings. Suddenly, you entered the wrong lane. What should you do? Continue driving in that lane until it is safe to return to the proper lane 44. You entered a fully occupied parking area except for a vacant PWD parking', 'R.A. 10913 (Anti-Distracted Driving Act) for acts in a motor vehicle in motion, or temporarily stopped at a traffic light or any intersection, whether diplomatic, public or private: E-Library - Information At Your Fingertips: Printer Friendly https://elibrary.judiciary.gov.ph/thebookshelf/showdocsfriendly/2/96764 8 of 14 10/17/2025, 10:17 PM Driving Act of 2013)] - Using a mobile communications device to write, send, or read a text - based communication, or to make or receive calls, and other similar acts; and - Using an electronic entertainment or computing device to play games, watch movies, surf the internet, compose messages, read e-books, perform calculation, and other similar acts - Using a mobile communications device to write, send, or read a text - based communication, or to make or receive calls, and other similar acts; and', 'Traffic Rules SEC. 48. Reckless driving.No person shall operate a motor vehicle on any highway recklessly or without reasonable caution considering the width, traffic, grades, crossing, curvatures, visibility and other conditions of the highway and the conditions of the atmosphere and weather, or so as to endanger the property or the safety or rights of any person or so as to cause excessive or unreasonable damage to the highway. SEC. 49. Right of way for police and other emergency vehicles.Upon the approach of any police or fire department vehicle, or of an ambulance giving audible signal, the driver of every other vehicle shall immediately drive the same to a position as near as possible and parallel to the right-hand edge or curb of the highway, clear of any intersection of highways, and shall stop and remain in such position, unless otherwise directed by a peace officer, until such vehicle shall have passed. SEC. 50. Tampering with vehicles.No unauthorized person shall sound the horn, handle the', ""the fine above-stated; and A holder of a driver's license who acts in violation of the provisions of Republic Act No. 4136 and other existing traffic laws shall suffer corresponding penalties as may be provided by law and other issuances. 58 Republic Act No. 10930 In case of death or physical injuries resulting in the loss of any part of the victim's body or the use thereof, insanity, imbecility impotence or blindness, or incapacity to work for more than ninety (90) days, the license of the offending driver shall be revoked for a period of (4) years, after a finding by the court that such driver was negligent or at fault The Department of Transportation (DOTr) and the LTO shall, in coordination with the Land Transportation Franchising and Regulatory Board (LTFRB) and other concerned agencies and private stakeholders, aggressively and regularly conduct a nationwide information, education and communication (IEC) campaign on road"", 'use; and j. Public motor vehicle - a motor vehicle with a valid franchise issued by the appropriate government agency to operate as a public utility vehicle or any vehicle for hire. RULE 2 - PROHIBITION, COVERAGE AND EXEMPTIONS Section 4. Distracted Driving Subject to the qualification in Sections 5 and 6 of this IRR, distracted driving refers to the performance by a motorist of any of the following acts in a motor vehicle in motion, or temporarily stopped at a traffic light or any intersection, whether diplomatic, public or private: a. Using a mobile communications device to write, send, or read a text-based communication, or to make or receive calls, and other similar acts; and b. Using an electronic entertainment or computing device to play games, watch movies, surf the internet, compose messages, read e-books, perform calculation, and other similar acts. Section 5. Extent of Coverage a. The operation of a mobile communications device is not considered to be distracted driving if done using the aid', 'Certificate of Registration, and current Official Receipt (OR/CR) 7. On the assumption that your motorcycle is in good running condition, what can cause you to skid and lose control when making an abrupt movement especially on a wet and slippery road? Improper braking 8. Are you allowed to use the shoulder of the road to pass on the right side of a car ahead? NO, it is against the law Pursuant to R.A. No. 4136 163 Nonprofessional  Motorcycle (A, A1) QUESTION ANSWER 9. What is the meaning of an inverted triangle sign? Give way 10. What do double yellow solid lines mean? No crossing or overtaking 11. What should you do when you are crossing a railroad and there are NO warning devices? Slow down, check both sides of the road then proceed with caution if clear (stop, look and listen) 12. When do you have to make a complete/full stop? At a red traffic light 13. To protect motorcycle', 'communication or to make or receive calls, and other similar acts; and (b) Using an electronic entertainment or computing device to play games, watch movies, surf the internet, compose messages, read e-books, perform calculations, and other similar acts. SEC. 5. Extent of Coverage.  (a) The operation of a mobile communications device is not considered to be distracted driving if done using the aid of a hands-free function or similar device such as, but not limited to, a speaker phone, earphones and microphones or other similar devices which allow a person to make and receive calls without having to hold the mobile communications device: Provided, That the placement of the mobile communications device or the hands-free device does not interfere with the line of sight of the driver. (b) Wheeled agricultural machineries such as tractors and construction equipment such as graders, rollers, backhoes, pay loaders, cranes, bulldozers, mobile concrete mixers and the like, and']","According to the provided context, it is not explicitly stated that using a phone while stopped at a red light is a violation. However, Republic Act No. 10913 (Anti-Distracted Driving Act) prohibits using a mobile communications device while operating a motor vehicle in motion, or temporarily stopped at a traffic light or any intersection. 

Since the context does not provide specific information on using a phone while stopped at a red light, it is best to consult the actual law for clarification.","Yes, using a handheld phone while the vehicle is temporarily stopped at a red light or in traffic is still considered distracted driving. Only hands-free devices are allowed unless it’s an emergency situation.",0.6,0.0
What if I cover my plate number?,"[""number plate is such that the numerals indicating the year of registry are on a detachable tag, the Commissioner or his deputies may in E-Library - Information At Your Fingertips: Printer Friendly https://elibrary.judiciary.gov.ph/thebookshelf/showdocsfriendly/2/26188 13 of 31 10/17/2025, 11:21 PM their discretion, issue the said tag only for subsequent re-registration charging a fee of one peso for each tag issued. SEC. 18. Use of number plates.At all times, every motor vehicle shall display in conspicuous places, one in front and one in the rear thereof, the said number plates. The number plates shall be kept clean and cared for, and shall be firmly affixed to the motor vehicle in such a manner as will make it entirely visible and always legible. Except in the case of dealer's number plates which may be used successively on various"", 'means of identification: Provided, further, That all motor vehicles exempted from payment of registration fees, motor vehicles for hire, and privately-owned motor vehicles shall bear Plates so designed and painted with different colors to distinguish one class from another: Provided, furthermore, That the plates of motor vehicles exempted from payment of registration fees shall be permanently assigned to such motor vehicles during their entire lifetime while exempted from payment of the fees: And, provided, finally, That the owner thereof shall return such plates to the Land Transportation Commission within a period of seven working days after such owner has lost his exemption privilege or has transferred the vehicle to a non-exempt owner. b. In case the design of the number plate is such that the numerals indicating the year of registry are on a detachable tag, the Commissioner or his deputies may in E-Library - Information At Your Fingertips: Printer Friendly', 'after the effectivity of this Act and thereafter as may be determined by the Oversight Committee. The Oversight Committee shall review the penalties herein imposed and shall adjust the same accordingly of deemed necessary. SEC. 19. Transitory Provision. - Motorcycle owners with number plates not in conformity with the provisions of this Act, shall renew their registration and apply for E-Library - Information At Your Fingertips: Printer Friendly https://elibrary.judiciary.gov.ph/thebookshelf/showdocsfriendly/2/86631 5 of 7 10/17/2025, 11:08 PM the required readable number plate not later than June 30, 2019. The LTO is given until December 31, 2019 to produce, release and issue the number plates as required by this Act. After December 31, 2019, the penal provisions regarding the use of bigger, readable and color-coded number plates as required under this Act shall take effect. SEC.', 'until such payment is made, the certificate of registration of the motor vehicle concerned shall be suspended by the Commissioner. After two such suspensions, re-registration of the vehicle concerned for one year may be denied. The Commissioner shall notify the owner of the motor vehicle of any action taken by him under this section. SEC. 17. Number plates, preparation and issuance of. a. The Commissioner shall cause number plates to be prepared and issued to owners of motor vehicles and trailers registered under this Act, charging a fee of four pesos for each pair including the numerals indicating the year of registry: Provided, however, That in case no number plates are available, the Commissioner or his deputies may issue, without charge, a written permit temporarily authorizing the operation of any motor vehicles with other means of identification: Provided, further, That all motor vehicles exempted from payment of registration fees, motor vehicles for hire, and privately-owned motor vehicles shall bear Plates so designed and painted with different', 'number plate for every motorcycle, following the font style and size prescribed in the implementing rules and regulations (IRR) of this Act. The information on the number plates shall be readable from the back portion of the motorcycle at a distance of at least fifteen (15) meters from the motorcycle. x x x The readable number plates must be displayed at the back of a motorcycle and shall be made of suitable and durable material as determined by the LTO. x x x."" SEC. 3. Section 7 of Republic Act No. 11235 is hereby amended to read as follows: ""SEC. 7. Driving Without a Number Plat or Readable Number Plate. - Driving without a number plate or a readable number plate, as provided in this Act, is prohibited. The driver of a motorcycle without a number plate or readable number plate shall be punished with a fine of not more than Five thousand pesos (P5,000.00). A motorcycle driver without a', 'forging, imitating, covering, concealing a number plate or readable number plate Fine of P50,000.00  P100,000.00, or Prision Mayor (6 yrs. And 1 day to 20 yrs.) Or both Knowingly sells or buys an erased, tampered, altered, forged or imitated number plate or readable number plate Unknowingly sells or buys  Prision Mayor (6 yrs. And 1 day to 20 yrs.) Arresto Mayor (1 month and 1 day to 6 months) Prohibition on Sale and Importation of Non-Complaint Motorcycles No person, natural or juridical, shall be allowed to sell motorcycles, as defined under Section 3(c) of this IRR, unless the same has the capability to bear and showcase a readable number plate required under section 5 of this IRR. Owners of existing motorcycle units which do not have space for front plate are required to provide a bracket or any', 'DIGIT vehicle ending 3 must be registered in March 2nd TO THE LAST DIGIT OF THE PLATE NUMBER  refers to the week the vehicle must be registered. 2nd to the last digit of 5 must register between 8th and 14th working day or 2nd week of March d. Three (3) alpha characters and two (2) numeric characters 137 DF LAST DIGIT vehicle ending 3 must be registered in July 2nd TO THE LAST DIGIT OF THE PLATE NUMBER  refers to the week the vehicle must be registered. 2nd to the last digit of 3 must register between 1st and 7th working day or 1st week of July 20 3. Optional Motor Vehicle Special Plate Three (3) alpha characters and two (2) numeric characters TSD 77 LAST DIGIT vehicle ending 7 must be registered in July 2nd TO THE LAST DIGIT OF THE PLATE NUMBER  refers to the week the vehicle must be registered. 2nd to the last or middle digit of 7 must register between 15th to 21st working day or 3rd week of July 21 MOTOR VEHICLE USERS CHARGE RATE PRIVATE and', 'number, motorcycle plate number, motorcycle body color, motorcycle brand/make. In the registry of motorcycles, the LTO shall observe at all time Republic Act No. 10173 of the ""Data Privacy Act of 2012"". SEC. 7. Driving Without a Number Plate or Readable Number Plate. - Driving without a number plate or readable number plate, as provided in this Act, is prohibited. The driver of a motorcycle without a number plate or readable number plate, as provided in this Act, shall be punished by prison correccional as provided in the Revised Penal Code, or a fine of not less than Fifty thousand pesos (P50,000.00) but not more than One hundred thousand pesos (P100,000.00). A motorcycle driver without a number plate or a readable number plate shall be E-Library - Information At Your Fingertips: Printer Friendly', 'than Twenty thousand pesos (P20,000.00)."" SEC. 7. Section 19 of Republic Act No. 11235 is hereby amended to read as follows: ""SEC. 19. Transitory Provision. - Motorcycle owners with number plates not in conformity with the provisions of this Act shall renew their registration and apply for the required readable number plate not later than December 31, 2025. The LTO is given until June 30, 2026 to produce, release, and issue the number plates as required by this Act. After June 30, 2026, the penal provisions regarding the use of bigger, readable, and color-coded number plates as required under this Act shall take effect."" SEC. 8. Separability Clause. - If any provision of this Act is declared invalid or unconstitutional, the remainder thereof not otherwise affected shall remain in full force and effect. SEC. 9. Repealing Clause. - All laws, presidential decrees, executive orders,', 'lost, damaged or stolen number plate or readable number plate and used in a crime Arresto Mayor (1 month and 1 day to 6 months) to Prision Correccional (6 months and 1 day to 6 yrs.) Use of a Stolen Number Plate or Readable Number Plate VIOLATION PENALTY Use of a stolen or transfer of number plate or readable number plate in a motorcycle Fine of P50,000.00  P100,000.00 or Prision Mayor (6 yrs. And 1 day to 20 yrs.), Or both 70 Republic Act No. 11235 Erasing, Tampering, Forging, Imitating, Covering or Concealing a Number Plate or Readable Number Plate and Intentional Use Thereof VIOLATION PENALTY Erasing, tampering, altering, forging, imitating, covering, concealing a number plate or readable number plate Fine of P50,000.00  P100,000.00, or Prision Mayor (6', 'or both; (b) If a person knowingly sells or buys an erased, tampered, altered, forged or imitated number plate or readable number plate, both buyer and seller shall be published with imprisonment ranging from six (6) months and one (1) day to two (2) years, or a fine of Ten thousand pesos (P10,000.00), or both."" SEC. 6. Section 13 of Republic Act No. 11235 is hereby amended to read as follows: ""SEC. 13. Use of a Stolen Number Plate or Readable Number Plate. - Without prejudice to criminal prosecution for violation of existing laws, the use of a stolen number plate or readable number plate in a motorcycle shall be punished with a fine of not more than Twenty thousand pesos (P20,000.00)."" SEC. 7. Section 19 of Republic Act No. 11235 is hereby amended to read as follows: ""SEC.', 'Number Plate. - If the number plate or readable number plate of a motorcycle is lost, damaged, or stolen, the owner of such motorcycle shall immediately report the same to the LTO and the PNP through the Joint PNP and LTO Operations and Control Center, and request a replacement number plate. Failure of the owner to report the same shall subject the owner to a fine of not less than Twenty thousand pesos (P20,000.00) but not more than Fifty thousand pesos (P50,000.00). However, if the lost, damaged, or stolen number plate or readable plate is used in the commission with an offense penalized under the Revised Penal Code or special penal laws, the failure of the owner to report within three (3) days that the motorcycle is lost, damaged, or stolen, shall subject the owner to a penalty of imprisonment of arresto mayor or prison correccional. SEC. 12. Erasing,', 'the PNP with the required clearances from the LTO upon proof of ownership, payment of the costs of seizure, and compliance with the requirement for a number plate or readable number plate."" SEC. 4. Section 11 of Republic Act No. 11235 is hereby amended to read as follows: ""SEC. 11. Loss of Number Plate or Readable Number Plate. - If the number plate or readable number plate of a motorcycle is lost, damaged, or stolen, the owner or possessor of such motorcycle shall report the same to the LTO and the PNP through the Joint PNP and LTO Operations and Control Center within seventy-two (72) hours from discovery of such loss or damage, and request a replacement number plate. Failure of the owner to report the same shall subject the owner to a fine of not more than Five thousand pesos (P5,000.00). If the lost, damaged, or stolen number plate or readable number plate', ""be firmly affixed to the motor vehicle in such a manner as will make it entirely visible and always legible. Except in the case of dealer's number plates which may be used successively on various motor vehicles in stock, no person shall transfer number plates from one motor vehicle to another. No dealer's number plate shall be used on any motor vehicle after said vehicle has been sold and delivered to a purchaser, and no dealer shall allow such dealer's number plates to be used on any motor vehicle after its sale and delivery to a purchaser. CHAPTER III.OPERATION OF MOTOR VEHICLES ARTICLE I.License to Drive Motor Vehicles SEC. 19. Duty to procure license.Except as otherwise specifically provided in this Act, no person shall operate any motor vehicle without first procuring a license drive a motor vehicle for the current year, nor while such license is delinquent, invalid, suspended or revoked. The license shall be carried by the driver at all times when operating a motor"", 'the new owner to a fine of not more than Five thousand pesos (P5,000): Provided, That no seizure shall be made E-Library - Information At Your Fingertips: Printer Friendly https://elibrary.judiciary.gov.ph/thebookshelf/showdocsfriendly/2/99056 1 of 5 10/17/2025, 11:10 PM solely on the basis of the buyer\'s failure to comply with the requirements of this section."" SEC. 2. Section 5 of Republic Act No. 11235 is hereby amended to read as follows: ""SEC. 5. Bigger, Readable, and Color-Coded Number Plates. - The LTO shall issue a bigger, readable, and color-coded number plate for every motorcycle, following the font style and size prescribed in the implementing rules and regulations (IRR) of this Act. The information on the number plates shall be readable from the back', 'October 2. Two-wheeled vehicles a. Three (3) numeric characters and three (3) alpha characters 528 ABC LAST DIGIT vehicle ending 8 must be registered in August 2nd TO THE LAST DIGIT OF THE PLATE NUMBER - refers to the week the vehicle must be registered. 2nd to the last or middle digit of 2 must register between 1st to 7th working day or 1st week of August 19 b. Two (2) alpha characters and five (5) numeric characters BA 13599 LAST DIGIT vehicle ending 9 must be registered in September 2nd TO THE LAST DIGIT OF THE PLATE NUMBER - 2nd to the last digit must register the vehicle between 22nd to the last working day or 4th week of September c. Four (4) numeric characters and two (2) alpha characters 5353 AB LAST DIGIT vehicle ending 3 must be registered in March 2nd TO THE LAST DIGIT OF THE PLATE NUMBER  refers to the week the vehicle must be registered. 2nd to the last digit of 5 must register between 8th and', 'but not more than One hundred pesos (P100,000.00), or both. If a person knowingly sells or buys an erased, tampered, altered, forged or imitated number plate or readable number plate, both such buyer and seller shall be punished by prison mayor as provided under the Revised Penal Code. However, if the person who sells or buys the number plate proves that he or she has no knowledge that it was erased, tampered, altered, forged or imitated, he or she shall be punished by arresto mayor. SEC. 13. Use of a Stolen Number Plate or Readable Number Plate. - The use of a stolen number plate or readable number plate in a motorcycle shall be punished by prison mayor as provided under the Revised Penal Code, or a fine of not less than Fifty thousand pesos (P50,000.00) but not more than One hundred thousand pesos (P100,000.00), or both', 'photocopy of company issued ID with photo and signature if requesting party is not available - Requesting Party - Requesting Party 2. Request from private entities, bank, foreign embassies, and financial institutions  Original letter request  Original supporting legal documents (Police Report, Court Order, Subpoena, Proceeding Filed or consent from the Motor Vehicle owner)  Company Identification Card / Original and one (1) copy of any issued ID with photo and signature of the requesting party and the Motor Vehicle owner - Requesting Party - Philippine National Police (PNP), Ombudsman, Court - Requesting Party Note: In this chapter, in case of conflict in text between this manual and the LTO Citizens Charter, the latter shall prevail. 17 MOTOR VEHICLE REGISTRATION SCHEDULE The following is the System of Operation in the monthly staggered registration of motor vehicles pursuant to Administrative Order No. 84A0-003: The Last Digit of the plate number determines the monthly schedule of registration. The middle numbers (3', 'scheme of the readable number plates for every region in the Philippines where a motorcycle is registered for quick and easy identification. The readable number plates must be displayed in both the front and back sides of a motorcycle and shall be made of suitable and durable material as determined by the LTO. The utilization of voluntary and paid labor from prisoners shall be among the requirements to bid for the procurement of the number plates under this Act. SEC. 6. Registry of Motorcycles. - The LTO shall maintain a registry of motorcycles in a database to facilitate information retrieval for official investigation and law enforcement purposes. The registry of motorcycles shall include, but not limited to, the following information: name of motorcycle owner, motorcycle owner\'s driver\'s license number, motorcycle owner\'s address and contact details, motorcycle identification number, motorcycle plate number, motorcycle body color, motorcycle brand/make. In the registry of motorcycles, the LTO shall observe at all time Republic Act No. 10173 of the ""Data', 'same shall subject the owner to a fine of not more than Five thousand pesos (P5,000.00). If the lost, damaged, or stolen number plate or readable number plate is used in connection with an offense penalized under the Revised Penal Code or special penal laws, the failure of the owner to report within three (3) days that the motorcycle is lost, E-Library - Information At Your Fingertips: Printer Friendly https://elibrary.judiciary.gov.ph/thebookshelf/showdocsfriendly/2/99056 2 of 5 10/17/2025, 11:10 PM damaged, or stolen, shall subject the owner to a fine of not more than Ten thousand pesos (P10,000.00)."" SEC. 5. Section 12 of Republic Act No. 11235 is hereby amended to read as follows: ""SEC. 12. Erasing, Tampering,', 'certificate.If inspection, as provided in paragraph (6) of Section hereof, any motor vehicle is found to be unsightly, unsafe E-Library - Information At Your Fingertips: Printer Friendly https://elibrary.judiciary.gov.ph/thebookshelf/showdocsfriendly/2/26188 12 of 31 10/17/2025, 11:21 PM overloaded, improperly marked or equipped, or otherwise unfit to be operated, or capable of causing excessive damage to the highways, or not conforming to minimum standards and specifications, the Commissioner may refuse to register the said motor vehicle, or if already registered, may require the number plates thereof to be surrendered to him, and upon seventy-two hours notice to the owner of the motor vehicle, suspend such registration until the defects of the vehicle are corrected and/or the minimum standards and specifications fully complied with. Whenever it shall appear from the records of the Commission that during any', ""TRAFFIC VIOLATION RECEIPT NAME OF APPREHENDED DRIVER/ OPERATOR VIOLATIONS DRIVER'S LICENSE NUMBER MV PLATE NUMBER REMARKS 1 2 3 4 5 6 7 8 9 10 11 12 13 14 15 16 17 18 19 20 Prepared by: Certified Correct: _______________________________ Name and Signature _______________________________ Name and Signature ______________________________ Position ______________________________ Position E-Library - Information At Your Fingertips: Printer Friendly"", 'that is not yet registered with the LTO is used in connection with an offense punishable under the Revised Penal Code or special penal laws, the maximum penalty of the relevant offense shall be imposed on the offenders. SEC. 5. Bigger, Readable and Color-Coded Number Plates. - The LTO shall issue a readable number plate for every motorcycle. The LTO shall, in the implementing rules and regulations (IRR) of this Act, determine the font style and size of the bigger, readable and color-code number plates: Provided, That the contents of the number plates shall be readable from the front, the back, and the side of the motorcycle from a distance of at least fifteen (15) meters from the motorcycle. The LTO shall also devise a color scheme of the readable number plates for every region in the Philippines where a motorcycle is registered for quick and easy identification. The readable number plates must be displayed in both the front and back sides of', 'in accordance with R.A. No. 4136, as amended. SECTION III. Use of Number Plates. Every motorcycle or scooter shall, at all times display in conspicuous places, the reflective number plates issued by the Land Transportation Office (LTO). The number plates shall be kept clean and shall be firmly affixed to the motor vehicle ln such a manner as will make it entirely visible and legible. SECTION IV. Duty of Driver/Rider to Have License. Except as otherwise specifically Provided by law, it shall be unlawful for any person to operate any motor vehicle without a valid license to drive a motor vehicle. The license with Restriction Code No. 1 shall be carried by the driver/rider at all times when operating a motorcycle or scooter, and shall be shown and/or surrendered for cause and upon demand by any person authorized under R.A. No 4136, as confiscate the same. SECTION V. Speed Limit. The uniform speed limit', 'of a motorcycle without a number plate or readable number plate shall be punished with a fine of not more than Five thousand pesos (P5,000.00). A motorcycle driver without a number plate or a readable number plate shall be stopped and seized by law enforcers, and immediately surrendered to the Philippine National Police (PNP): Provided, That no seizure shall be made upon showing proof of ownership and registration and that the owner is not at fault for the non-installation of a number plate or readable plate. Any apprehension must be reported immediately to the LTO, the PNP, and the Department of Information and Communications Technology (DICT) through the Joint LTO and PNP Operations and Control Center. The owner of such motorcycle may redeem the seized motorcycle from the PNP with the required clearances from the LTO upon proof of ownership, payment of the costs of seizure, and compliance with the requirement for a number plate or readable number plate.""', 'the commission of a crime or offense shall be impounded by the PNP as evidence in custodia legis (property take into the courts custody during the pendency of litigation over it) in a secured impounding center provided by the Local Government Unit (LGU) until the termination of the case. Such motorcycle shall then be forfeited in favor of the government, unless the court finds that the defendant is not guilty of the offense charged or such motorcycle belongs to an innocent third party. 69 Republic Act No. 11235 Loss of Number Plate  must be reported to LTO within 72 hours VIOLATION PENALTY Failure of the owner to report a lost, damaged or stolen motorcycle plate and apply for replacement Fine of P20,000.00  P50,000.00 Failure to report the lost, damaged or stolen number plate or readable number plate and used in a crime Arresto Mayor (1 month and 1 day to 6 months) to Prision Correccional (6 months', ""TRAFFIC VIOLATION RECEIPT APPREHENDED DRIVER/ OPERATOR DRIVER'S LICENSE NUMBER MV PLATE NUMBER FINAL DISPOSITION/RESOLUTION OF VIOLATION (Indicate the specific violations REMARKS ADMITTED CONTESTED AFFIRMED DISMISSED Prepared by: Certified Correct: _______________________________ Name and Signature _______________________________ Name and Signature ______________________________ Position ______________________________ Position E-Library - Information At Your Fingertips: Printer Friendly"", ""each change of registration, from private to for hire or vice-versa; revision of gross weight rating, change of tire size; transfer of ownership; replacement of a lost registration certificate, number plate, driver's license or permit; badge; preparation of affidavit or certified copy of records, or for any similar circumstances requiring the issue, revision, or reissue of a certificate of registration, driver's license, badge, permit, or other document, a fee of two pesos shall be collected. E-Library - Information At Your Fingertips: Printer Friendly https://elibrary.judiciary.gov.ph/thebookshelf/showdocsfriendly/2/26188 11 of 31 10/17/2025, 11:21 PM The replacement of a lost or utterly spoiled certificate, number plate, license, badge or permit shall render the original invalid. In case of request in writing for certification of data or facts involving two or more"", 'the motor vehicle, suspend such registration until the defects of the vehicle are corrected and/or the minimum standards and specifications fully complied with. Whenever it shall appear from the records of the Commission that during any twelve- month period more than three warnings for violations of this Act have been given to the owner of a motor vehicle, or that the said owner has been convicted by a competent court more than once for violation of such laws, the Commissioner may, in his discretion, suspend the certificate of registration for a period not exceeding ninety days and, thereupon, shall require the immediate surrender of the number plates. Whenever a motor vehicle is found to be underweighed the owner thereof shall pay the difference in the registration fees corresponding to the shortage in weight plus a fifty per cent surcharge, and until such payment is made, the certificate of registration of the motor vehicle concerned shall be suspended by the Commissioner. After two such suspensions, re-registration of the vehicle concerned for one year may be', ""Use of Licenses, Number Plates, Etc. SEC. 31. Imitation and false representations.No person shall make or use or attempt to make or use a driver's license, badge, certificate of registration, number plate, tag, or permit in imitation or similitude of those issued under this Act, or intended to be used as or for a legal license, badge, certificate, plate, tag or permit, or with intent to sell or otherwise dispose of the same to another. No person shall falsely or fraudulently represent as valid and in force any driver's license, badge, certificate, plate, tag or permit issued under this Act which is delinquent or which has been revoked or suspended. No person shall, knowingly and with intent to deceive, make one or more false or fraudulent statements in an application for the registration of vehicles, or for a driver's license. ARTICLE III.Passengers and Freight SEC. 32. Exceeding registered capacity.No person operating any"", 'in the monthly staggered registration of motor vehicles pursuant to Administrative Order No. 84A0-003: The Last Digit of the plate number determines the monthly schedule of registration. The middle numbers (3 digit)/2nd to the last number (4 and 5 digit) shall determine the working days, within the week when the registration of the vehicle shall be renewed. 1st week (Any working day from 1st to 7th day of the registration month) 1, 2, 3 2nd week (Any working day from 8th to 14th day of the registration month) 4, 5, 6 3rd week (Any working day from 15th to 21st day of the registration month 7, 8 4th week (Any working day from 22nd to 31st day of the registration month) 9,0 MONTHLY SCHEDULE LAST DIGITS OF PLATE JANUARY 1 FEBRUARY 2 MARCH 3 APRIL 4 MAY 5 JUNE 6 JULY 7 AUGUST 8 SEPTEMBER 9 OCTOBER 0 18 Below are examples of the registration schedule 1. Four-wheeled vehicles a. Three (3) alpha characters', 'LGU until the termination of the case. Such motorcycle shall then be forfeited in favor of the government, unless the court finds that the defendant is not guilty of the offense charged or such motorcycle belongs to an innocent third party. The Department of Interior and Local Government (DILG) shall ensure and enforce that all LGUs set aside land and establish a secured impounding center that shall be under the control of the PNP to store the impounded motorcycles in accordance with this Act. They shall also have a computerized/digitized data to see to it that all impounded or released motorcycles are duly recorded and such data shall be shared on a real-time basis to the Joint PNP and LTO Operations and Control Center. SEC. 11. Loss of Number Plate or Readable Number Plate. - If the number plate or readable number plate of a motorcycle is lost, damaged, or stolen, the owner of such motorcycle shall immediately report the same to the LTO and the', 'That the Commissioner of Land Transportation shall provide appropriate dealer\'s number plates corresponding to the classification of vehicles hereinbelow described, and registration fee for every set of such dealer\'s number plates shall be in accordance with the following schedule of rates: Two hundred pesos for each truck or trailer; One hundred pesos for each passenger automobile; and Twenty pesos for each motorcycle and the like. h. Registration under the ""Government Motor Vehicle"" classification shall be free of charge, upon request of the chief of bureau or office concerned. i. Motor vehicles not intended to be operated or used upon any public highway, or which are operated on highways not constructed or maintained by the Government, or are intended not to be used or operated at all, shall be exempt from payment of the registration fees provided in this Act, but shall each pay an annual recording and service fee of fifteen pesos: Provided, however, That no E-Library - Information At Your Fingertips: Printer Friendly', 'the former, within five (5) days from the date of the sales invoice for brand new locally purchased motorcycles, or from the Certificate of Stock Reported (CSR) report date for new or used imported motorcycles. Any sale or disposition thereafter shall be reported by the owner to the LTO within three (3) days upon such sale/disposition, by presenting an original copy and furnishing a machine copy of the notarized Deed of Sale or similar document evidencing the disposition of the motorcycle, to the LTO office where the latest Certification of Registration was issued. 65 Republic Act No. 11235 Metal plate shall be 235mm in width and 135mm height, and made of suitable and durable aluminum substrate material with reflectorized background and security features. The font size for all alpha numeric is 60 mm tall. Decal plate shall be 135mm in width and 85mm in height, and made of suitable and durable sticker material with reflectorized', 'black alphanumeric characters. c. Government Motorcycle - with white background and red alphanumeric characters. d. Diplomatic Motorcycle - with white background and blue alphanumeric characters. The number plates shall be kept clean and cared for, and shall be firmly affixed to the motorcycles. FINES and PENALTIES Failure to Register or to Report Sale or Disposition VIOLATION PENALTY Failure of the buyer to register the motorcycle to LTO within five (5) days from acquisition of ownership. Failure of the subsequent seller to notify the LTO within three (3) days from the sale of motorcycle Fine of P20,000.00 - P50,000.00 or, Arresto Mayor (1 month and 1 day to 6 months) to Prision Correccional (6 months and 1 day to 6 yrs.), or both Driving without a Number Plate or Readable Number Plate VIOLATION PENALTY Driving without a number plate or a readable number plate Fine of P50,000.00 -', '- Registered Motor Vehicle owner, Financing institution - Land Transportation Office (LTO) District Office/Extension Office, Motor Vehicle Inspection Center 16 REQUIREMENTS WHERE TO SECURE 5. Lost or Replacement Plates/Tags/ Sticker/RFID Sticker  Original Affidavit of loss or mutilated plate/ sticker/ RFID sticker  Original and one (1) photocopy of any valid government issued ID with photo and signature - Applicant - Applicant VIII. RE-STAMPING OF ENGINE/CHASSIS NUMBER REQUIREMENTS WHERE TO SECURE  Original Certificate of Registration (CR)  Affidavit of Owner stating the reason/s or need for re-stamping - Motor Vehicle Owner - Motor Vehicle Owner IX. REQUEST FOR MOTOR VEHICLE REGISTRATION 1. Request from Government Agency  Original letter request  Authorization letter and one (1) photocopy of company issued ID with photo and signature if requesting party is not available - Requesting Party - Requesting Party 2. Request from private entities, bank, foreign embassies, and financial', 'FEBRUARY 2 MARCH 3 APRIL 4 MAY 5 JUNE 6 JULY 7 AUGUST 8 SEPTEMBER 9 OCTOBER 0 18 Below are examples of the registration schedule 1. Four-wheeled vehicles a. Three (3) alpha characters and four (4) numeric characters ABC 1435 LAST DIGIT must be registered in May 2nd TO THE LAST DIGIT OF THE PLATE NUMBER - refers to the week the vehicle must registered The vehicle must be registered between the 1st and 7th working day of May b. Three (3) alpha characters and three (3) numeric characters BCA 170 LAST DIGIT vehicle ending 0 must be registered in October 2nd TO THE LAST DIGIT OF THE PLATE NUMBER - refers to the week the vehicle must be registered. 2nd to the last or middle digit of 7 must register between 15th to 21st working day or 3rd week of October 2. Two-wheeled vehicles a. Three (3) numeric characters and three (3) alpha characters 528 ABC LAST DIGIT vehicle ending 8 must be registered in August 2nd TO THE LAST', 'vehicles; (d) Owner refers to any person who owns or is the registered owner of a motorcycle. Under this Act, it also refers to any person who has actual control and possession of a motorcycle, whether it is registered or not; and (e) Number plate refers to the regular motor vehicle license plate issued by the Land Transportation Office (LTO) for a motorcycle, bearing the standard alphanumeric characters in accordance with Republic Act No. 4136, as amended, otherwise known as the ""Land Transportation and Traffic Code"". E-Library - Information At Your Fingertips: Printer Friendly https://elibrary.judiciary.gov.ph/thebookshelf/showdocsfriendly/2/86631 1 of 7 10/17/2025, 11:08 PM SEC. 4. Registration by the Owner. - The owner of a motorcycle shall register his or her motorcycle with the LTO within five (5) days from such acquisition of', ""Position E-Library - Information At Your Fingertips: Printer Friendly https://elibrary.judiciary.gov.ph/thebookshelf/showdocsfriendly/2/96764 12 of 14 10/17/2025, 10:17 PM Appendix 3 UPDATED REPORT ON APPREHENSION CASES __________________________________ Date NAME OF AGENCY/LGU: _______________________________ TRAFFIC VIOLATION RECEIPT APPREHENDED DRIVER/ OPERATOR DRIVER'S LICENSE NUMBER MV PLATE NUMBER FINAL DISPOSITION/RESOLUTION OF VIOLATION (Indicate the specific violations REMARKS ADMITTED CONTESTED AFFIRMED DISMISSED Prepared by: Certified Correct:"", 'capability to bear and showcase a readable number plate required under section 5 of this IRR. Owners of existing motorcycle units which do not have space for front plate are required to provide a bracket or any other provision where the same shall be installed. 71  Violations in Connection with Licensing  Violations in Connection with Motor Vehicle Registration / Renewal / Operation  Violations in Connection with Dimensions, Specifications, Weight and Load Limits  Violations in Connection with Franchise 72 Chapter III Fines and Penalties for Violations of Laws, Rules and Regulations Governing Land Transportation TEMPORARY OPERATORS PERMIT (TOP) Serves as a permit to operate a motor vehicle for a period of seventy- two (72) hours only. All apprehensions are deemed admitted unless contested by filling a written contest within five (5) days from date of apprehension. Failure of the driver to pay the corresponding penalty within fifteen (15) days from the date of apprehension shall cause automatic suspension of his drivers license for a period of thirty (30) days from the date of apprehension, in addition to the fines']","According to the provided context, covering a number plate is not explicitly mentioned as a separate offense. However, it can be inferred that it is a form of ""concealing a number plate"" which is punishable under Section 6 of Republic Act No. 12209.

For concealing a number plate, the penalty is:

Fine of P50,000.00 to P100,000.00, or Prision Mayor (6 years and 1 day to 20 years), or both.

Note: The context does not specify the exact penalty for a first offense, but it mentions the range of penalties for concealing a number plate.","Covering or altering over a motorcycle plate is strictly prohibited. Penalties include a Php50,000 to Php100,000 fine and revocation of registration.",0.875,0.5999485195380782
Can I park my car facing the opposite direction of traffic?,"['ANGLE PARKING Where angle parking is required, vehicles shall be parked at an angle of about forty- five degrees (45) to the curb and with one of the front wheels touching or within one foot of the curb. PARALLEL PARKING A method of parking a vehicle parallel to the road and in line with other parked vehicles. parallel parking initially requires driving slightly past the parking space, parallel to the parked vehicles in front of that space, keeping a safe distance, then followed by reversing into that space. 124 Before Starting and Driving on the Road PERPENDICULAR PARKING Means parking the vehicle on the side of another vehicle, perpendicular to a wall or curb. This parking area is mostly located in malls or garages with limited space. PARKING PROHIBITIONS IN SPECIFIED PLACES No driver shall park a vehicle, or permit it to stand, whether attended or unattended, upon a highway in any of the following places: a. Within an intersection b. On a crosswalk c. Within six meters of the intersection of curb', 'except that, upon highways laned for traffic and upon one-way highways, a left turn shall be made from the left lane of traffic in the direction in which the vehicle E-Library - Information At Your Fingertips: Printer Friendly https://elibrary.judiciary.gov.ph/thebookshelf/showdocsfriendly/2/26188 25 of 31 10/17/2025, 11:21 PM is proceeding. c. For the purpose of this section, the center of the intersection shall mean the meeting point of the medial lines of the highways intersecting one another, except when it is occupied by a monument, grass plot or any permanent structure, other than a traffic control device. SEC. 46. Parking prohibited in specified places.No driver shall park a vehicle, or permit it to stand, whether attended or unattended, upon a highway in any of the following places: a. Within an intersection b. On a crosswalk c.', 'b. The signal herein required shall be given by means of extending the hand and arm beyond the left side of the vehicle, or by an approved mechanical or electrical signal device. ARTICLE IV.Turning and Parking SEC. 45. Turning at intersections. a. The driver of a vehicle intending to run to the right at an intersection shall approach such intersection in the lane for traffic nearest to the right-hand side of the highway and, in turning, shall keep as close as possible to the right-hand curb or edge of the highway. b. The driver of a vehicle intending to turn to the left shall approach such intersection in the lane for traffic to the right of and nearest to the center line of the highway, and, in turning, shall pass to the left of the center of the intersection, except that, upon highways laned for traffic and upon one-way highways, a left turn shall be made from the left lane of traffic in the direction in which the vehicle E-Library -', ""the driver of such other vehicles of the intention to make such movement. Source: Canva Photos 121 Before Starting and Driving on the Road OVERTAKING AND PASSING RESTRICTIONS 1. The driver of a vehicle shall not drive to the left side of the centerline of a highway in overtaking or passing another vehicle proceeding in the same direction, unless such left side is clearly visible, and is free of oncoming traffic for a sufficient distance ahead to permit such overtaking or passing to be made in safety. 2. The driver of a vehicle shall not overtake or pass another vehicle proceeding in the same direction, when approaching the crest of a grade, not upon a curve in the highway, where the driver's view along the highway is obstructed within a distance of five hundred feet ahead, except on a highway having two or more lanes for movement of traffic in one direction where the driver of a vehicle may overtake or pass another vehicle: Provided, that on a highway within a business or residential"", 'park a vehicle, or permit it to stand, whether attended or unattended, upon a highway in any of the following places: a. Within an intersection b. On a crosswalk c. Within six meters of the intersection of curb lines. d. Within four meters of the driveway entrance to and fire station. e. Within four meters of a fire hydrant f. In front of a private driveway g. On the roadway side of any vehicle stopped or parked at the curb or edge of the highway h. At any place where official signs have been erected prohibiting parking. SEC. 47. Parked vehicle.Whenever a motor vehicle is parked unattended on any highway, the driver thereof must turn off the ignition switch and stop the motor and notch effectively the hand brake. ARTICLE V.Miscellaneous Traffic Rules SEC. 48. Reckless driving.No person shall operate a motor vehicle on any highway recklessly or without reasonable caution considering the width, traffic, grades, crossing, curvatures, visibility and', 'the driver of any vehicle being operated on a ""through highway"" from the duty of driving with due regard for the safety of vehicles entering such ""through highway"" nor as protecting the said driver from the consequence of an arbitrary exercise off such right-of-way. Source: Canva Photos Source: Canva Photos Source: Canva Photos 116 Before Starting and Driving on the Road DRIVING ON THE RIGHT SIDE OF THE HIGHWAY Unless a different course of action is required in the interest of the safety and the security of life, person, or property, or because of unreasonable difficulty of operation in compliance herewith, every person operating a motor vehicle or an animal-drawn vehicle on a highway shall pass to the right when meeting persons or vehicles coming toward him/her, and to the left when overtaking persons or vehicles going the same direction, and when turning to the left in going from one highway to another, every vehicle shall be conducted to the right of the center of the intersection of the highway. CLASSIFICATION', 'Before Starting and Driving on the Road RIGHT-OF-WAY RULES Republic Act No. 4136 enumerates and expressly defines the Right- of-Way as: When two vehicles approach or enter an intersection at approximately the same time, the driver of the vehicle on the left shall yield the right of way to the vehicle on the right, except as otherwise hereinafter provided. The driver of any vehicle travelling at an unlawful speed shall forfeit any right of way which he/she might otherwise have hereunder. The driver of a vehicle (Vehicle B) approaching but not having entered an intersection, shall yield the right- of-way to a vehicle within such intersection or turning therein to the left across the line of travel of such first-mentioned vehicle, provided the driver of the vehicle turning left has given a plainly visible signal of intention to turn as required in this Act. n The driver of any vehicle upon a highway within a business or residential district shall yield the', 'the movement of traffic in one direction, the driver of a vehicle may overtake and pass another vehicle on the right. Nothing in this section shall be construed to prohibit a driver overtaking and passing, upon the right, another vehicle which is making or about to make a left turn. SEC. 40. Driver to give way to overtaking vehicle.The driver of a vehicle about to be overtaken and passed by another vehicle approaching from the rear shall give way to the overtaking vehicle on suitable and audible signal being given by the driver of the overtaking vehicle, and shall not increase the speed of his vehicle until completely passed by the overtaking vehicle. SEC. 41. Restrictions on overtaking and passing. a. The driver of a vehicle shall not drive to the left side of the center line of a highway in overtaking or passing another vehicle proceeding in the same direction, unless such left side is clearly visible, and is free of oncoming traffic for a sufficient distance ahead to permit', 'zone."" ARTICLE III.Right of Way and Signals SEC. 42. Right of way. a. When two vehicles approach or enter an intersection at approximately the same time, the driver of the vehicle on the left shall yield the right of way to the vehicle on the right, except as otherwise hereinafter provided. The driver of any vehicle traveling at an unlawful speed shall forfeit any right of way which he might otherwise have hereunder. b. The driver of a vehicle approaching but not having entered an intersection, shall yield the right of way to a vehicle within such intersection or turning therein to the left across the line of travel of such first-mentioned vehicle, provided the driver of the vehicle turning left has given a plainly visible signal of intention to turn as required in this Act. c. The driver of any vehicle upon a highway within a business or residential district shall yield the right of way to a pedestrian crossing such highway within a cross walk, except at intersections where the movement of', 'driver of the vehicle turning left has given a plainly visible signal of intention to turn as required in this Act. n The driver of any vehicle upon a highway within a business or residential district shall yield the right-of-way to a pedestrian crossing such highway within a crosswalk, except at intersections where the movement of traffic is being regulated by a peace officer or by traffic signal. Every pedestrian crossing a highway within a business or residential district, at any point other than a crosswalk shall yield the right-of- way to vehicles upon the highway. 115 Before Starting and Driving on the Road The driver of a vehicle upon a highway shall bring to a full stop such vehicle before traversing any ""through highway"" or railroad crossing: Provided, that when it is apparent that no hazard exists, the vehicle may be slowed down to five miles per hour instead of bringing it to a full stop. F The driver of a vehicle entering a highway from a private road or drive shall yield the', 'vehicle from one point to another 2) DRIVING ON THE ROAD A. Starting off, driving ahead, and stopping B. Driving in different environments and situations C. Choice of speed in different situations D. Driving uphill and downhill E. Driving through bends F. Approaching and crossing railway G. Lane shifting and choices of lanes H. Making a U-Turn I. Meeting oncoming traffic J. Overtaking and passing K. Driving in different kinds of junction with or without signals and with or without restricted view L. Stopping M. Dealing with pedestrians, motorcyclists, cyclists, trucks, buses, jeepneys and other motor vehicles N. Rush hour and heavy traffic techniques O. Merging with traffic and driving off from a heavy traffic 3) PARKING ON LEVEL GROUND, DOWNHILL AND UPHILL (WITH CURB AND WITHOUT CURB) 59 Road Traffic Signs ROAD TRAFFIC SIGNS OUTLINE: A. REGULATORY SIGNS 1. Priority 2. Directional 3. Prohibitive / Restrictive 4. Speed 5. Parking and Stopping', 'of a barangay with an ideal width of more than 4.50 meters. 5. Farm-to-Market Road - access road from farm to transport of products to the market outlet with an ideal width of more than 4.50 meters. Source: Canva Photos 117 Before Starting and Driving on the Road TURNING AT INTERSECTIONS MAKING THE RIGHT TURN 1. Proceed to the right lane well in advance. 2. Reduce to a safe speed and signal your intention to turn. 3. Check the traffic approaching from the left and pedestrian or any other obstruction. 4. At the turn position, keep your rear right wheel nearest to the curb or edge of the highway. MAKING THE LEFT TURN 1. Vehicle B - Drive your vehicle to the lane, advance to the intersection where you intend to make a turn. 2. Vehicles A and B - Reduce to a safe speed and signal your intention to turn. 3. Vehicle B - If stopped, keep your wheels pointed straight ahead and wait to cross the intersection.', '2. Vehicles A and B - Reduce to a safe speed and signal your intention to turn. 3. Vehicle B - If stopped, keep your wheels pointed straight ahead and wait to cross the intersection. 4. Vehicle B - Make your turn into the lane nearest to the center line. Always be aware of approaching long vehicles in an intersection. 5. Vehicle B - Approach right- turning vehicle (Vehicle A), coming from the opposite direction, so that they are on your right. 118 Before Starting and Driving on the Road LEFT TURN FROM ONE-WAY STREET TO TWO-WAY STREET (VEHICLE A) 1. Signal your intention to turn left. 2. Look ahead to the left or to the right before making a turn. 3. Move towards the left-most lane. 4. Watch out for motorcycles, bicycles, pedestrians, and obstructions. 5. Keep to the left-most lane while turning. LEFT TURN FROM ONE-WAY STREET TO ONE-WAY STREET (VEHICLE A)', 'into the muffler 19. A steady green traffic light means: vehicles can proceed 20. What should you do if you make a wrong turn on a one-way road? Back up if possible or safely make a U-turn 21. If you are in doubt while approaching an intersection, you must: yield the right-of-way to avoid road crash 180 Professional  Light (B, B1, B2) QUESTION ANSWER 22. Can a motorist park in a pedestrian lane? NO, not in any circumstances Parking in a pedestrian lane or crosswalk is in violation of traffic rules and regulations (R.A. No. 4136) 23. Is driving a private vehicle on a yellow bus lane allowed? No, except when turning or going into the garage within 100 meters upon entering the yellow bus lane 24. If your cargo exceeded one (1) meter from the body of your vehicle, you must: hang a red flag with at least 30x30 centimeters at the edge of the', 'nearest to be right hand side of the highway and, in turning, to keep as close as possible to the right hand curve or edge of highway * Reckless driving for 3rd and succeeding offenses * Submission of fake documents in relation to the application for a driver\'s license (New/Renewal) * Failure to yield the right to way to a pedestrian crossing such highway within a crosswalk except at intersection where the movement of traffic is regulated by a peace officer or by traffic signal1/ * Disregarding Traffic Signs - include other traffic violations not mentioned in the other categories but fall under this violation * Failure to stop before traversing a ""through highway"" or railroad crossing * Illegal turn - Failure of the driver of a motor vehicle intending to run to the right at an intersection to approach such intersection in the lane for traffic nearest to be right hand side of the highway and, in turning, to keep as close as possible to the right hand curve or edge of highway * Overtaking when left side is not visible', 'on a highway having two or more lanes for movement of traffic in one direction where the driver of a vehicle may overtake or pass another vehicle: Provided, that on a highway within a business or residential district, having two or more lanes for movement of traffic in one direction, the driver of a vehicle may overtake or pass another vehicle on the right. Source: Canva Photos 122 Before Starting and Driving on the Road 3. The driver of a vehicle shall not overtake or pass any other vehicle proceeding in the same direction, at any railway grade crossing, not at any intersection of highways unless such intersection or crossing is controlled by traffic signal, or unless permitted to do so by a watchman or a peace officer, except on a highway having two or more lanes for movement of traffic in one direction where the driver of a vehicle may overtake or pass another vehicle on the right. Nothing in this section shall be construed to prohibit a driver overtaking or passing upon the right another vehicle which', 'Overtake only at a safe and manageable speed.  Always consider the quality of rear tires when overtaking on a curve. Inferior tires will cause the motorcycle to skid. 123 Before Starting and Driving on the Road PROPER PARKING DOWNHILL AND UPHILL PARKING With a curb - When parking downhill or uphill, turn the front wheels into the curb or toward the sidewalk. When parking on a sloped driveway, turn the wheels so that the vehicle will not roll into the street if the parking brake fails. Always engage the parking brakes. If possible, leave the vehicle in gear position. Without a curb  The main purpose of parking is to avoid road crashes. Park your vehicle in such a way that whenever the parking brake is inadvertently released, the vehicle will roll out off the road and not into the road. ANGLE PARKING Where angle parking is required, vehicles shall be parked at an angle of about forty- five degrees (45) to the curb and with one of the front wheels touching or within one foot of', 'peace officer, except on a highway having two or more lanes for movement of traffic in one direction where the driver of a vehicle may overtake or pass another vehicle on the right. Nothing in this section shall be construed to prohibit a driver overtaking or passing upon the right another vehicle which is making or about to make a left turn. d. The driver of a vehicle shall not overtake or pass, or attempt to pass, any other vehicle, proceeding in the same direction, between any points indicated by the placing of official temporary warning or caution signs indicating that men are working on the highway. e. The driver of a vehicle shall not overtake or pass, or attempt to overtake or pass, any other vehicle proceeding in the same direction in any ""no-passing or overtaking zone."" ARTICLE III.Right of Way and Signals SEC. 42. Right of way. a. When two vehicles approach or enter an intersection at approximately the same time, the driver of the vehicle', 'of any vehicle being operated on a ""through highway"" from the duty of driving with due regard for the safety of vehicles entering such ""through highway"" nor as protecting the said driver from the consequence of an arbitrary exercise of such right of way. SEC. 44. Signals on starting, stopping or turning. a. The driver of any vehicle upon a highway, before starting, stopping or turning from a direct line, shall; first see that such movement can be made in safety, and if any pedestrian may be affected by such movement, shall give a clearly audible signal by sounding the horn, and whenever the operation of any other vehicle approach-in or following may be affected by such movement, shall give a signal plainly visible to the driver of such other: vehicles of the intention to make such movement. b. The signal herein required shall be given by means of extending the hand and arm beyond the left side of the vehicle, or by an approved mechanical or electrical signal device. ARTICLE IV.Turning', 'out for motorcycles, bicycles, pedestrians, and obstructions. 5. Keep to the left-most lane while turning. LEFT TURN FROM ONE-WAY STREET TO ONE-WAY STREET (VEHICLE A) 1. Signal your intention to turn left. 2. Look ahead for traffic to check if the way is clear. 3. Position your vehicle nearest to the curb upon reaching the intersection. 4. Watch out for motorcycles, bicycles, pedestrians, and obstructions. TURNING FROM ONE-WAY STREET TO ONE-WAY STREET ON RED SIGNAL 1. Check if you are allowed to make a turn on a Red Signal. If yes, safely proceed. Otherwise, STOP and wait for a Green Traffic Light. 2. Position your vehicle nearest to the curb of the intersection. 3. Signal your intention to turn. 119 Before Starting and Driving on the Road MAKING A U-TURN U-turns are risky and prohibited in some areas. When doing a U-turn: 1. Start turning from the right side of', 'Be extra cautious when approaching and passing such vehicles. Do not overtake the vehicle unless there is enough time and distance to safely complete the maneuver. Leave extra space if going uphill and stopping behind a large vehicle. There is a tendency that it may roll back when the driver releases the brake or clutch. LARGE VEHICLES Never overtake a large hauling truck that is turning left or right. Said vehicle may block all or some of the lanes. Long vehicles may straddle lanes while turning. Source: Canva Photos 141 Attitude and Behavior EMERGENCY VEHICLES Give the priority right-of-way to emergency vehicles Upon the approach of any police or fire department vehicle, or of an ambulance giving audible signal, the driver of every other vehicle shall immediately drive the same to a position as near as possible and parallel to the right-hand edge or curb of the highway, clear of any intersection of highway, and shall stop and remain in such position, unless otherwise directed by a peace officer, until such vehicle shall have', 'or pass another vehicle: Provided, That on a highway within a business or residential district, having two or more lanes for movement of traffic in one E-Library - Information At Your Fingertips: Printer Friendly https://elibrary.judiciary.gov.ph/thebookshelf/showdocsfriendly/2/26188 23 of 31 10/17/2025, 11:21 PM direction, the driver of a vehicle may overtake or pass another vehicle on the right. c. The driver of a vehicle shall not overtake or pass any other vehicle proceeding in the same direction, at any railway grade crossing, nor at any intersection of highways unless such intersection or crossing is controlled by traffic signal, or unless permitted to do so by a watchman or a peace officer, except on a highway having two or more lanes for movement of traffic in one direction where the driver of a vehicle may overtake or pass another vehicle on the right. Nothing in this section', 'the Road STARTING TO DRIVE STEERING For Motorcycle Riders  Sit comfortably and hold the handlebar firmly BACKING UP / REVERSING Reversing (also known as backing up) is the process of driving a vehicle in the reverse direction to maneuver. Rearview mirror is the standard equipment for this endeavor. Modern motor vehicles have built-in technical aids or sensors like backup cameras, while other vehicles may be equipped with the same. Success in reversing depends on correct driving posture, hearing, seeing, steering and speed control. The main problem when reversing is poor visibility resulting to road crashes. To prevent such, one can install safety equipment including cameras and sensors. The driver must also be aware of the surroundings that may pose a danger like:  Site layout  Blind spots  Pedestrians, motorists, and parked vehicles  Space and lighting  Defective safety equipment, such as camera and sensors Hands grip on the steering wheel at a 9:3 or 10:2 position to have a good and full control of the steering wheel. You', 'stand, whether attended or unattended, upon a highway in any of the following places: a. Within an intersection b. On a crosswalk c. Within six meters of the intersection of curb lines d. Within four meters of a driveway entrance to a fire station e. Within four meters of a fire hydrant f. In front of a private driveway g. On the roadway side of any vehicle stopped or parked at the curb or edge of the highway h. At any place where official signs have been displayed prohibiting parking For Motorcycle Riders  Never park downhill.  As much as possible, use the center stand when parking for longer hours.  Never forget to lock the handlebar before leaving the area.  If parking inside a mall or parking bay, see to it that there is enough maneuvering space for others and for yourself. 125 Before Starting and Driving on the Road EXPRESSWAY RULES AND REGULATIONS 1. No person or vehicle shall have any right of ingress or egress to, from or across the Limited', '""through highway"" or a ""stop intersection"" to yield right of way to all vehicles approaching in either direction on such ""through highway"". 30. Failure to give proper signal - failure to give the appropriate signal before starting, stopping or turning from a direct line. 31. Illegal turn - failure of the driver of a motor vehicle intending to run to the right at an intersection to approach such intersection in the lane for traffic nearest to be right-hand side of the highway and, in turning, to keep as close as possible to right-hand curve or edge of the highway. 32. Illegal turn - failure of the driver of a vehicle intending to turn to the left, to approach such intersection in the lane for traffic to the right of and nearest to the center line of the highway, and in, turning to pass to the left of the center of the intersection except upon highway laned for traffic and upon one-way highway. 33. Failure to stop motor and notch handbrake of', 'exists, the vehicle may be slowed down to five miles per hour instead of bringing it to a full stop. F The driver of a vehicle entering a highway from a private road or drive shall yield the right-of-way to all vehicles approaching on such highway. EXCEPTION TO THE RIGHT-OF-WAY RULE The driver of a vehicle upon a highway shall yield the right-of-way to police or fire department vehicles and ambulances when such vehicles are operated on official business and the drivers thereof sound audible signal of their approach. The driver of a vehicle entering a ""through highway"" or a ""stop intersection"" shall yield the right-of- way to all vehicles approaching to either direction on such ""through highway"": Provided, that nothing in this subsection shall be construed as relieving the driver of any vehicle being operated on a ""through highway"" from the duty of driving with due regard for the safety of vehicles entering such ""through highway"" nor as protecting the said driver', ""center line of a highway in overtaking or passing another vehicle proceeding in the same direction, unless such left side is clearly visible, and is free of oncoming traffic for a sufficient distance ahead to permit such overtaking or passing to be made in safety. b. The driver of a vehicle shall not overtake or pass another vehicle proceeding in the same direction, when approaching the crest of a grade, nor upon a curve in the highway, where the driver's view along the highway is obstructed within a distance of five hundred feet ahead except on a highway having two or more lanes for movement of traffic in one direction where the driver of a vehicle may overtake or pass another vehicle: Provided, That on a highway within a business or residential district, having two or more lanes for movement of traffic in one E-Library - Information At Your Fingertips: Printer Friendly"", ""when your vehicle is approaching a crest? Prepare to slow down and stay on your lane for a safer travel 24. Drinking any amount of alcohol while driving may: decrease your reaction time, impair your judgment, and give you a false sense of confidence 25. A green arrow traffic light means: vehicles turning on that direction shall proceed 26. Motor vehicle's horn is used to: warn other road users of your presence 27. Which vehicles have the right-of- way at a rotunda or roundabout? The vehicles within the roundabout 28. What could be a reason for a driver to lose his concentration in driving? Listening to loud music, using mobile phone or gadget, watching videos, rubbernecking, and engaging in long conversations with passenger/s 29. In a single solid yellow line, you are allowed to cross only: when turning into a driveway 30. If you are driving and you need to use your mobile phone, you should: stop at a safe side of the road to"", 'Code of the Philippines 45. If this sign is disregarded, it will constitute an offense. Regulatory Sign Directional Sign (e.g., left lane must turn left, one-way sign) 46. Why should the driver always yield to emergency vehicles with blinkers and sirens on? Because they have a priority right-of-way 47. The Right-Of -Way rule signifies: the rights of drivers on when to yield or give way to others while driving 48. When making a right turn, you should: reduce speed and stay on the outermost lane of the road then signal your intention to turn right 49. When approaching a crosswalk or pedestrian lane, you should: slow down and stop to yield to pedestrians 50. What should you do if you are stopped by an enforcer even when you believe that you did not violate any traffic rules and regulations? Stop at the roadside and politely ask the reason why you were being stopped 168 Nonprofessional  Light (B,', 'lanes 9. Turning and lane changing 10. Interaction with various road users (riders, cyclists, pedestrians, and other vehicles) - Passing stationary vehicles and pedestrians - Meeting oncoming traffic - Riding ahead of or behind other motorists - Riding side by side 11. Overtaking 12. ABCs of passing junctions - riding in different kinds of junctions (straight through, turning left or right), with or without obligation to give the right-of-way 13. Riding in dark unlighted road, wet and slippery road, sandy and loose road, steep slope, and sharp curvatures 14. Approaching, riding in, and leaving roundabouts 15. Stopping and parking 16. Riding with back ride 17. Emergency situations (tire blowout, fire, rolling over, engine overheating) 42 Course Content of Driving School  Light Vehicles COURSE CONTENT OF DRIVING SCHOOL MODULE FOR LIGHT VEHICLES PART I: THEORETICAL DRIVING COURSE I. INTRODUCTION TO DRIVING 1) Organization and mandate of LTO, LTFRB,', 'to the vehicle on the right when these vehicles approach or enter an intersection at approximately the same time. 24. Failure to yield the right of way - failure of the vehicle approaching but not having entered an intersection to yield the right of way to a vehicle within such intersection or turning therein to the left across the line of travel of the first mentioned vehicle when such vehicle has given a plainly visible signal of intention to turn. 25. Failure to yield the right of way - failure of the driver of any vehicle upon a highway within a business or residential district to yield the right of way to a pedestrian crossing such highway within a crosswalk except at intersection where the movement of traffic is regulated by a peace officer or by traffic signal. 26. Failure to stop before traversing a ""through highway"" or railroad crossing - failure of the driver of a vehicle upon a highway to bring to a full stop such vehicle before traversing any ""through highway"" or railroad crossing. 78 27. Failure to yield right way', 'or freight of trucks requiring the same. 5. Permitting passenger to ride on running board, step board or mudguard of MV while the same in motion. 6. Failure to dim headlights when approaching another motor vehicle. 7. Driving in a place not intended for traffic or into place not allowed for parking. 76 8. Hitching or permitting a person or a bicycle, motorcycle, tricycle or skate roller to hitch to a motor vehicle. 9. Driving against traffic - failure to pass to the right when meeting persons or vehicles coming towards him. 10. Illegal turn - failure to conduct the motor vehicle to the right of the intersection of the highway when turning to the left in going from one highway to another. 11. Illegal overtaking - failure to pass to the left when overtaking person or vehicles going to the same direction except when there are two or more lanes for the movement of traffic in one direction. 12. Overtaking at unsafe distance - failure to pass at a safe distance to the left', 'approved mechanical or electrical signal device. For Motorcycle Riders  Use of hand, head or foot signals that are not mentioned in this topic are not recognized as a lawful signal.  Other international signs may be used for group riding only.  Avoid using other signals that may tend to confuse other motorists. Example, raising your left foot to turn left is not a recognized and lawful signal. Besides, it is not safe. The driver of any vehicle upon a highway, before starting, stopping or turning from a direct line, shall first see that such movement can be made in safety, and if any pedestrian may be affected by such movement, shall give a clearly audible signal by sounding the horn, and whenever the operation of any other vehicle approaching or following may be affected by such movement, shall give a signal plainly visible to the driver of such other vehicles of the intention to make such movement. Source: Canva Photos 121 Before Starting and Driving on the Road OVERTAKING AND PASSING RESTRICTIONS 1. The driver of a vehicle shall', 'lane PAVEMENT ARROWS  used for lane control and in white color SPEED LIMIT AT 60KPH  a speed limit on pavement to supplement the speed limit posted on the roadside Source: Google images Source: Google images 99  Checking Motor Vehicle and Documents A. BLOWBAGETS B. Essential Parts of Air supply System for Heavy and Articulated Vehicles C. Documents  Before Starting and Driving on the Road A. Before Starting the Engine B. Starting to Drive - Steering - Backing Up / Reversing - Helpful Backing Tips to Avoid Road Crash  Driving on the Road A. Traffic Lights and Signals B. Braking C. Following Distance D. Speed Restrictions E. Exception to Speed Restrictions F. Right-of-Way Rules G. Exception to the Right-of-Way Rules H. Driving on the Right Side of the Highway I. Classification of Roads J. Turning at Intersections K. Making a U-turn L. Roundabout Rules M. Starting, Stopping or Turning Using Hand Signals N. Overtaking and Passing Restrictions O. Proper Parking', 'a flashing red light indicate? Stop, yield, and proceed when it is safe 46. While driving in a street with no pavement markings, what should you do? Proceed with caution and drive at the rightmost side of the road 47. What is the proper action if you see a person in a wheelchair who is about to cross the street? Stop and wait for the PWD to cross the street 48. Can an enforcer apprehend a motorist who is using his/her phone while driving? Yes, if the driver is not using hands-free device (R.A No. 10913) 49. Holders of a professional drivers license for light vehicles are allowed to drive: any motor vehicle exceeding to 5000 kgs GVW 50. In an uphill road, you must turn the wheels ___________ when parking. away from the curb 183 Road Traffic Signs QUESTION ANSWER 1. Identify the traffic sign: Traffic light ahead 2. Identify', 'Traffic Rules SEC. 48. Reckless driving.No person shall operate a motor vehicle on any highway recklessly or without reasonable caution considering the width, traffic, grades, crossing, curvatures, visibility and other conditions of the highway and the conditions of the atmosphere and weather, or so as to endanger the property or the safety or rights of any person or so as to cause excessive or unreasonable damage to the highway. SEC. 49. Right of way for police and other emergency vehicles.Upon the approach of any police or fire department vehicle, or of an ambulance giving audible signal, the driver of every other vehicle shall immediately drive the same to a position as near as possible and parallel to the right-hand edge or curb of the highway, clear of any intersection of highways, and shall stop and remain in such position, unless otherwise directed by a peace officer, until such vehicle shall have passed. SEC. 50. Tampering with vehicles.No unauthorized person shall sound the horn, handle the', 'going to the same direction except when there are two or more lanes for the movement of traffic in one direction. 12. Overtaking at unsafe distance - failure to pass at a safe distance to the left of another motor vehicle when overtaking that vehicle. 13. Cutting an overtaken vehicle - driving to the right side of the highway after overtaking before his motor vehicle is safely clear of such overtaken vehicle. 14. Failure to give way to an overtaking vehicle - failure to give way to another vehicle approaching from the rear that wishes to overtake his vehicle when the former has given suitable and audible signal. 15. Increasing speed when being overtaken - increasing the speed of the motor vehicle before the overtaking vehicle has completely passed. 16. Overtaking when left side is not visible or clear of oncoming traffic - driving to the left side of the center line of a highway in overtaking or passing another vehicle proceeding in the same direction where the left side is not clearly visible and is not free', 'intersection collisions occur because drivers fail to follow the right-of-way regulations. At an intersection Where there is no traffic sign or signal, the vehicle on the left shall yield to the vehicle on the right. At a give-way sign intersection When you approach such a sign at an intersection, you must give the right-of-way to any other vehicle in or closely approaching the intersection. At a stop sign intersection Vehicle approaching such sign must come to a full stop and yield the right-of-way to the vehicle in or approaching the intersection. If two vehicles stopped on a stop line at the same time, the vehicle on the left must yield to the vehicle on the right. Never do a rolling stop. At an intersection with a traffic control device If your light is green, you may proceed but only after yielding to other vehicles and pedestrians lawfully within the intersection. On intersections allowing a right turn on red light, proceed only after stopping and yielding to pedestrians and to cross-traffic', 'to pedestrians such as PWDs, Senior Citizens, Children, Pregnant Women, Road Workers, and the likes.  Give the right-of-way to priority vehicles such as emergency vehicles.  Yield the right-of-way to ascending vehicles, school service, and vehicles with lesser steering radius, vehicles that are already turning left, vehicles on yellow boxes and the likes. 138 Attitude and Behavior ATTITUDE TOWARDS MOTORISTS DRIVING AGAINST THE FLOW OF TRAFFIC ON A TWO-WAY ROAD On undivided roadways, be constantly alert for situations that might cause oncoming vehicles to swerve into your lane. Stay on the outer lane (Vehicle A) on a two-lane road and observe your speed. In the event of counterflow, keep calm and do not insist your right. Make the proper signal and change your lane with care. Avoid eye to eye contact with the oncoming motorists to reduce tension. To prevent collision with oncoming vehicle, consider the following when they steer to your direction:', '24 of 31 10/17/2025, 11:21 PM SEC. 43. Exception to the right of way rule. a. The driver of a vehicle entering a highway from a private road or drive shall yield the right of way to all vehicles-approaching on such highway. b. The driver of a vehicle upon a highway shall yield the right of way to police or fire department vehicles and ambulances when such vehicles are operated on official business and the drivers thereof sound audible signal of their approach. c. The driver of a vehicle entering a ""through high way"" or a ""stop intersection"" shall yield the right of way to all vehicles approaching in either direction on such ""through highway"": Provided, That nothing in this sub section shall be construed as relieving the driver of any vehicle being operated on a ""through highway"" from the duty of driving with due regard for the safety of vehicles entering such ""through highway"" nor as protecting the said driver from the consequence of']","No, you cannot park your car facing the opposite direction of traffic. According to Republic Act No. 4136, Section 46, No driver shall park a vehicle, or permit it to stand, whether attended or unattended, upon a highway in any of the following places: a. Within an intersection b. On a crosswalk c. Within six meters of the intersection of curb lines d. Within four meters of a driveway entrance to a fire station e. Within four meters of a fire hydrant f. In front of a private driveway g. On the roadway side of any vehicle stopped or parked at the curb or edge of the highway h. At any place where official signs have been displayed prohibiting parking.

However, the context does not explicitly state that parking facing the opposite direction of traffic is prohibited. But, it is generally considered a traffic violation and can be considered as ""parking in a prohibited place"" which is punishable under the law.",No. Parking against the flow of traffic is a violation under most city ordinances. Vehicles must park facing the same direction as traffic movement on that side of the road.,0.7692307692307693,0.9287509722060134
What is the penalty for using unauthorized sirens or blinkers on a private vehicle?,"['of all the Armed Forces of the Philippines, do hereby order and decree: 1. That it shall be unlawful for the owner or possessor of any motor vehicle to use or attach to his vehicle any siren, bell, horn, whistle, or other similar gadgets that produce exceptionally loud or startling sound, including domelights, blinkers and other similar signalling or flashing devices. 2. The gadgets or devices mentioned above may be attached to and use only on motor vehicles designated for official use by the Armed Forces of the Philippines, National Bureau of Investigation, Land Transportation Commission, Police Departments, Fire Departments, and hospital ambulances. Any device or gadget installed or mounted on any motor vehicle or otherwise used in violation of this decree shall be subject to immediate confiscation and, in cases of a second and subsequent offenses, the offender shall be prosecuted for violation of this Decree before the military tribunal and, upon conviction thereof, shall suffer the penalty of imprisonment for six months and/or a', 'a particular motor vehicle or CPC. Hence, the second apprehension of a vehicle belonging to the same operator, regardless of whether the first and second vehicle apprehended are included in the same or different CPCs, shall be counted as second (2nd) offense. If a private motor vehicle operating as a PUV but without proper authority from the LTFRB is apprehended, the LTFRB or RFRBs shall, in addition to the abovementioned fines, impounding, and penalty, disqualify the registered owner, and, in case of a corporation, all its stockholders and directors, to operate any kind of public land transportation. 85 VIOLATIONS FINES AND PENALTIES 2. Refusal to render service to the public or convey passenger to destination* 3. Overcharging / undercharging of fare* 4. Failure to provide proper body markings 5. No franchise / Certificate of Public Convenience or evidence of franchise presented during apprehension or carried inside the motor', '19 of 31 10/17/2025, 11:21 PM (b-1) HornsEvery motor vehicle shall be provided with a horn or signalling devise in good working order: Provided, however, That no horn or signalling device emit-ting an exceptionally loud, startling, or disagreeable sound shall be installed or used on any motor vehicle. All authorized emergency vehicles, such as ambulance and police cars and fire wagons used for emergency calls shall be equipped with a bell, siren, or exhaust whistle of a type approved by the Commissioner, and no such device shall be installed or used in any other vehicle. No vehicle not classified as a motor vehicle under this Act shall be equipped with a horn or signalling device similar to the horn customarily used on motor vehicles. (c) Headlights.Every motor vehicle of more than one meter of projected width, while in use on any public highway shall bear two headlights, one on each side, with white or yellowish light visible from the', 'RECEIPT WHILE DRIVING A MOTOR VEHICLE J. ALL OTHER VIOLATIONS OF TRAFFIC RULES AND REGULATIONS Seat Belts Use Act of 1999 Motorcycle Helmet Act of 2009 Php 1,000.00 Php 1,000.00 This includes the following traffic violations: 1. Parking a. In an intersection b. Within 6 meters of the intersection c. In front of the driveway entrance d. Within 4 meters of a fire hydrant e. In front of a private driveway f. On the roadway side of any unmoving or parked MV at the curb or edge of the highway g. At any place where signs of prohibitions have been installed 2. Disregarding Traffic Signs. 3. Allowing passengers on top or cover of a motor vehicle except in a truck helper. 4. Failure to provide canvass cover to cargoes or freight of trucks requiring the same. 5. Permitting passenger to ride on running board, step board or mudguard of MV while the same in motion. 6. Failure to dim headlights when approaching another', 'Traffic Rules SEC. 48. Reckless driving.No person shall operate a motor vehicle on any highway recklessly or without reasonable caution considering the width, traffic, grades, crossing, curvatures, visibility and other conditions of the highway and the conditions of the atmosphere and weather, or so as to endanger the property or the safety or rights of any person or so as to cause excessive or unreasonable damage to the highway. SEC. 49. Right of way for police and other emergency vehicles.Upon the approach of any police or fire department vehicle, or of an ambulance giving audible signal, the driver of every other vehicle shall immediately drive the same to a position as near as possible and parallel to the right-hand edge or curb of the highway, clear of any intersection of highways, and shall stop and remain in such position, unless otherwise directed by a peace officer, until such vehicle shall have passed. SEC. 50. Tampering with vehicles.No unauthorized person shall sound the horn, handle the', 'heavy volume of vehicles; - there is a high density of fast moving vehicles; or - where a speed limit of more than 60/kph is imposed * Commission of a crime in the course of apprehension upon conviction by a regular court of competent jurisdiction * Colorum violation * Driving a motor vehicle while under the influence of alcohol, dangerous drugs and/or similar substance upon final conviction by a regular court of competent jurisdiction [Sec. 12 of R.A. No. 10586 (Anti-Drunk and Drugged * 2nd offense of Sec. 4 of R.A. 10913 (Anti-Distracted Driving Act) for acts in a motor vehicle in motion, or temporarily stopped at a traffic light or any intersection, whether diplomatic, public or private: * 1st offense of Sec. 4 of R.A. 10913 (Anti-Distracted Driving Act) for acts in a motor vehicle in motion, or temporarily stopped at a traffic light or any intersection, whether diplomatic, public or private:', ""/ undercharging of fare* 4. Failure to provide proper body markings 5. No franchise / Certificate of Public Convenience or evidence of franchise presented during apprehension or carried inside the motor vehicle* 6. Fraud and falsities such as presentation of fake and spurious CPC, OR/CR, plates, stickers and tags* 7. Employing reckless, insolent, discourteous or arrogant drivers 8. Allowing an unauthorized driver to drive PUV or allowing a driver to drive PUV without bringing his/her driver's license 1st Offense  Php 5,000.00 2nd Offense  Php 10,000.00 and impounding of unit for thirty (30) days 3rd and Subsequent Offenses - Php 15,000.00 and cancellation of CPC where the unit is authorized Revocation/Cancellation of the franchise/Certificate of Public Convenience, after due notice of hearing pursuant to LTFRB Memorandum Circular No. 2013-003 1st Offense - Php 5,000.00 2nd Offense -"", 'use of sirens, bells, horns, whistles and similar gadgets that emit exceptionally loud or startling sounds, including domelights and other similar signalling or flashing devices attached to motor vehicles and used on the highways; WHEREAS, it has been observed that such unregulated use of sirens, bells, horns, whistles or similar gadgets that emit exceptionally loud or startling sounds, including domelights and similar signalling or flashing devices actually impede and confuse traffic, are inconsistent with sound traffic discipline and control on the highways, and in effect constitute a major problem in the maintenance of peace and order; NOW, THEREFORE, I, FERDINAND E. MARCOS, President of the Philippines, pursuant to Proclamation No. 1081, dated September 21, 1972, and in my capacity as Commander-in-Chief of all the Armed Forces of the Philippines, do hereby order and decree: 1. That it shall be unlawful for the owner or possessor of any motor vehicle to use or attach to his', 'use thereof, insanity, imbecility, impotence or blindness, or incapacity to work for more than ninety (90) days, the license of the offending driver shall be revoked for a period of four (4) years, after a finding by the court that such driver was negligent or at fault. ""The Department of Transportation (DOTr) and the LTO shall, in coordination with the Land Transportation Franchising and regulatory Board (LTFRB) and other concerned agencies and private stakeholders, aggressively and regularly conduct a nationwide information, education and communication (IEC) campaign on road safety, including the list of measures implemented pursuant to and violations punishable under this Act."" SEC. 5. Review of Penalties.- The secretary of the DOTr. upon the recommendation of the LTO, after due hearing and publication, shall have the power to increase or adjust the fine herein imposed once every five (5) years: Provided, That in no', 'to be released by a regular court of competent jurisdiction after payment of appropriate fines and penalties. Php 10,000.00 In addition, the drivers license shall be confiscated, and revoked upon conviction for the crime. The driver shall be disqualified from being granted a drivers license for a period of 5 years counted from the date of payment of appropriate fines and penalties The motor vehicle driven by the violator shall likewise be impounded until ordered to be released by a regular court of competent jurisdiction after payment of appropriate fines and penalties. 74 D. Refer to R.A. No. 10586 E. RECKLESS DRIVING No person shall operate a motor vehicle on any highway recklessly or without reasonable caution considering the width, traffic, grades, crossing, curvatures, visibility and other conditions of the highway and the conditions of the atmosphere and weather, or so to endanger the property of the safety or rights of any person or so as to cause excessive or unreasonable damage to the highway. This includes driving with an improperly', 'transport but operating as city or provincial bus); and BUS TRUCKS JEEPNEY VANS SEDAN MC Php 1 Million Php 200,000.00 Php 50,000.00 Php 200,000.00 Php 120,000.00 Php 6,000.00 3 Months 1. Revocation of the ENTIRE Certificate of Public Convenience (""CPC"") where the apprehended vehicle belongs (except when apprehended vehicle is with private/green plate); 2. Blacklisting of the apprehended vehicle and all other authorized units included in the CPC from being used as a public utility vehicle; and 3. Revocation of the registration of the apprehended vehicle and all other authorized units included in the franchise. 84 TYPE OF VIOLATION PENALTIES FOR 2ND OFFENSE d. A PUV with suspended or cancelled CPC and Decision/Order of the suspension or cancellation is executory; and e. A PUV with expired CPC and without a pending application for extension of validity timely', 'TRAFFIC VIOLATIONS OF PUBLIC UTILITY VEHICLE DRIVERS THAT CAUSE HEAVY TRAFFIC 1. Stopping (loading and unloading passengers) outside of the stopping zone and ignoring other motorists right-of-way. 2. Beating the red light. 3. Distracted driving by talking or chatting with passengers, eating, receiving phone calls, or composing text messages. 4. Speeding as a result of inducing and convincing passengers that they will reach their destinations ahead of time. 5. Swerving through indiscriminate and unsafe changing lanes. 6. Tailgating on fast moving traffic. 7. Counterflowing or driving against the flow of traffic. 8. Stopping on a pedestrian crosswalk to wait for possible passengers. 9. Delaying movement on green signal traffic lights to wait for passengers. 10. Opening door while the vehicle is in motion. 11. Lane Straddling. 12. Stopping on a yellow box. 157  Conductors License  Nonprofessional Motorcycle (A, A1)  Nonprofessional Light', 'vehicle, a common carrier hauling volatile, flammable or toxic material, or a driver who commits an act classified herein as distracted driving within a fifty (50)-meter radius from the school premises shall be subject to a penalty of thirty thousand pesos (P30,000.00) and suspension of ones drivers license for three (3) months. The foregoing penalties shall be imposed without prejudice to other liabilities under the Revised Penal Code or any special law, arising out or on occasion of the herein prohibited acts. SEC. 9. Liability of Owner and/or Operator of the Vehicle Driven by the Offender.  The owner and/or operator of the vehicle driven by the offender shall be directly and principally held liable together with the offender for the fine unless he or she is able to convincingly prove that he or she has exercised extraordinary diligence in the selection and supervision of his or her drivers in general and the offending driver in particular. This section shall principally apply to', ""the fine above-stated; and A holder of a driver's license who acts in violation of the provisions of Republic Act No. 4136 and other existing traffic laws shall suffer corresponding penalties as may be provided by law and other issuances. 58 Republic Act No. 10930 In case of death or physical injuries resulting in the loss of any part of the victim's body or the use thereof, insanity, imbecility impotence or blindness, or incapacity to work for more than ninety (90) days, the license of the offending driver shall be revoked for a period of (4) years, after a finding by the court that such driver was negligent or at fault The Department of Transportation (DOTr) and the LTO shall, in coordination with the Land Transportation Franchising and Regulatory Board (LTFRB) and other concerned agencies and private stakeholders, aggressively and regularly conduct a nationwide information, education and communication (IEC) campaign on road"", '9 of 14 10/17/2025, 10:17 PM e. In front of a private driveway f. On the roadway side of any unmoving or parked MV at the curb or edge of the highway g. At any place where signs of prohibitions have been installed * Allowing passengers on top/cover of MV vehicle within such intersection or turning therein to the left across the line of travel of the first mentioned vehicle when such vehicle has given a plainly visible signal of intention to turn *Smoke belching [Section 46, R.A. 8749 (Philippine Clean Air Act of 1999)] - 3rd offense * Failure to dim headlights when approaching another motor vehicle * Failure to provide canvass cover to cargoes or freight of trucks requiring the same2/ * Axle Overloading (Violation of R.A. 8794) * Hitching or permitting a person or a bicycle, motorcycle, tricycle or skate roller to hitch to a motor vehicle increasing speed when being overtaken', 'park a vehicle, or permit it to stand, whether attended or unattended, upon a highway in any of the following places: a. Within an intersection b. On a crosswalk c. Within six meters of the intersection of curb lines. d. Within four meters of the driveway entrance to and fire station. e. Within four meters of a fire hydrant f. In front of a private driveway g. On the roadway side of any vehicle stopped or parked at the curb or edge of the highway h. At any place where official signs have been erected prohibiting parking. SEC. 47. Parked vehicle.Whenever a motor vehicle is parked unattended on any highway, the driver thereof must turn off the ignition switch and stop the motor and notch effectively the hand brake. ARTICLE V.Miscellaneous Traffic Rules SEC. 48. Reckless driving.No person shall operate a motor vehicle on any highway recklessly or without reasonable caution considering the width, traffic, grades, crossing, curvatures, visibility and', 'motor vehicles which are not in motion, except those which are stopped momentarily at a traffic light or any intersection, or are pulled over to the side of the road in compliance with a traffic regulation. Section 6. Exemptions The provisions of this IRR shall not apply to the following: a) A motorist using a mobile phone an emergency call to; (i) a law enforcement agency or agent to report a crime or prohibited act, accident, natural calamity, bomb threat/terrorist action, animal activism, infrastructure failure and biological, chemical, or radioactive hazard spill or release; (ii) government or non-government health care provider, or a medical practitioner, and emergency rescue units, in instances requiring immediate medical attention; (iii) fire department or non-government fire volunteers in the event of fire/ explosion; (iv) other emergency services, agency or entity rendering electric, gas, water, chemical, towing and other similar services, in instances requiring immediate attention to save lives and', 'altered sealing wire. 45. No signboards. 46. Pick and Drop of Passengers outside the terminal. 47. Carrying of illegal and/or prohibited cargoes. 48. Failure to provide the fire extinguisher and required ""STOP and GO"" signage for use of each vehicle. 49. Trip cutting. 50. Failure to display fare matrix. 51. Breach of franchise conditions under 2011 Revised Terms and Conditions of CPC not otherwise herein provided. 80 VIOLATIONS IN CONNECTION WITH MOTOR VEHICLE REGISTRATION/RENEWAL/OPERATION VIOLATIONS FINES AND PENALTIES A. DRIVING AN UNREGISTERED MOTOR VEHICLE Php 10,000.00 This includes driving with an improperly registered motor vehicle or a motor vehicle with expired, revoked, suspended or invalid registration, unregistered or fake substitute or replacement engine, engine block or chassis In addition, in case of non- registration and the violation has exceeded one (1) month, the motor vehicle shall be impounded and shall be released only upon its valid registration and payment', 'Constitution Statutes Executive Issuances Judicial Issuances Other Issuances Jurisprudence International Legal Resources Legal Links Today is Saturday, August 16, 2025 MALACAANG M a n i l a PRESIDENTIAL DECREE No. 96 January 13, 1973 DECLARING UNLAWFUL THE USE OR ATTACHMENT OF SIRENS, BELLS, HORNS, WHISTLES OR SIMILAR GADGETS THAT EMIT EXCEPTIONALLY LOUD OR STARTLING SOUNDS, INCLUDING DOMELIGHTS AND OTHER SIGNALLING OR FLASHING DEVICES ON MOTOR VEHICLES AND PROVIDING CERTAIN EXCEPTIONS THEREFOR WHEREAS, Presidential Proclamation No. 1081 envisioned, among other goals, the bringing about of a social order characterized by a high state of discipline and order among the citizenry; WHEREAS, much of the chaotic conditions from which our people have suffered and still continue to suffer are the direct result of indiscriminate and unregulated use of sirens, bells, horns, whistles and similar gadgets that emit exceptionally loud or startling sounds, including domelights and other similar signalling or flashing devices attached to motor vehicles and used', 'consequences of the unrestrained use of electronic mobile devices on road safety as to cause its regulation. A law prohibiting all motorists to use any communications device while the motor vehicle is in motion or temporarily stopped a traffic light or intersection whether diplomatic, public or private. WHAT ARE DISTRATCED DRIVING PROHIBITIONS? 49 Republic Act No. 10913 EXEMPTIONS The law shall not apply to the following: a. A motorist using mobile phone for an emergency call to:  A law enforcement agency or agent to report a crime or a prohibited act, accident, natural calamity, bomb threat/terrorist action, animal activism, infrastructure failure and biological, chemical, or radioactive hazard spill or release;  Government or non-government health care provider, or a medical practitioner, and emergency rescue units, in instances requiring immediate medical attention;  Fire department or non-government fire volunteers in the event of fire/explosion;  Other emergency services, agency or entity rendering electric, gas, water, chemical, towing and other', ""certified by the DTI installed and set in the vehicle. SETTING OF STANDARDS The DOTr shall, in accordance with acceptable international standards, determine the specifications of the speed limiters that may be allowed to be installed in the covered vehicles. The LTO or the LTFRB, shall supervise and inspect the setting of speed limiter corresponding to the maximum allowed in the route plied by a particular covered vehicle. 53 Republic Act No. 10916 FINES and PENALTIES A Driver who operates a Motor Vehicle without speed limiter or the owner/operator who allows such driver to operate an MV without speed limiter. A driver, owner or operator who operates or allows a person to operate a motor vehicle with a nonfunctioning or tampered speed limiter. First Offense - Fifty Thousand Pesos (Php 50,000.00) Plus, a one (1) month suspension of driver's license or three (3) months suspension of MV franchise Second Offense - Fifty Thousand Pesos (Php"", 'Code of the Philippines 45. If this sign is disregarded, it will constitute an offense. Regulatory Sign Directional Sign (e.g., left lane must turn left, one-way sign) 46. Why should the driver always yield to emergency vehicles with blinkers and sirens on? Because they have a priority right-of-way 47. The Right-Of -Way rule signifies: the rights of drivers on when to yield or give way to others while driving 48. When making a right turn, you should: reduce speed and stay on the outermost lane of the road then signal your intention to turn right 49. When approaching a crosswalk or pedestrian lane, you should: slow down and stop to yield to pedestrians 50. What should you do if you are stopped by an enforcer even when you believe that you did not violate any traffic rules and regulations? Stop at the roadside and politely ask the reason why you were being stopped 168 Nonprofessional  Light (B,', 'fake or altered sealing wire * Presentation of fake/spurious CPC/OR/CR/plates/stickers and tags * Refusal to render service to the public or convey passenger to destination * Failure to provide fare discount to those entitled under exiting laws and pertinent MCs of LTFRB3/ * Operating the unit/s without or with defective/ improper / unauthorized accessories, devices, equipment and parts * Trip cutting * No sign board * All violations in connection with motor vehicle registration/renewal/ operation * Carrying of illegal and/or prohibited cargoes * Similar acts punishable under local ordinances shall be considered less grave * Pick and drop of passengers outside the terminal * Unauthorized motor vehicle modification * Failure to display fare matrix * Operating a Right Hand Drive motor vehicle * Failure to display the international Symbol of Accessibility inside the units and/or failure to designate seats specifically for the use of Persons with Disabilities or Failure or refusal to transport PWDs * Driving against traffic * Illegal overtaking * Breach', 'forms of misrepresentation 12. Failure to display ""No Smoking""\' signage and/or allowing personnel or passenger to smoke inside the vehicle 13. Fast, tampered, defective taximeter or operating without or with an old seal taximeter (TX only) * 14. Tampered, broken, joined, reconnected, fake or altered sealing wire (TX only) * 15. Violation of color scheme or design/Adoption of new color design without authority from the Board (PUB and TX only) 16. Unregistered or unauthorized trade/business name (PUB and TX only) 17. No Panel Route (PUJ, PUB, UV) 1st Offense - Php 5,000.00 2nd Offense - Php 10,000.00 and impounding of unit for thirty (30) days 3rd and Subsequent Offenses  Php 15,000.00 and cancellation of CPC where the unit is authorized 87 VIOLATIONS FINES AND PENALTIES 18. No sign board* (PUJ,', 'Php 1,000.00 Fine shall be imposed upon the driver and conductor of the motor vehicle. 83 VIOLATIONS IN CONNECTION WITH FRANCHISE TYPE OF VIOLATION TYPE OF VEHICLE PENALTIES FOR FIRST (1ST) OFFENSE FINE Minimum Impounding Period (until) STATUS of CPC 1. Colorum Violation - A motor vehicle is considered operating as ""colorum"" under any of the following circumstances: a. A private motor vehicle operating as a PUV but without proper authority from the LTFRB; b. A PUV operating outside of its approved route or area without a prior permit from the Board or outside the exceptions provided under existing memorandum circulars; c. A PUV operating differently from its authorized denomination (ex. those approved as school service but operating as UV express, or those approved as tourist bus transport but operating as city or provincial bus); and BUS TRUCKS JEEPNEY VANS SEDAN MC Php 1 Million Php 200,000.00 Php 50,000.00 Php 200,000.00 Php', 'and for yourself. 125 Before Starting and Driving on the Road EXPRESSWAY RULES AND REGULATIONS 1. No person or vehicle shall have any right of ingress or egress to, from or across the Limited Access Facility and to or from abutting lands, except at such designated entry/exit points/interchanges. 2. It is unlawful to remove or cause the removal of right-of-way fences along the sides of the Limited Access Facilities. 3. A person or group of persons is not allowed or permitted to stand, stop, load, unload, or park a vehicle in the Limited Access Facilities except in designated places. 4. In case of vehicle emergency, breakdown or accident, impaired vehicle/s shall be removed from the travel way by authorized towing operators without delay at the expense of the owner and/or driver. 5. The following vehicles are not allowed to enter the Expressway at any time: a. Motorcycles (below 400 cc), tricycles, all kinds of', 'odor, smoke or noise. CHAPTER IVTRAFFIC RULES ARTICLE I.Speed Limit and Keeping to the Right SEC. 35. Restriction as to speed. a. Any person driving a motor vehicle on a highway shall drive the same at a careful and prudent speed, not greater nor less than is reasonable and proper, having due E-Library - Information At Your Fingertips: Printer Friendly https://elibrary.judiciary.gov.ph/thebookshelf/showdocsfriendly/2/26188 21 of 31 10/17/2025, 11:21 PM regard for the traffic, the width of the highway, and of any other condition then and there existing; and no person shall drive any motor vehicle upon a highway at such a speed as to endanger the life, limb and property of any person, nor at a speed greater than will permit him to bring the vehicle to a stop within the assured clear distance ahead. b. Subject to', ""the provisions of this Act. Non-installation and tampering of the speed limiter shall be liable to the penalty provisions thereof. Enforcement Procedure - The driver, upon lawful demand by the LTO LEO, shall surrender his/her driver's license and present the Certificate of Registration (CR), current Official Receipt (OR) of registration, and certificate of conformity. In the event of a violation, the LTO LEO shall immediately impound the vehicle in the designated impoundment area of the LTO. The impounded vehicle shall only be released upon payment of fines as provided in the penalty provisions hereof and installation or recalibration of the tampered speed limiter device. 55 REPUBLIC ACT NO. 10930 AN ACT RATIONALIZING AND STRENGTHENING THE POLICY REGARDING DRIVER'S LICENSE BY EXTENDING THE VALIDITY PERIOD OF DRIVERS LICENSES, AND PENALIZING ACTS IN VIOLATION OF ITS ISSUANCE AND APPLICATION, AMENDING FOR THOSE PURPOSES SECTION 23 OF REPUBLIC ACT NO. 4136, AS"", 'remain in such position, unless otherwise directed by a peace officer, until such vehicle shall have passed. SEC. 50. Tampering with vehicles.No unauthorized person shall sound the horn, handle the levers or set in motion or in any way tamper with or damage or deface any motor vehicle. E-Library - Information At Your Fingertips: Printer Friendly https://elibrary.judiciary.gov.ph/thebookshelf/showdocsfriendly/2/26188 26 of 31 10/17/2025, 11:21 PM SEC. 51. Hitching to a vehicle.No person shall hang on to, or ride on, the outside or the rear end of any vehicle, and no person on a bicycle, roller skate or other similar device, shall hold fast to or hitch on to any moving vehicle, and no driver shall knowingly permit any person to hang on to or ride, the outside or rear end of his vehicle or', 'into the muffler 19. A steady green traffic light means: vehicles can proceed 20. What should you do if you make a wrong turn on a one-way road? Back up if possible or safely make a U-turn 21. If you are in doubt while approaching an intersection, you must: yield the right-of-way to avoid road crash 180 Professional  Light (B, B1, B2) QUESTION ANSWER 22. Can a motorist park in a pedestrian lane? NO, not in any circumstances Parking in a pedestrian lane or crosswalk is in violation of traffic rules and regulations (R.A. No. 4136) 23. Is driving a private vehicle on a yellow bus lane allowed? No, except when turning or going into the garage within 100 meters upon entering the yellow bus lane 24. If your cargo exceeded one (1) meter from the body of your vehicle, you must: hang a red flag with at least 30x30 centimeters at the edge of the', 'Owner of the Offending Vehicle The owner and/or operator of the motor vehicle driven by the offender shall be directly and principally held liable together with the offender for the fine and the award against the offender for civil damages unless he/she is able to convincingly prove that he/she has exercised extraordinary diligence in the selection and supervision of his/her drivers in general and the offending driver in particular. This section shall principally apply to the owners and/or operators of public utility vehicles and commercial vehicles such as delivery vans, cargo trucks, container trucks, school and company buses, hotel transports, cars or vans for rent, taxi cabs, and the like. Section 4. Review of Penalties The L TO shall, after five (5) years from the effectivity of this Act and every five (5) years thereafter, review the applicability and enforcement of all foregoing pecuniary penalties and shall initiate amendment and/or upgrade the same as may be necessary, subject', 'of twelve (12) months for the first conviction and perpetually revoked for the second conviction. The professional drivers license of any person found to have violated Section 5 of this Act shall also be confiscated and perpetually revoked for the first conviction. The perpetual revocation of a drivers license shall disqualify the person from being granted any kind of drivers license thereafter. The prosecution for any violation of this Act shall be without prejudice to criminal prosecution for violation of the Revised Penal Code, Republic Act No. 9165 and other special laws and existing local ordinances, whenever applicable. SEC. 13. Direct Liability of Operator and/or Owner of the Offending Vehicle.  The owner and/or operator of the vehicle driven by the offender shall be directly and principally held liable together with the offender for the fine and the award against the offender for civil damages unless he or she is able to convincingly prove that he or she has exercised extraordinary diligence in the selection and supervision of his or her drivers in', 'date of issuance of the order of suspension. Provided, that period of suspension will subsist if the fine has not been paid within one (1) year from the order of suspension. Vehicles operating without a speed limiter or a malfunctioning or tampered speed limiter shall be impounded immediately and shall only release upon payment of the appropriate fines. ENFORCEMENT AND ADJUDICATION Inspection of Covered Vehicles Law - LTO and LTFRB Law Enforcement Officer (LEO) and its duly deputized agents shall have the authority to inspect apprehended vehicles for violating traffic rules and regulations and any other law, for non-compliance with this Act. The LTFRB shall have the authority to inspect and apprehend covered PUVs committing violations or failing to comply with the provisions of this Act. Non-installation and tampering of the speed limiter shall be liable to the penalty provisions thereof. Enforcement Procedure - The driver, upon lawful demand by the LTO', 'capability to bear and showcase a readable number plate required under section 5 of this IRR. Owners of existing motorcycle units which do not have space for front plate are required to provide a bracket or any other provision where the same shall be installed. 71  Violations in Connection with Licensing  Violations in Connection with Motor Vehicle Registration / Renewal / Operation  Violations in Connection with Dimensions, Specifications, Weight and Load Limits  Violations in Connection with Franchise 72 Chapter III Fines and Penalties for Violations of Laws, Rules and Regulations Governing Land Transportation TEMPORARY OPERATORS PERMIT (TOP) Serves as a permit to operate a motor vehicle for a period of seventy- two (72) hours only. All apprehensions are deemed admitted unless contested by filling a written contest within five (5) days from date of apprehension. Failure of the driver to pay the corresponding penalty within fifteen (15) days from the date of apprehension shall cause automatic suspension of his drivers license for a period of thirty (30) days from the date of apprehension, in addition to the fines', ""hereof, an offender operating a conveyance or machinery which do not require a driver's license, the penalty shall be impoundment of the conveyance or machinery in lieu of the confiscation of the driver's license. Provided, further, that in the event the fine imposed is not settled within six (6) months from the date of apprehension, the implementing agency shall exhaust all available legal remedies to implement this Section. The foregoing penalties shall be imposed without prejudice to other liabilities under the Revised Penal Code or any special law, arising out or on occasion of the herein prohibited acts. The implementing agency may increase the amount of fine herein imposed once every five (5) years in the amount not exceeding ten percent (10%) of the existing rates sought to be increased which shall take effect only upon publication in at least two (2) newspapers of general circulation. Section 9. Liability of Owner and/or Operator of the Vehicle Driven by the Offender"", 'the load of any vehicle extends more than one meter beyond the bed or body thereof, there shall be displayed at every projecting end of such load a red flag not less than thirty centimeters both in length and width, except that during the hours fixed under subsection (c), there shall be displayed, in lieu of the required red flags, red lights visible at least fifty meters away. (j) Mufflers.Every motor vehicle propelled by an internal combustion engine shall be equipped with a muffler, and whenever said motor vehicle passes through a street of any city, municipality, or thickly populated district or barrio, the muffler shall not be cut out or disconnected. No motor vehicle shall be operated in such a manner as to cause it to emit or make any unnecessary or disagreeable odor, smoke or noise. CHAPTER IVTRAFFIC RULES ARTICLE I.Speed Limit and Keeping to the Right SEC. 35. Restriction as to speed. a. Any person driving a motor vehicle', 'fine. C. OPERATING A RIGHT HAND DRIVE MOTOR VEHICLE Php 50,000.00 In addition, the motor vehicle shall be impounded and subject to inspection, if defect was corrected and payment of the fine. 81 D. MOTOR VEHICLE OPERATING WITHOUT OR WITH DEFECTIVE/ IMPROPER /UNAUTHORIZED ACCESSORIES, DEVICES, EQUIPMENT AND PARTS This includes bells/horns/sirens/ whistles, blinkers, early warning device (EWD), grill/s, jalousies, brake (foot and hand brakes), brake lights /headlights /interior lights /signal lights /tail lights, mirrors, mufflers, metallic tires / spare tire, speedometer, windshield, wipers or any other accessory, device, equipment or part that is manifestly prejudicial to road safety. Php 5,000.00 In addition, the motor vehicle shall be impounded until the accessory, device, equipment or part is properly installed, corrected or removed, as the case may be and payment of the fine.', 'Php 5,000.00 2nd Offense - Php 10,000.00 and impounding of unit for thirty (30) days 3rd and subsequent Offenses - Php 15,000.00 and cancellation of CPC where the unit is authorized Except in cases of colorum violation, as stated in number one (1), the LTFRB, in the application of these fines and penalties, shall count offenses against operators and not against a particular motor vehicle or CPC. Hence, the second offense committed by a different vehicle of the same operator shall be counted as second (2nd) offense and another offense by third vehicle with the same operator shall be counted as a third (3rd) offense, provided all apprehended vehicles belong to the same CPC. Fines and penalties provided for under existing Memorandum Circulars of the LTFRB which are not provided for in this Joint Administrative Order shall continue to be applied by the Board and Regional Franchising and Regulatory Offices. 88 89', ""suspension of driver's license for three (3) months, for the third offense; and d. A fine of twenty thousand pesos (P20,000.00) for the fourth offense and succeeding offenses, and revocation of driver's license. Provided, that a driver of a public utility vehicle, a school bus, a school service vehicle, a common carrier hauling volatile, flammable or toxic material, or a driver who commits an act classified herein as distracted driving within a fifty (50)-meter radius from the school premises shall be subject to a penalty of thirty thousand pesos (P30,000.00) and suspension of one's driver's license for three (3) months. Provided, that the implementation of Section 8(c) hereof, an offender operating a conveyance or machinery which do not require a driver's license, the penalty shall be impoundment of the conveyance or machinery in lieu of the"", 'or whatever style, kind, make, character, or nature, when upon a highway during the hours above-mentioned, whether in motion or not, shall have one or more lights so arranged that the same shall be visible at least fifty meters from the front and the rear of such vehicle. (g) Lights when parked or disabled.Appropriate parking lights or flares visible one hundred meters away shall be displayed at a corner of the vehicle whenever such vehicle is parked on highways or in places that are not well-lighted or is placed in such manner as to endanger passing traffic. (h) Windshield wiper.Every motor vehicle shall be equipped with a mechanically or electrically operated de-vice for wiping off raindrops or other moisture from its front windshield. (i) Use of red flag.Whenever the load of any vehicle extends more than one meter beyond the bed or body thereof, there shall be displayed at every projecting end of such load a red flag not less than thirty centimeters both in length']","According to Presidential Decree No. 96, the penalty for using unauthorized sirens or blinkers on a private vehicle is confiscation of the device, and for a second and subsequent offense, the offender shall be prosecuted before the military tribunal and, upon conviction, shall suffer the penalty of imprisonment for six months and/or a fine.","The unauthorized sirens, bells, horns, whistles, blinkers, or similar gadgets shall be punished with imprisonment for six months and/or a fine of Php600. In addition, the certificate of registration of the motor vehicle on which the device is installed shall be cancelled or revoked.",1.0,0.9999999999999998
Are children allowed to sit in the front seat of a vehicle?,"['SEC. 5. Children Prohibited to Sit in Front Seat. - Infants and/or children with ages six (6) years and below shall be prohibited to sit in the front seat of any running motor vehicle. SEC. 6. Coverage. - This Act, in the interest of public safety, shall apply to drivers and front seat passengers of public and private motor vehicles and other vehicles as may be determined by the IRR thereon. E-Library - Information At Your Fingertips: Printer Friendly https://elibrary.judiciary.gov.ph/thebookshelf/showdocsfriendly/2/5294 2 of 5 10/17/2025, 11:20 PM SEC. 7. Provisions for Seat Belt. - This Act further requires car manufacturers, assemblers and distributors to ensure that seat belt devices are properly installed before the distribution and sale of the said vehicles as determined by the IRR thereon: Provided, That manufacturers, assemblers and distributors', 'immediately inform and require the front seat passengers upon boarding a vehicle of running engine to wear the prescribed seat belts. Any passenger who refuses to wear a seat belt shall not be allowed to continue his/her trip. For special public service vehicles such as school services and other similar vehicles as may be determined by the IRR, seat belt devices should be provided and used by both drivers and front seat passengers as defined herein and the first row passengers immediately behind the driver at all times while inside a vehicle of running engine. Operational motor vehicles, both public and private, which are not equipped with the required seat belt devices, are given one (1) year from the issuance of the IRR by the Land Transportation Office (LTO) to retrofit appropriate seat belt devices in their vehicles. SEC. 5. Children Prohibited to Sit in Front Seat. - Infants and/or children with ages six (6) years and below shall be prohibited to sit in the front seat of any running motor', 'Notwithstanding the child being secured in a child restraint system, at no instance shall such child be left unaccompanied by an adult in a motor vehicle. SEC. 5. Children in Rear Seats. - No child twelve (12) years and below of age shall be allowed to sit in a front seat of a motor vehicle with a running engine or while such child is being transported on any road, street or highway, unless the child meets the height requirement set forth in Section 4 of this Act and is properly secured using the regular seat belt in the front seat. SEC. 6. Safety Standards for Child Restraint Systems. - The Department of Trade and Industry (DTI) is mandated to use standards set forth in United Nations Regulation 44 and United National Regulation 129 including its evolving standards and other acceptable international standards in the approval or disapproval of child restraint E-Library - Information At Your Fingertips: Printer Friendly', ""in Motor Vehicles. - It shall be unlawful for the driver of a covered vehicle not to properly secure at all times a child, in a child restraint system while the engine is running or transporting such child on any road, street or highway unless the child is at least one hundred fifty (150) centimeters or fifty-nine (59) inches in height and is properly secured using the regular seat belt. The child restraint system shall be appropriate to the child's age, height and weight, and approved in accordance with Section 6 of this Act. The requirements of this section shall not apply to circumstances where the child restraint system would put such child in a greater danger, such as: (1) During medical emergencies; (2) Other analogous circumstances prescribed under the implementing rules and regulations (IRR). Notwithstanding the child being secured in a child restraint system, at no instance shall such child be left unaccompanied by an adult in a motor vehicle. SEC. 5. Children in Rear"", 'That t he fines and fees that may be collected in the enforcement of this Act shall be used exclusively for its implementation: Provided, finally, That such sums as may be necessary for the continued implementation of this Act shall be included in the annual General Appropriations Act. SEC. 15. Transitory Clause. - Mandatory compliance of this Act shall be enforced only one (1) year after the effectivity of the IRR of this Act. SEC. 16. Separability Clause. - If any provision, or part hereof, is held invalid or unconstitutional, the remainder of the law or provision not otherwise affected shall remain valid and subsisting. SEC. 17. Repealing Clause. - Section 5 on the age of children prohibited to sit in front seat of Republic Act No. 8750 and Section 11 thereof on the use of special car seats are hereby amended. All other laws, decrees, executive orders, rules and regulations, issuances or parts thereof inconsistent with this Act are', 'and those seated at the back row (the row of passenger immediately behind the driver) of private cars, Sports Utility Vehicles (SUV) and for hire vehicles are required to wear seat belts while inside a vehicle of running engine on any road or thoroughfare. Passenger seated at the back row of the following private motor vehicles: jeeps, passenger vans/wagons, Asian Utility Vehicles (AUV), buses trucks vintage cars and special purpose vehicles shall be exempted from wearing or using seat belt devices while inside a vehicle of running engine on any road or thoroughfare. 33 Republic Act No. 8750 In the case of for hire motor vehicles, the driver shall be required to immediately inform and require the front seat passengers upon boarding a vehicle of running engine to wear the prescribed seat belts. Any passenger who refuses to wear seat belts shall not be allowed to continue his/her trip. In addition, he/she will be informed that no insurance can be recovered in case of accident. Appropriate signage shall be', 'those at the first row immediately behind the driver in the case of public utility buses (PUBs) and to passengers seated on the right side beside the driver for private motor vehicles. SEC. 4. Mandatory Use of Seat Belts. - For their own safety, the driver and front seat passengers of a public or private motor vehicle are required to wear or use their seat belt devices while inside a vehicle of running engine on any road or thoroughfare: Provided, That for private vehicles, except for jeeps, jeepneys, vans, buses and such other private vehicles as may be determined in the Implementing Rules and Regulations (IRR), front and back seat passengers are likewise required to use their seat belt devices at all times. In the case of public motor vehicles, the driver shall be required to immediately inform and require the front seat passengers upon boarding a vehicle of running engine to wear the prescribed seat belts. Any passenger who refuses to wear a seat belt shall not be allowed to continue his/her', ""of its agencies, instrumentalities or political subdivisions, including government-owned or -controlled corporations or their subsidiaries for official use; and (3) Any diplomatic vehicle. (f) Public motor vehicle shall refer to public utility vehicle or vehicle for hire; (g) Driver refers to the individual operating a motor vehicle; and (h) Child Restraint System refers to a device, approved in accordance with Section 6 of this Act, capable of accommodating a child occupant in a sitting or supine position. It is so designed as to diminish the risk of injury to the wearer, in the event of a collision or of abrupt deceleration of the vehicle, by limiting the mobility of the child's body. SEC. 4. Mandatory Use of Child Restraint System in Motor Vehicles. - It shall be unlawful for the driver of a covered vehicle not to properly secure at all times a child, in a child restraint system while the engine is running or transporting such child"", 'risks while aboard motor vehicles. In order to guarantee the safety and welfare of infants and children and prevent traffic- related deaths and injuries, there is a need to adequately, consistently and objectively require, regulate, promote, and inform the public on the use of child restraint systems in motor vehicles and provide access to safe, appropriate, quality and affordable child restraint systems, in accordance with international standards accepted by the United Nations. Furthermore, there is also a need to study and determine appropriate safety measures for children being transported in public utility vehicles. SEC. 3. Definition of Terms. - For purposes of this Act, the term: (a) Adult refers to any person eighteen (18) years old and above; (b) Child refers to any person twelve (12) years old and below; (c) Covered vehicle refers to any private motor vehicle or public motor vehicle upon the determination of the Department of Transportation (DOTr) in accordance with Section 12 of this Act; (d) Motor vehicle', 'Pregnant Women and Senior Citizens in properly designated seats. Provide fare discount if applicable. 7. Instruct the passenger to fasten their seat belt if such is provided. 8. Inform the passenger on the prohibition of SMOKING on a public utility vehicle. 9. Instruct the passenger not to distract the driver while the vehicle is in motion. 10. Pick and drop passenger at the correct loading/unloading zone. 11. Be polite and courteous. 12. Assist passengers who need immediate emergency response. 153 Specific Responsibilities of a Driver MOTORCYCLES 1. Always wear Standard Protective Motorcycle Helmet and other safety protective gears (R.A. No. 10054). 2. The back rider must also wear protective helmet and safety gear (R.A. No. 10054/10666). 3. Ensure that a child below 18 years old (R.A. No. 10666): a. is able to reach around and grasp the waist of the rider; b. is wearing a standard', 'a free required to secure a franchise from the LTFRB under LTFRB Memorandum Circular No. 98-027. 61 Republic Act No. 11229 MANDATORY USE OF CHILD RESTRAINT SYSTEMS IN MOTOR VEHICLES It is unlawful for the driver of a covered vehicle not to properly secure at all times a child, in a child restraint system while the engine is running or when transporting such child on any road, street or highway unless the child is at least one hundred fifty (150) centimeters or fifty-nine (59) inches in height and is properly secured using the regular seat belt. The driver must ensure that: 1) The child restraint system is correctly installed in the vehicle through proper anchorage points; 2) The child restraint system is appropriate for the childs age, height and weight; 3) The harness straps and lap belt are firmly buckled and not twisted; 4) The shoulder strap crosses the center of the childs chest and not the childs neck; and 5) The lap belt fits across', 'harness straps and lap belt are firmly buckled and not twisted; 4) The shoulder strap crosses the center of the childs chest and not the childs neck; and 5) The lap belt fits across the childs thighs and hips and not across the abdomen. 62 Republic Act No. 11229 EXEMPTIONS This circumstances where the use of the child restraint system would put a child in greater danger, such as: 1) During medical emergencies; 2) When the child being transported has a medical, mental, psychological, psychiatric or developmental condition; or 3) Other analogous circumstances as may be determined by the DOTr in consultation with the DOH. The child being secured in a child restraint system, at no instance shall such child be left unaccompanied by an adult in a motor vehicle. FINES and PENALTIES First Offense - Php 1,000.00 Second Offense - Php 2,000.00 Third and Succeeding Offenses - Php 5,000.00 and suspension of the drivers license for a', '115 OG No. 17, 4171 (April 29, 20219) [ REPUBLIC ACT NO. 11229, February 22, 2019 ] AN ACT PROVIDING FOR THE SPECIAL PROTECTION OF CHILD PASSENGERS IN MOTOR VEHICLES AND APPROPRIATING FUNDS THEREFOR Be it enacted by the Senate and House of Representatives of the Philippines in Congress assembled: SECTION 1. Short Title. - This Act shall be known as the ""Child Safety in Motor Vehicles Act"". SEC. 2. Declaration of Policy. - It is the policy of the State to ensure the safety of children while being transported in any form of motor vehicle. The State recognizes the right of children to assistance, including proper care, and special protection from all forms of neglect, abuse and other conditions prejudicial to their development, including exposure to safety risks while aboard motor vehicles. In order to guarantee the safety and welfare of infants and children and prevent traffic- related deaths and injuries, there is a need to adequately, consistently and objectively require,', 'APPROPRIATING FUNDS THEREFOR It is the policy of the State to ensure the safety of children while being transported in any form of motor vehicle. The State recognizes the right of children to assistance, including proper; care, and special protection from all forms of neglect, abuse and other conditions prejudicial to their development, including exposure to safety risks while aboard motor vehicles. In order to guarantee the safety and welfare of infants and children and prevent traffic-related deaths and injuries., there is a need to adequately, consistently and objectively require, regulate, promote, and inform the public on the use of child restraint systems in motor vehicles and provide access to safe, appropriate, quality and affordable child restraint systems, in accordance with international standards accepted by the United Nations. Furthermore, there is also a need to study and determine appropriate safety measures for children being transported in public utility vehicles. 60 Republic Act No. 11229 DEFINITON OF TERMS (a) Adult refers to any person eighteen', 'SEAT BELTS USE ACT OF 1999 AN ACT REQUIRING THE MANDATORY COMPLIANCE BY MOTORISTS OF PRIVATE AND PUBLIC VEHICLES TO USE SEAT BELT DEVICES AND REQUIRING VEHICLE MANUFACTURERS TO INSTALL SEAT BELT DEVICES IN ALL THEIR MANUFACTURED VEHICLES It is policy of the State to secure and safeguard its citizenry, particularly the passengers and drivers of private and public motor vehicles, from the ruinous and extremely injurious effects of vehicular accidents. Towards this end, the State shall pursue a more proactive and preventive approach in order to secure the safety of the passengers and drivers at all times with the mandatory enforcement of the use of seat belt devices by the drivers and front seat passengers of private and public motor vehicles. MANDATORY USE OF SEAT BELTS Passengers of all motor vehicles whether private of for hire seated facing forward in the front row seats and those seated at the back row (the row of passenger immediately behind the driver) of private cars, Sports Utility Vehicles (SUV) and for hire vehicles are required to wear seat belts while inside a', 'EXEMPTION This Act does not apply to a passenger or operator with a physically disabling ailment or medical condition which would prevent appropriate restraint in a safety belt, if the condition is duly certified by a licensed physician and surgeon or a licensed chiropractor who shall state the nature of the condition as well as the reason why the restraint is inappropriate. 34 Republic Act No. 8750 FINES and PENALTIES FAILURE TO WEAR THE PRESCRIBED SEAT BELT AND FOR ALLOWING A CHILD SIX (6) YEARS OLD AND BELOW TO SIT ON THE FRONT PASSENGER SEAT. First Offense - One thousand pesos (Php 1,000.00) Second Offense - Two thousand pesos (Php 2,000.00) Third and Succeeding Offenses - Five thousand pesos (Php 5,000.00) plus one (1) week suspension of drivers license counting from the payment of fine FAILURE TO POST APPROPRIATE SEAT BELT SIGNAGE (FOR PUV) AND FAILURE TO REQUIRE THE FRONT SEAT PASSENGER TO WEAR A SEAT BELT. For', 'refuses to wear seat belts shall not be allowed to continue his/her trip. In addition, he/she will be informed that no insurance can be recovered in case of accident. Appropriate signage shall be posted on public or for hire vehicles. The seat belt law does not apply to seat belt assemblies for the following seat type: 1. Folding seats which are provided at aisles, loading platform or spaces other than those designed exclusively for installing seats (except those seats in which only the jump seat section can be folded.) 2. Single-seater provided at the side of the drivers seat three- wheeled motor vehicles where the rotational angle of the steering wheel or bar is less than seven times the rotational angle of steering tire. 3. Seats facing sideward. 4. Seats provided in close proximity to emergency exit. EXEMPTION This Act does not apply to a passenger or operator with a physically disabling ailment or medical condition which would prevent appropriate restraint in a safety belt, if the condition is duly certified', 'It shall be unlawful for any person to drive a two (2)-wheeled motorcycle with a child on board on public roads where there is heavy volume of vehicles, there is a high density of fast moving vehicles or where a speed limit of more than 60/kph is imposed, unless: (a) The child passenger can comfortably reach his/her feet on the standard foot peg of the motorcycle; E-Library - Information At Your Fingertips: Printer Friendly https://elibrary.judiciary.gov.ph/thebookshelf/showdocsfriendly/2/63318 1 of 3 10/17/2025, 10:59 PM (b) The childs arms can reach around and grasp the waist of the motorcycle rider; and (c) The child is wearing a standard protective helmet referred to under Republic Act No. 10054, otherwise known the Motorcycle Helmet Act of 2009. SEC. 5. Exception.  Notwithstanding the prohibition provided in the preceding', '1 of 5 10/17/2025, 11:20 PM (2) Any motor vehicle owned by the National Government or any of its agencies, instrumentalities or political subdivisions, including government- owned or -controlled corporations or their subsidiaries for official use; and (3) Any diplomatic vehicle. (e) ""Public motor vehicle"" shall refer to public utility vehicle or vehicle for hire. (f) ""Motor vehicle of running engine"" shall refer to a vehicle as stated herein, operating and standing on any road or thoroughfare with engine running. (g) ""Front seat passengers"" shall refer to persons on board a public utility vehicle seated at the right side beside the driver for public utility jeepneys (PUJs) and to passengers seated at the right side beside the driver and those at the first row immediately behind the driver in the case of public utility buses (PUBs) and to passengers seated on the right side beside the driver for private motor vehicles. SEC. 4. Mandatory', '[ IRR of REPUBLIC ACT NO. 10666, April 04, 2017 ] IMPLEMENTING RULES AND REGULATIONS (IRR) OF REPUBLIC ACT NO. 10666 ""AN ACT PROVIDING FOR THE SAFETY OF CHILDREN ABOARD MOTORCYCLES"" I. INTRODUCTION Pursuant to Section 11 of Republic Act No. 10666, otherwise known as the Children\'s Safety on Motorcycles Act of 2015 and in order to pursue a more proactive and preventive approach to secure the safety of passengers, especially children, by regulating the operation of motorcycles along roads and highways, the following Implementing Rules and Regulations are hereby promulgated. RULE 1  PRELIMINARY PROVISIONS Section 1. Coverage These Rules shall cover all acts of driving/riding a two (2)-wheeled motorcycles with a child on board. Section 2. Definition of Terms a. Act refers to Republic Act No. 10666; b. Child refers to any person below eighteen (18) years of age; c. Foot peg refers to a flat form attached to the motorcycles on which to', 'Certification Training Program. - The DOTr and the DTI are hereby mandated to formulate and implement a certification training program for product inspectors, law enforcers, manufacturers, distributors, and sellers on the regulation, installation, use, maintenance and inspection of child restraint system, as prescribed by IRR. SEC. 9 Child Safety in Public Utility Vehicles. - The DOTr shall conduct a study and recommend to Congress the use of child restraint systems in public utility vehicles such as jeepneys, buses, including school buses, taxis, vans, coasters, accredited/affiliated service vehicles of transportation network companies, and all other motor vehicles used for public transport. Should the DOTr determine, after study, that child restraint systems are not applicable in certain public utility vehicles, it shall recommend to Congress other safety measures and/or regulations for the safe and secure transportation of children in such vehicles: Provided, That the study shall be conducted within one (1) year from the effectivity of this Act.', 'the prohibited driving acts that could place your life at risk is: using mobile phone while driving 35. In which lane should you take upon merging on the expressway? Rightmost lane 36. If a driver operates a motor vehicle with a blinking/running/flashing brake light, he/she will be apprehended for: illegal modification 37. Are you allowed to leave your motor vehicle while the engine is running at a complete stop on the road? NO, not in any time It may cause confusion to other motorists and it may cause road crash 38. This could be one of the possible causes of road crash, if neglected: low level or leaking brake fluid 39. Under R.A. No. 11229, a child twelve (12) years old and below cannot sit at the back seat of a moving vehicle without the use of a ________________ child restraint system 40. While driving on the road, the driver is', 'to Five Hundred Thousand (Php 500,000.00) shall be imposed. FOR NON-PROFESSIONAL DRIVERS: 1st Conviction Confiscation and suspension of license for a period of 12 months. 2nd Conviction Revocation of license. FOR PROFESSIONAL DRIVERS: 1st Conviction Confiscation and perpetual revocation of license. 46 REPUBLIC ACT NO. 10666 CHILDRENS SAFETY ON MOTORCYCLES ACT OF 2015 AN ACT PROVIDING FOR THE SAFETY OF CHILDREN ABOARD MOTORCYLES It is the policy of the State to defend the right of children to assistance, including proper care and nutrition, and special protection from all forms of neglect, abuse, cruelty, exploitation, and other conditions prejudicial to their development. Towards this end, the State shall pursue a more proactive and preventive approach to secure the safety of passengers, especially children, by regulating the operation of motorcycles along roads and highways. PROHIBITION It shall be unlawful for any person to drive a two (2)-wheeled motorcycle with a child on board on public', ""assemblers and distributors to ensure that seat belt devices are properly installed before the distribution and sale of the said vehicles as determined by the IRR thereon: Provided, That manufacturers, assemblers and distributors of jeepneys may install a pelvic restraint or lap belt only in the driver's and front seat passengers' seats and this shall be considered as substantial compliance with the requirements of this Act. SEC. 8. Importation. - It shall be unlawful for any person to import or cause the importation of any vehicle without appropriate and operational seat belt devices as required herein and in accordance with the IRR thereon. SEC. 9. Type of Seat Belt Devices Required. - The seat belt devices required to be installed in all motor vehicles shall comply with the standards and specifications established by the Bureau of Product Standards of the Department of Trade and Industry (DTI) in consultation with the LTO of the Department of Transportation and Communications (DOTC): Provided, That the seat belt"", ""Law); and l. Temporary Operators Permit (TOP) refers to the citation ticket issued by an authorized LTO. RULE II  PROHIBITION Section 3. Prohibition It shall be unlawful for any person to drive a two (2)-wheeled motorcycle with a child on board on public roads where there is heavy volume of vehicles, there is a high density of fast moving vehicles or where a speed limit of more than 60/kph is imposed, unless: a. The child passenger can comfortable reach his/her feet on the standard foot peg of the motorcycle; b. The child's arm can reach around and grasp the waist of the motorcycle rider; and c. The child is wearing a standard protective helmet referred to under Republic Act No. 10054, otherwise known as the Motorcycle Helmet Act of 2009, and other protective gears as required by Section 4. Exception Notwithstanding the prohibition provided in the preceding section, this Act shall not apply to cases where the child to be transported requires immediate medical attention. RULE"", ""with the Land Transportation Franchising and Regulatory Board (LTFRB) and other concerned agencies and private stakeholders, aggressively and regularly conduct a nationwide information, education and communication (IEC) campaign on road safety, including the list of measures implemented pursuant to and violations punishable under this Act B. OFFICER Any officer who, in any manner, issues a driver's license without the necessary examinations, connives with the applicant for the irregular issuance of a license, or who, by gross negligence, issues a driver's license to an unqualified applicant shall suffer a penalty of removal from the service with all the accessory penalties attached thereto. 59 REPUBLIC ACT NO. 11229 CHILD SAFETY IN MOTOR VEHILCES ACT AN ACT PROVIDING FOR THE SPECIAL PROTECTION OF CHILD PASSENGERS IN MOTOR VEHICLES AND APPROPRIATING FUNDS THEREFOR It is the policy of the State to ensure the safety of children while being transported in any form of motor vehicle. The State recognizes the right of children to assistance,"", 'favor, and the same is renewable on or before the last working day of the month of his birth, attaching a readily recognizable photograph and after E-Library - Information At Your Fingertips: Printer Friendly https://elibrary.judiciary.gov.ph/thebookshelf/showdocsfriendly/2/26188 18 of 31 10/17/2025, 11:21 PM presentation of a medical certificate of fitness of applicant. Passenger trucks may be allowed to construct any cargo carrying device at the rear or at the side of the truck, subject to the approval of the Commissioner: Provided, however, That the total weight of the device, in-cluing the cargo, shall not exceed one hundred kilos. (b) Carrying of passengers and freight on top of vehicles.No person operating a motor vehicle shall allow any passenger to ride on the cover or top of such vehicles: Provided, however, That subject to such conditions as may be contained in', 'the policy of the State to secure and safeguard its citizenry, particularly the passengers and drivers of private and public motor vehicles, from the ruinous and extremely injurious effects of vehicular accidents. Towards this end, the State shall pursue a more proactive and preventive approach in order to secure the safety of the passengers and drivers at all times with the mandatory enforcement of the use of seat belt devices by the drivers and front seat passengers of private and public motor vehicles. SEC. 3. Definition of Terms. - For purposes of this Act, the term: (a) ""Motorist"" shall refer to the driver of a motor vehicle. (b) ""Seat belt device"" shall refer to any strap, webbing or similar device in the form of pelvic restraint or lap belt, upper torso restraint or shoulder strap or a combination thereof designed to secure a person in a motor vehicle in order to mitigate the results of any accident, including all necessary buckles and other', ""for Disabled Persons), and R.A. No. 11314 (Student Fare Discount Act)? 20% discount of the prescribed fare for senior citizens, PWDs, and students 3. Seatbelts must be worn by the driver and the passenger at: all times, in any kind of road condition regardless of the destination 4. What documents should always be carried by a conductor? Conductor's License, Photocopy of Valid Franchise/Certificate of Public Convenience (CPC), Certificate of Registration (CR) and current Official Receipt (OR) of payment 5. If a motor vehicle is a 61-seater including the driver's seat, how many passengers are allowed to board in it? 60 passengers 6. By law, the front seat of For Hire buses are reserved for: Senior Citizens, persons with disability (PWDs), and pregnant women Pursuant to Joint Administrative Order No. 2014-01 159 Conductors License QUESTION ANSWER 7. The Conductor's License CANNOT be used"", 'H. No. 4462; Manila Bulletin (August 5, 2015); 111 OG No. 37, 5381 (September 14, 2015) [ REPUBLIC ACT No. 10666, July 21, 2015 ] AN ACT PROVIDING FOR THE SAFETY OF CHILDREN ABOARD MOTORCYLES Be it enacted by the Senate and House of Representatives of the Philippines in Congress assembled: SECTION 1. Short Title.  This Act shall be known as Childrens Safety on Motorcycles Act of 2015. SEC. 2. Declaration of Policy.  It is the policy of the State to defend the right of children to assistance, including proper care and nutrition, and special protection from all forms of neglect, abuse, cruelty, exploitation, and other conditions prejudicial to their development. Towards this end, the State shall pursue a more proactive and preventive approach to secure the safety of passengers, especially children, by regulating the operation of motorcycles along roads and highways. SEC. 3. Definitions.  For purposes of this Act,', 'penalty for allowing passengers to ride on top or cover of a side car? Monetary fines 174 Professional  Motorcycle (A, A1) QUESTION ANSWER 9. While driving on the road and you are about to slow down, you must check for: vehicles behind to avoid collision 10. Safety in driving motorcycle is a must, thus you should: wear standard helmet and proper protective gear 11. At times when the vehicle in front of you does NOT give way, you must: be patient and do NOT overtake 12. In stopping, it is always safe to: use the front and rear brakes at the same time 13. In making a U-turn, it is NOT advisable to use ___________ the front wheel brake 14. In a merging road or traffic, you must check _______________ your speed, brakes, side mirrors and signals 15. The feet of a rider while driving a motorcycle', 'and emission compliant vehicle (BLOWBAGETS/BLOWBAGA). 7. Ensure that the vehicle is kept clean, tidy and in good running condition at all times. 8. Be knowledgeable on what to do and act in case of road crash. 9. Be knowledgeable on the rights and privileges of a drivers license holder. 10. Always observe road safety, discipline, and courtesy. 11. Be in a healthy condition. 152 Specific Responsibilities of a Driver BUSES and JEEPNEYS 1. Collect the appropriate fare. 2. Display the duly authorized fare matrix. 3. Issue official fare receipt/ticket. 4. Return the full amount of ticket fare whenever the trip is cut. 5. Convey passengers no more than the sitting capacity of the vehicle. 6. Accommodate Persons with Disability (PWDs), Pregnant Women and Senior Citizens in properly designated seats. Provide fare discount if applicable. 7. Instruct the passenger to fasten their seat belt if such is provided. 8. Inform', 'more proactive and preventive approach to secure the safety of passengers, especially children, by regulating the operation of motorcycles along roads and highways. SEC. 3. Definitions.  For purposes of this Act, the following terms shall mean: (a) Motorcycle refers to any two (2)-wheeled motor vehicle having one (1) or two (2) riding saddles; (b) Public roads refer to roads designed by the national government or local government units as roads for public use such as, but not limited to, national highways, provincial roads, city, municipal and barangay streets; (c) Foot peg refers to a flat form attached to the motorcycles on which to stand or brace the feet; and (d) Rider refers to the driver of a motorcycle. SEC. 4. Prohibition.  It shall be unlawful for any person to drive a two (2)-wheeled motorcycle with a child on board on public roads where there is heavy volume of vehicles, there is a high density of fast', 'of the owner and/or driver. 5. The following vehicles are not allowed to enter the Expressway at any time: a. Motorcycles (below 400 cc), tricycles, all kinds of scooters and bicycles; exceptions - only 1 back ride is allowed; helmets must be worn at all times b. Vehicles being towed, except those which are being removed from the expressway c. Dilapidated and not roadworthy vehicles (i.e., vehicles without headlights, taillights, brake lights, vehicles with misaligned chassis, bald tires, etc.) d. Smoke belchers (as per Clean Air Act R.A. No. 8749) e. Trucks carrying construction aggregates (including sand, gravel, and fill materials) not leveled and/or without cover f. Vehicles with cargo not battened down and/or not firmly fastened 126 Before Starting and Driving on the Road 6. Lane No. 1 (innermost lane) or the lane nearest the Median Barrier', 'RECEIPT WHILE DRIVING A MOTOR VEHICLE J. ALL OTHER VIOLATIONS OF TRAFFIC RULES AND REGULATIONS Seat Belts Use Act of 1999 Motorcycle Helmet Act of 2009 Php 1,000.00 Php 1,000.00 This includes the following traffic violations: 1. Parking a. In an intersection b. Within 6 meters of the intersection c. In front of the driveway entrance d. Within 4 meters of a fire hydrant e. In front of a private driveway f. On the roadway side of any unmoving or parked MV at the curb or edge of the highway g. At any place where signs of prohibitions have been installed 2. Disregarding Traffic Signs. 3. Allowing passengers on top or cover of a motor vehicle except in a truck helper. 4. Failure to provide canvass cover to cargoes or freight of trucks requiring the same. 5. Permitting passenger to ride on running board, step board or mudguard of MV while the same in motion. 6. Failure to dim headlights when approaching another', ""Blood Alcohol Content when driving: 0.00% If you drink, dont drive If you drive, dont drink 33. What is the exemption for a child to ride a motorcycle pursuant to R.A. No. 10666 Childrens Safety on Motorcycle Act? When the child to be transported requires immediate medical attention 34. What is the risk of driving alongside a car? It is prone to road crash due to blind spots 35. Sleeping early and being physically fit is a: good professional driver's trait 36. When driving a motorcycle with a back rider, one must anticipate: longer braking distance 37. An orange traffic sign means: there is roadwork ahead and you must follow the prescribed speed limit 38. If you are hesitant to overtake the vehicle in front, you must: NOT overtake 177 Professional  Motorcycle (A, A1) QUESTION ANSWER 39. A solid yellow line prohibits a motorist to ________ overtake 40. If two passengers"", 'United States of America: Provided, further, That in the case of automobiles with altered, changed or rebuilt bodies, the weight as obtained: by actual weighing shall be considered the vehicles weight: Provided, furthermore, That the increased registration fees herein prescribed shall not apply to jeeps and jeepneys for private use or for hire and the fees hereof shall be those prescribed for them before the approval of this Act E-Library - Information At Your Fingertips: Printer Friendly https://elibrary.judiciary.gov.ph/thebookshelf/showdocsfriendly/2/26188 8 of 31 10/17/2025, 11:21 PM The registered passenger capacity of passenger auto-mobiles operated for hire or for private use shall be determined as follows: 1. For each adult passenger, a horizontal rectangular area, including seat and feet space, not less than thirty-five centimeters wide and sixty centimeters long, except in the front seat, which', 'also a need to study and determine appropriate safety measures for children being transported in public utility vehicles. 60 Republic Act No. 11229 DEFINITON OF TERMS (a) Adult refers to any person eighteen (18) years old and above; (b) Child refers to any person twelve (12) years old and below; (c) Child Restraint System refers to a device, approved in accordance with Section 6 of this Act, capable of accommodating a child occupant in a sitting or supine position. It is so designed as to diminish the risk of injury to the wearer, in the event of a collision or of abrupt deceleration of the vehicle, by limiting the mobility of the childs body. (d) Import Commodity Clearance (ICC) refers to a document issued by the DTI  Bureau of Philippine Standards (DTI-BIS) attesting that the imported product conforms to the requirements of the relevant Philippine National Standards. (e)', 'and Section 11 thereof on the use of special car seats are hereby amended. All other laws, decrees, executive orders, rules and regulations, issuances or parts thereof inconsistent with this Act are hereby repealed or amended accordingly. SEC. 18. Effectivity. - This Act shall take effect fifteen (15) days after its publication in the Official Gazette or in two (2) national newspapers of general circulation. Approved, (SGD.) GLORIA MACAPAGAL-ARROYO Speaker of the House of Representatives (SGD.) VICENTE C. SOTTO III President of the Senate This Act which is consolidation of Senate Bill No. 1971 and House Bill No. 6938 was E-Library - Information At Your Fingertips: Printer Friendly https://elibrary.judiciary.gov.ph/thebookshelf/showdocsfriendly/2/95785 5 of 6 10/17/2025, 11:06 PM passed by the Senate and the House', 'on top of vehicles.No person operating a motor vehicle shall allow any passenger to ride on the cover or top of such vehicles: Provided, however, That subject to such conditions as may be contained in permits that may be issued by the Commissioner, baggage or freight may be carried on the top of a truck provided the weight thereof does not exceed twenty kilos per square meter and is distributed in such a manner as not to endanger the passengers or stability of the truck. (c) Riding on running boards.No driver shall permit any person to ride on the running board, step board, or mudguard of his motor vehicle for any purpose except to make repair or adjustment in the motor or to collect fares. SEC. 33. Passenger or freight capacity marked on vehicle.All passenger automobiles for hire shall have the registered passenger capacity plainly and conspicuously marked on both sides thereof, in letters and numerals not less than five centimeters in height. All motor trucks, whether for passenger or freight private,']","According to Republic Act No. 8750, children with ages six (6) years and below are prohibited to sit in the front seat of any running motor vehicle (SEC. 5).","No child 12 years and below shall be allowed to sit in a front seat of a motor vehicle with a running engine on any road, street, or highway.",1.0,0.6980174394092552
What is the penalty for driving under the influence of alcohol?,"['UNDER THE INFLUENCE OF ALCOHOL, DANGEROUS DRUGS, AND SIMILAR SUBSTANCES, AND FOR OTHER PURPOSES DECLARATION OF POLICY Pursuant to the Constitutional principle that recognizes the protection of life and property and the promotion of the general welfare as essential for the enjoyment of the blessing of democracy, it is hereby declared the policy of the State to ensure road safety through the observance of the citizenry of responsible and ethical driving standards. Towards this end, the State shall penalize the acts of driving under the influence of alcohol, dangerous drugs and other intoxicating substances and shall inculcate the standards of safe driving and the benefits that may be derived from it through institutional programs and appropriate public information strategies. PUNISHABLE ACT It shall be unlawful for any person to drive a motor vehicle while under the influence of alcohol, dangerous drugs and/or other similar substances. Driving under the influence of alcohol refers to the act of operating a motor vehicle while the drivers blood alcohol concentration level has, after being subjected to a breath analyzer', 'the effects of the consumption of alcoholic beverages on the ability of a person to operate a motor vehicle, the hazards of driving under the influence of alcohol, dangerous drugs and/or other similar substances, and the penalties attached for violation thereof. For professional drivers, every applicant for a drivers license or those applying for renewal thereof shall undergo the drivers education herein stated. The drivers license written examination shall include questions concerning the effects of alcohol and drug intoxication on the ability of a person to operate a motor vehicle and the legal and pecuniary consequences resulting from violation of the provisions of this Act. SEC. 5. Punishable Act.  It shall be unlawful for any person to drive a motor vehicle while under the influence of alcohol, dangerous drugs and/or other similar substances. SEC. 6. Conduct of Field Sobriety, Chemical and Confirmatory Tests.  A law enforcement officer who has probable cause to believe that a person is driving under the influence of alcohol, dangerous drugs and/or other similar', '1 of 6 10/17/2025, 11:16 PM (e) Driving under the influence of alcohol refers to the act of operating a motor vehicle while the drivers blood alcohol concentration level has, after being subjected to a breath analyzer test, reached the level of intoxication, as established jointly by the Department of Health (DOH), the National Police Commission (NAPOLCOM) and the Department of Transportation and Communications (DOTC). (f) Driving under the influence of dangerous drugs and other similar substances refers to the act of operating a motor vehicle while the driver, after being subjected to a confirmatory test as mandated under Republic Act No. 9165, is found to be positive for use of any dangerous drug. (g) Field sobriety tests refer to standardized tests to initially assess and determine intoxication, such as the horizontal gaze nystagmus, the walk-and-turn, the one-leg stand, and other similar tests as determined jointly', '11:16 PM proper conduct of field sobriety tests, which guidelines shall be made available to the public and made available for download through the official LTO website. SEC. 12. Penalties.  A driver found to have been driving a motor vehicle while under the influence of alcohol, dangerous drugs and/or other similar substances, as provided for under Section 5 of this Act, shall be penalized as follows: (a) If the violation of Section 5 did not result in physical injuries or homicide, the penalty of three (3) months imprisonment, and a fine ranging from Twenty thousand pesos (Php20,000.00) to Eighty thousand pesos (Php80,000.00) shall be imposed; (b) If the violation of Section 5 resulted in physical injuries, the penalty provided in Article 263 of the Revised Penal Code or the penalty provided in the next preceding subparagraph, whichever is higher, and a fine ranging from One hundred thousand pesos', 'the policy of the State to ensure road safety through the observance of the citizenry of responsible and ethical driving standards. Towards this end, the State shall penalize the acts of driving under the influence of alcohol, dangerous drugs and other intoxicating substances as defined under said Act and these Rules and shall inculcate the standards of safe driving and the benefits that may be derived from it through institutional programs and appropriate public information strategies. Section 2. Coverage These Rules shall cover all acts of driving and/or operating a motor vehicle while under the influence of alcohol, and/or dangerous drugs and similar substances. Section 3. Definition of Terms For purposes of these Rules, the terms hereunder shall be understood as follows: a. b. C. Act refers to Republic Act No. 10586. Alcohol refers to alcoholic beverages classified into beer, wine and distilled spirits, the consumption of which produces intoxication. Blood Alcohol Concentration (BAC) refers to the measure of amount of', 'S. No. 3365; H. No. 4251; 109 OG No. 37, 6182 (September 16, 2013); Manila Bulletin; Philippine Star, June 6, 2013 [ REPUBLIC ACT NO. 10586, May 27, 2013 ] AN ACT PENALIZING PERSONS DRIVING UNDER THE INFLUENCE OF ALCOHOL, DANGEROUS DRUGS, AND SIMILAR SUBSTANCES, AND FOR OTHER PURPOSES Be it enacted by the Senate and House of Representatives of the Philippines in Congress assembled: SECTION 1. Short Title.  This Act shall be known as the Anti-Drunk and Drugged Driving Act of 2013?. SEC. 2. Declaration of Policy.  Pursuant to the Constitutional principle that recognizes the protection of life and property and the promotion of the general welfare as essential for the enjoyment of the blessing of democracy, it is hereby declared the policy of the State to ensure road safety through the observance of the citizenry of responsible and ethical driving standards. Towards this end, the State shall penalize the acts of driving under', 'to be released by a regular court of competent jurisdiction after payment of appropriate fines and penalties. Php 10,000.00 In addition, the drivers license shall be confiscated, and revoked upon conviction for the crime. The driver shall be disqualified from being granted a drivers license for a period of 5 years counted from the date of payment of appropriate fines and penalties The motor vehicle driven by the violator shall likewise be impounded until ordered to be released by a regular court of competent jurisdiction after payment of appropriate fines and penalties. 74 D. Refer to R.A. No. 10586 E. RECKLESS DRIVING No person shall operate a motor vehicle on any highway recklessly or without reasonable caution considering the width, traffic, grades, crossing, curvatures, visibility and other conditions of the highway and the conditions of the atmosphere and weather, or so to endanger the property of the safety or rights of any person or so as to cause excessive or unreasonable damage to the highway. This includes driving with an improperly', '2. Mandatory Alcohol and Chemical Testing of Drivers Involved in Motor Vehicular Accidents A driver of a motor vehicle involved in a vehicular accident resulting in the loss of human life or physical injuries shall be subjected to chemical tests, including a drug screening test and, if necessary, a drug confirmatory test as mandated under Republic Act No. 9165, to determine the presence and/or concentration of alcohol, dangerous drugs and/or substances in the bloodstream or body. 3. Nationwide Random Terminal Inspection and Quick Random Drug Tests These rules shall cover all acts of driving and/or operating a motor vehicle while under the influence of alcohol and/or dangerous drugs and similar substances. 45 Republic Act No. 10586 FINES and PENALTIES A driver found to have been driving a motor vehicle while under the influence of alcohol, dangerous drugs and/or other similar substances shall be penalized as follows: If the violation did not result in physical injuries or homicide Twenty thousand pesos (Php', '1 IMPLEMENTING RULES AND REGULATIONS Republic Act No. 10586 ""An Act Penalizing Persons Driving Under The Influence Of Alcohol, Dangerous Drugs, And Similar Substances, And For Other Purposesn Otherwise known as the ""Anti-Drunk and Drugged Driving Act of 2013"" I. INTRODUCTION Pursuant to Section 17 of Republic Act No. 10586, the following Implementing Rules and Regulations are hereby prescribed jointly by the Department of Transportation and Communications (DOTC), Department of Health (DOH) and the National Police Commission (NAPOLCOM) to carry out the provisions of said Act. RULE I - PRELIMINARY PROVISIONS Section 1. Policy Pursuant to the Constitutional principle that recognizes the protection of life and property and the promotion of the general welfare as essential for the enjoyment of the blessing of democracy, it is hereby declared the policy of the State to ensure road safety through the observance of the citizenry of responsible and ethical driving standards. Towards this end, the State shall penalize the acts of driving under the', 'vehicle, a common carrier hauling volatile, flammable or toxic material, or a driver who commits an act classified herein as distracted driving within a fifty (50)-meter radius from the school premises shall be subject to a penalty of thirty thousand pesos (P30,000.00) and suspension of ones drivers license for three (3) months. The foregoing penalties shall be imposed without prejudice to other liabilities under the Revised Penal Code or any special law, arising out or on occasion of the herein prohibited acts. SEC. 9. Liability of Owner and/or Operator of the Vehicle Driven by the Offender.  The owner and/or operator of the vehicle driven by the offender shall be directly and principally held liable together with the offender for the fine unless he or she is able to convincingly prove that he or she has exercised extraordinary diligence in the selection and supervision of his or her drivers in general and the offending driver in particular. This section shall principally apply to', 'drugs and/or other similar substances. Driving under the influence of alcohol refers to the act of operating a motor vehicle while the drivers blood alcohol concentration level has, after being subjected to a breath analyzer test, reached the level of intoxication. 39 Republic Act No. 10586 Conclusive proof that a driver is driving under the influence of alcohol. Driving under the influence of dangerous drugs and other similar substances refers to the act of operating a motor vehicle while the driver, after being subjected to a confirmatory test as mandated under Republic Act No. 9165, is found to be positive for use of any dangerous drug. Dangerous drugs and other similar substances refer to drugs listed in the schedules annexed to the 1961 Single Convention on Narcotics Drugs, as amended by the 1972 Protocol, and in the schedules annexed to the 1971 Single Convention of Psychotropic Substances as enumerated in its attachment which is an integral part of Republic Act No. 9165 otherwise known as the Comprehensive Dangerous Drugs Act of 2020 and', 'Dangerous drugs and other similar substances refer to drugs listed in the schedules annexed to the 1961 Single Convention on Narcotics Drugs, as amended by the 1972 Protocol, and in the schedules annexed to the 1971 Single Convention of Psychotropic Substances as enumerated in its attachment which is an integral part of Republic Act No. 9165, otherwise known as the ""Comprehensive Dangerous Drugs Act of 2002"" and those that the Dangerous Drugs Board may reclassify, add to or remove from the list of dangerous drugs. Driving under the influence of alcohol (DUIA) refers to the act of operating a motor vehicle while the driver\'s BAC level has, after being subjected to an ABA test, reached the level of intoxication, as established jointly by the DOH, the NAPOLCOM and the DOTC, in these Rules. For this purpose, a driver of a private motor vehicle with a gross vehicle weight not exceeding 4500 kg. a BAC of 0.05% or higher shall be', 'heavy volume of vehicles; - there is a high density of fast moving vehicles; or - where a speed limit of more than 60/kph is imposed * Commission of a crime in the course of apprehension upon conviction by a regular court of competent jurisdiction * Colorum violation * Driving a motor vehicle while under the influence of alcohol, dangerous drugs and/or similar substance upon final conviction by a regular court of competent jurisdiction [Sec. 12 of R.A. No. 10586 (Anti-Drunk and Drugged * 2nd offense of Sec. 4 of R.A. 10913 (Anti-Distracted Driving Act) for acts in a motor vehicle in motion, or temporarily stopped at a traffic light or any intersection, whether diplomatic, public or private: * 1st offense of Sec. 4 of R.A. 10913 (Anti-Distracted Driving Act) for acts in a motor vehicle in motion, or temporarily stopped at a traffic light or any intersection, whether diplomatic, public or private:', 'vehicle while under the influence of alcohol, dangerous drugs and/or other similar substances shall be penalized as follows: If the violation did not result in physical injuries or homicide Twenty thousand pesos (Php 20,000.00) to Eighty thousand pesos (Php 80,000.00) fine and three (3) months imprisonment; If the violation resulted in physical injuries The penalty provided in Article 263 of the Revised Penal Code or the penalty provided in the next preceding paragraph whichever is higher and a fine of One Hundred Thousand (Php 100,000.00) to Two Hundred Thousand (Php 200,000.00) shall be imposed; If the violation has resulted in homicide A penalty provided in Article 249 of the Revised Penal Code and a fine ranging from Three Hundred Thousand (Php 300,000.00) to Five Hundred Thousand (Php 500,000.00) shall be imposed. FOR NON-PROFESSIONAL DRIVERS: 1st Conviction Confiscation and suspension of license for a period of 12', 'R.A. No. 10586 - Anti-Drunk and Drugged Driving Act of 2013 F. R.A. No. 10913 - Anti-Distracted Driving Act G. R.A. No. 10916 - Road Speed Limiter Act of 2016 H. R.A. No. 10930 - Rationalizing and Strengthening the Policy Regarding Drivers License Amending Sec. 23 of R.A No. 4136 7) Traffic Violations, Fines and Penalties (JAO 2014-01) A. Violations in Connection with Licensing B. Violations in Connection with Motor Vehicle Registration/Renewal /Operation C. Violations in Connection with Dimensions, Specifications, Weight and Load Limits D. Violations in Connection with Franchise 55 Course Content of Driving School  Heavy Vehicles IV. DEFENSIVE DRIVING 1) Defensive Driving  Attitude and Behavior 2) Driver Perception and Awareness A. SIPDE - Scanning process - Leaving yourself an out B. Factors Affecting Concentration - Man Made (distracted driving) - Physiological C. Factors Affecting Driving Skills -', ""license or those applying for renewal thereof shall undergo the driver's education herein stated. b. The training course for all applicants of driver's license, whether new or renewal, shall be implemented uniformly nationwide and shall include the impact of alcohol, drugs, fatigue and distracted driving on a driver's performance as well as the penalties attached for violation thereof. c. The driver's license written examination shall include questions concerning the effects of alcohol and drug intoxication on the ability of a person to operate a motor vehicle and the legal and pecuniary consequences resulting from violation of the provisions of this Act. For this purpose, the L TO shall cause the revision of all modules on the effects of alcohol and drug intoxication while driving. RULE Ill - PROCEDURE FOR APPREHENSION Section 1. Probable Cause Probable cause shall mean that the LEO has reasonable ground to believe that the person driving the motor vehicle is under the influence of alcohol, dangerous drugs and/or other similar substances upon personally witnessing a"", 'the abovementioned fine, the driver\'s license of an erring applicant, if one is granted by reason of such misrepresentation, connivance, falsification or cheating, shall be revoked, and the applicant shall be prohibited from applying for a period of two (2) years. The repetition as such offense shall warrant the perpetual disqualification from being granted a driver\'s license in addition to the fine above-stated; and ""(c) A holder of a driver\'s license who acts in violation of the provisions of Republic Act No. 4136 and other existing traffic laws shall suffer corresponding penalties as may be provided by law and other issuances. ""In case of death or physical injuries resulting in the loss of any part of the victim\'s body or the use thereof, insanity, imbecility, impotence or blindness, or incapacity to work for more than ninety (90) days, the license of the offending driver shall be', ""Probable Cause Probable cause shall mean that the LEO has reasonable ground to believe that the person driving the motor vehicle is under the influence of alcohol, dangerous drugs and/or other similar substances upon personally witnessing a traffic offense committed by means of lane straddling, making sudden stops, overspeeding, swerving or weaving in such an apparent - Implementing Rules and Regulations I RA 10586 4 way as to indicate that the driver is under the influence of alcohol, dangerous drugs and/or other similar substances. In the course of apprehension for another traffic offense, the evident smell of alcohol in a driver's breath, generally slurred speech in response to questioning, bloodshot or reddish eyes, flushed face, poor coordination, difficulty in understanding and responding intelligently to questions shall also constitute probable cause. In any case, the burden of proof to establish the existence of probable cause is on the LEO. a. Procedure in screening for driving under the influence of alcohol i. Upon personal determination of probable cause,"", 'even when you believe that you did not violate any traffic rules and regulations? Stop at the roadside and politely ask the reason why you were being stopped 168 Nonprofessional  Light (B, B1, B2) QUESTION ANSWER 1. If you are parking uphill on a road without a curb, turn the wheels toward the ___________ edge of the road 2. What does a flashing yellow light mean? You can proceed through the intersection with caution 3. When parking downhill, you must: turn your wheels toward the curb 4. When parking uphill, you must: turn your wheels away from the curb 5. A solid yellow or white line on the road means: passing/overtaking is NOT allowed 6. A red flag or red light must be attached to any load that extends over: one (1.0) meter from the body of the vehicle 7. What are the effects of alcohol in a driver? Poor coordination of body movements and', 'PNP shall conduct periodic training seminars for their LEOs with regard to the proper conduct of field sobriety tests and ABA tests. Within four (4) months from the effectivity of this Act, the LTO shall publish the guidelines and procedures for the proper conduct of field sobriety tests, which guidelines shall be made available to the public and made available for download through the official L TO website. RULE VI - PENAL TIES Section 1. A driver found to have been driving a motor vehicle while under the influence of alcohol, dangerous drugs and/or other similar substances, as provided for under Section 5 of RA 10586, shall be penalized as follows: a. b. C. If the violation did not result in physical injuries or homicide, the penalty of three (3) months imprisonment, and a fine ranging from Twenty thousand pesos (Php 20,000.00) to Eighty thousand pesos (Php 80,000.00) shall be imposed; If the violation resulted in physical', 'the atmosphere and weather, or so to endanger the property of the safety or rights of any person or so as to cause excessive or unreasonable damage to the highway. This includes driving with an improperly registered motor vehicle or a motor vehicle with expired, revoked, suspended, or invalid registration, unregistered of fake substitute or replacement engine, engine block or chassis. F. SUBMISSION OF FAKE DOCUMENTS IN RELATION TO THE APPLICATION FOR A DRIVERS LICENSE (NEW/RENEWAL) Anti-Drunk and Drugged Driving Act of 2013 First offense Php 2,000.00 Second offense Php 3,000.00 Subsequent offense Php10,000.00 In addition, the drivers license shall be suspended for a period of three (3) months for the second offense and six (6) months for the third offense from payment of fine and revocation of drivers license on the succeeding offense. A revoked non-professional driver shall be disqualified from being granted a drivers license for a period of two (2) years counted from', 'similar device, shall hold fast to or hitch on to any moving vehicle, and no driver shall knowingly permit any person to hang on to or ride, the outside or rear end of his vehicle or allow any person on a bicycle, roller skate or other similar device to hold fast or hitch to his vehicle. SEC. 52. Driving or parking on sidewalk.No person shall drive or park a motor vehicle upon or along any sidewalk, path or alley not intended for vehicular traffic or parking. SEC. 53. Driving while under the influence of liquor or narcotic drug.No person shall drive a motor vehicle while under the influence of liquor or narcotic drug. SEC. 54. Obstruction of traffic.No person shall drive his motor vehicle in such a manner as to obstruct or impede the passage of any vehicle, nor, while discharging or taking on passengers or loading or unloading freight, obstruct the free passage of other vehicles on the', ""Light (B, B1, B2) QUESTION ANSWER 13. At a normal speed, keeping one's distance lessens the risk of road crash. One good rule is to leave a car length or follow the __________. 2-second rule 14. What should you do if you drive in heavy traffic and want to change lanes? Look out for cyclists/ motorcyclists filtering through the traffic 15. Where should you NOT overtake? At intersections and when approaching a bridge, curve, or a crest Solid yellow or white line, shoulder of the road, railroad, hospital and school zone, busy streets 16. What is the maximum penalty for driving under the influence of liquor or prohibited drugs? Perpetual forfeiture of driver's license 17. What should be done first when changing lanes? Make a signal 18. When merging on expressway, you have to make full use of the: acceleration lane (continuity lane) 19. What should a driver"", 'While driving downhill, you can preserve your brake by using the: engine brake 28. What are the usual causes of flat tires? Improper tire inflation, overloading and excessive use of tires (tread wear) 29. Where do you usually see a directional traffic sign? Before the junction 181 Professional  Light (B, B1, B2) QUESTION ANSWER 30. In what instances will speed restrictions NOT apply? When drivers of ambulance, fire trucks, police cars, physicians, armed forces, and traffic enforcers are responding to emergency, and when any driver is bringing wounded or sick person for emergency treatment to hospitals Pursuant to R.A. No. 4136 31. Aside from the monetary fine, what is the additional penalty of a driver apprehended for NOT wearing a seatbelt for the third offense? Suspension of drivers license for one (1) week Pursuant to Joint Administrative Order No. 2014-01 32. The maximum speed limit for light vehicles in expressways is: 100 kph 33.', ""it shall be the duty of the law enforcement officer to bring the driver to the nearest police station to be subjected to a drug screening test and if necessary, a drug confirmatory test as mandated under R.A. No. 9165. 44 Republic Act No. 10586 DRIVER REFUSES TO UNDERGO THE MANDATORY TESTING A driver of a motor vehicle who refuses to undergo the mandatory testing as required shall be penalized by the confiscation and automatic revocation of his/her driver's license, in addition to other penalties provided herein and/or other pertinent law, after compliance with the requirement of due process. 1. Traffic Offense like: - Swerving / Weaving (Lane Deviation) - Make sudden stops - Speeding - Other offenses stated under R.A. No. 4136 2. Mandatory Alcohol and Chemical Testing of Drivers Involved in Motor Vehicular Accidents A driver of a motor vehicle involved in a vehicular accident resulting in the loss of human life or physical injuries shall"", ""Blood Alcohol Content when driving: 0.00% If you drink, dont drive If you drive, dont drink 33. What is the exemption for a child to ride a motorcycle pursuant to R.A. No. 10666 Childrens Safety on Motorcycle Act? When the child to be transported requires immediate medical attention 34. What is the risk of driving alongside a car? It is prone to road crash due to blind spots 35. Sleeping early and being physically fit is a: good professional driver's trait 36. When driving a motorcycle with a back rider, one must anticipate: longer braking distance 37. An orange traffic sign means: there is roadwork ahead and you must follow the prescribed speed limit 38. If you are hesitant to overtake the vehicle in front, you must: NOT overtake 177 Professional  Motorcycle (A, A1) QUESTION ANSWER 39. A solid yellow line prohibits a motorist to ________ overtake 40. If two passengers"", ""suspension of driver's license for three (3) months, for the third offense; and d. A fine of twenty thousand pesos (P20,000.00) for the fourth offense and succeeding offenses, and revocation of driver's license. Provided, that a driver of a public utility vehicle, a school bus, a school service vehicle, a common carrier hauling volatile, flammable or toxic material, or a driver who commits an act classified herein as distracted driving within a fifty (50)-meter radius from the school premises shall be subject to a penalty of thirty thousand pesos (P30,000.00) and suspension of one's driver's license for three (3) months. Provided, that the implementation of Section 8(c) hereof, an offender operating a conveyance or machinery which do not require a driver's license, the penalty shall be impoundment of the conveyance or machinery in lieu of the"", ""license of erring applicant, if one is granted by reason of such misrepresentation, connivance, falsification or cheating, shall be revoked, and the applicant shall be prohibited from applying for a period of two (2) years. The repetition of such offense shall warrant the perpetual disqualification from being granted driver's license in addition to the fine above-stated; and c. A holder of the driver's license who acts in violation of the provisions of Republic Act No. 4136 and other existing traffic laws shall suffer corresponding penalties as may be provided by law and other issuances. In case of death or physical injuries resulting in the loss of any part of the victim's body or the use thereof, insanity, imbecility, impotence or blindness, or incapacity to work for more than ninety (90) days, the license of the offending driver shall be revoked for a period of four (4) years, after a finding by"", 'to the 1971 Single Convention of Psychotropic Substances as enumerated in its attachment which is an integral part of Republic Act No. 9165 otherwise known as the Comprehensive Dangerous Drugs Act of 2020 and those that the Board may reclassify, add to or remove from the list of dangerous drugs. BAC Private Motor Vehicle with gross vehicle weight not exceeding 4,500kgs - 0.05% or higher Trucks, Buses, Motorcycles and Public Utility Vehicle - more than 0.00% 40 Republic Act No. 10586 PROBABLE CAUSE Probable cause shall mean that the LEO has reasonable ground to believe that the person driving the motor vehicle is under the influence of alcohol, dangerous drugs and/or other similar substances: 1st Probable Cause Upon personally witnessing a traffic offense committed by means of lane straddling, making sudden stops, speeding, swerving or weaving in such an apparent way as to indicate that the driver is under the influence of alcohol, dangerous drugs, and/or other similar substances. 2nd', ""hereof, an offender operating a conveyance or machinery which do not require a driver's license, the penalty shall be impoundment of the conveyance or machinery in lieu of the confiscation of the driver's license. Provided, further, that in the event the fine imposed is not settled within six (6) months from the date of apprehension, the implementing agency shall exhaust all available legal remedies to implement this Section. The foregoing penalties shall be imposed without prejudice to other liabilities under the Revised Penal Code or any special law, arising out or on occasion of the herein prohibited acts. The implementing agency may increase the amount of fine herein imposed once every five (5) years in the amount not exceeding ten percent (10%) of the existing rates sought to be increased which shall take effect only upon publication in at least two (2) newspapers of general circulation. Section 9. Liability of Owner and/or Operator of the Vehicle Driven by the Offender"", 'penalty within fifteen (15) days from the date of apprehension shall cause automatic suspension of his drivers license for a period of thirty (30) days from the date of apprehension, in addition to the fines and penalties prescribed hereunder. The LTO shall resolve a contested case within five (5) days from receipt of said written contest. The imposition of the fines and penalties shall be without prejudice to any criminal action that may be instituted under existing laws, rules and regulations. VIOLATIONS IN CONNECTION WITH LICENSING A. DRIVING WITHOUT A VALID DRIVERS LICENSE / CONDUCTORS PERMIT This includes driving within an expired, revoked, suspended, inappropriate drivers license restriction code, inappropriate drivers license classification, fake drivers license, tourist driving a motor vehicle with a valid foreign driving license beyond the 90-day maximum allowable period and a student driver driving without being accompanied by a duly licensed driver. Php 3,000.00 In addition, the unlicensed or improperly licensed driver shall be disqualified from being granted a drivers license and driving', 'Conduct of Field Sobriety, Chemical and Confirmatory Tests.  A law enforcement officer who has probable cause to believe that a person is driving under the influence of alcohol, dangerous drugs and/or other similar substances by apparent indications and manifestations, including overspeeding, weaving, lane straddling, sudden stops, swerving, poor coordination or the evident smell of alcohol in a persons breath or signs of use of dangerous drugs and other similar substances, shall conduct E-Library - Information At Your Fingertips: Printer Friendly https://elibrary.judiciary.gov.ph/thebookshelf/showdocsfriendly/2/57102 2 of 6 10/17/2025, 11:16 PM field sobriety tests. If the driver fails in the sobriety tests, it shall be the duty of the law enforcement officer to implement the mandatory determination of the drivers blood alcohol concentration level through the use of a breath analyzer or similar measuring instrument. If the', '11229 - Child Safety on Motor Vehicles Act 7) Traffic Violations, Fines and Penalties (JAO 2014-01) A. Violations in Connection with Licensing B. Violations in Connection with Motor Vehicle Registration/Renewal /Operation C. Violations in Connection with Dimensions, Specifications, Weight and Load Limits D. Violations in Connection with Franchise IV. DEFENSIVE DRIVING 1) Defensive Driving  Attitude and Behavior 2) Driver Perception and Awareness A. SIPDE - Scanning process - Leaving yourself an out B. Factors Affecting Concentration - Man Made (distracted driving) - Physiological C. Factors Affecting Driving Skills - Fatigue, drugs and alcohol 47 Course Content of Driving School  Light Vehicles D. Speed Management Limits - Limits (maximum and minimum) - Two (2) or Three (3) second rule 3) Safe Positioning and Distances A. Eye Clearance and Distance Test - Looking 10 to 15 seconds ahead - The necessity of mastering horizontal and vertical clearances B. Lane Positioning - Overtaking lanes - Slow and fast lanes -', ""penalty of removal from the service with all the accessory penalties attached thereto; b. A fine in the amount of Twenty thousand pesos (P20,000.00) shall be imposed upon an applicant for a driver's license found to have committed any of the following acts: 1. Willful misrepresentation with respect to material information in one's application; 2. Connivance with the officer in the irregular conduct of examination or issuance of license; 3. Falsification of documents; or 4. Cheating during examinations. Any or all the acts abovementioned shall be punished whether or not a license was granted by reason of such misrepresentation, connivance, and falsification or cheating. In addition to the abovementioned fine, the driver's license of erring applicant, if one is granted by reason of such misrepresentation, connivance, falsification or cheating, shall be revoked, and the applicant shall be"", 'of Trade and Industry (DTI). 37 Republic Act No. 10054 EXEMPTION Drivers of tricycles shall be exempted from complying with the mandatory wearing of motorcycle helmets. FINES and PENALTIES Any person caught not wearing the standard protective motorcycle helmet in violation of this Act shall be punished with a fine of the following: First Offense - One thousand five hundred pesos (Php 1,500.00) Second Offense - Three thousand pesos (Php 3,000.00) Third Offense - Five thousand pesos (Php 5,000.00) Fourth and Succeeding Offenses - Ten thousand pesos (Php 10,000.00) plus confiscation of the drivers license 38 REPUBLIC ACT NO. 10586 ANTI-DRUNK and DRUGGED DRIVING ACT OF 2013 AN ACT PENALIZING PERSONS DRIVING UNDER THE INFLUENCE OF ALCOHOL, DANGEROUS DRUGS, AND SIMILAR SUBSTANCES, AND FOR OTHER PURPOSES DECLARATION OF POLICY Pursuant to the Constitutional principle that recognizes the protection of life and property and the promotion of the general welfare', ""be attached to any load that extends over: one (1.0) meter from the body of the vehicle 7. What are the effects of alcohol in a driver? Poor coordination of body movements and lack of self-judgment 8. In a toll gate, a red X light/sign means: you cannot drive through this lane 9. What does a flashing red light mean? You must stop and then go only when it is safe to do so 10. What hand signal must a driver give when he/she wants to turn right? Left arm bent at elbow, hand pointing up 11. At a normal speed, what is the safety rule when following behind another car? One car length apart 12. A driver of a vehicle approaching a crossing or intersection shall: slow down and stop 169 Nonprofessional  Light (B, B1, B2) QUESTION ANSWER 13. At a normal speed, keeping one's distance lessens the risk of road crash. One good rule is to leave"", 'urine or blood tests to determine the blood alcohol concentration level and/or positive indication of dangerous drugs and similar substances in a persons body. (d) Dangerous drugs and other similar substances refer to drugs listed in the schedules annexed to the 1961 Single Convention on Narcotics Drugs, as amended by the 1972 Protocol, and in the schedules annexed to the 1971 Single Convention of Psychotropic Substances as enumerated in its attachment which is an integral part of Republic Act No. 9165, otherwise known as the Comprehensive Dangerous Drugs Act of 2002? and those that the Board may reclassify, add to or remove from the list of dangerous drugs. E-Library - Information At Your Fingertips: Printer Friendly https://elibrary.judiciary.gov.ph/thebookshelf/showdocsfriendly/2/57102 1 of 6 10/17/2025, 11:16 PM (e) Driving under the influence of alcohol refers to the act of operating a motor', ""documents. v. Without positive confirmation, the driver shall be apprehended for the other traffic offense only and not for violation of this Act. Section 2. Driver's License Custody All driver's licenses confiscated under these rules shall be turned over to L TO for safekeeping and shall be released by L TO only after final disposition or lawful order of the courts. RULE IV - MANDATORY ALCOHOL AND DRUG TESTING Section 1. Mandatory Alcohol and Chemical Testing of Drivers Involved in Motor Vehicular Accidents a. A driver of a motor vehicle involved in a vehicular accident resulting in the loss of human life or physical injuries shall be subjected to on site field sobriety test and ABA testing, -- - - - - - -- - Implementing Rules and Regulations I RA 10586 .: --r 6 whenever practicable, and, thereafter chemical tests, including a drug screening test and, if necessary, a drug confirmatory test as mandated under Republic Act No. 9165, to"", 'odor, smoke or noise. CHAPTER IVTRAFFIC RULES ARTICLE I.Speed Limit and Keeping to the Right SEC. 35. Restriction as to speed. a. Any person driving a motor vehicle on a highway shall drive the same at a careful and prudent speed, not greater nor less than is reasonable and proper, having due E-Library - Information At Your Fingertips: Printer Friendly https://elibrary.judiciary.gov.ph/thebookshelf/showdocsfriendly/2/26188 21 of 31 10/17/2025, 11:21 PM regard for the traffic, the width of the highway, and of any other condition then and there existing; and no person shall drive any motor vehicle upon a highway at such a speed as to endanger the life, limb and property of any person, nor at a speed greater than will permit him to bring the vehicle to a stop within the assured clear distance ahead. b. Subject to', ""11:21 PM delinquent registration, the penalty shall be a fine fifty per cent of the registration fees corresponding to the portion of the year for which the vehicle is registered for use. b. For failure to sign driver's license or to carry same while driving, twenty pesos fine. c. Driving a vehicle with a delinquent or invalid driver's license, fifty pesos fine. d. Driving a motor vehicle with delinquent, suspended or invalid registration, or without registration or without the proper license plate for the current year, three hundred pesos fine. e. Driving a motor vehicle without first securing a driver's license, three hundred pesos fine. f. Driving a motor vehicle while under the influence of liquor or narcotic drug, a fine of not less than two hundred pesos nor more than five hundred pesos, or imprisonment of not more than three months, or both, at the discretion of the Court. g. Violation of Sections""]","According to Republic Act No. 10586, the penalty for driving under the influence of alcohol is as follows:

If the violation did not result in physical injuries or homicide, the penalty is three (3) months imprisonment, and a fine ranging from Twenty thousand pesos (Php 20,000.00) to Eighty thousand pesos (Php 80,000.00).

If the violation resulted in physical injuries, the penalty is the penalty provided in Article 263 of the Revised Penal Code or the penalty provided in the next preceding paragraph, whichever is higher, and a fine ranging from One hundred thousand pesos (Php 100,000.00) to Two hundred thousand pesos (Php 200,000.00).

If the violation resulted in homicide, the penalty is the penalty provided in Article 249 of the Revised Penal Code and a fine ranging from Three hundred thousand pesos (Php 300,000.00) to Five hundred thousand pesos (Php 500,000.00).","If a person is found driving under the influence without causing physical injuries or homicide, the penalty shall be imprisonment for three (3) months and a fine ranging from Twenty Thousand Pesos (Php20,000.00) to Eighty Thousand Pesos (Php80,000.00). If the violation results in physical injuries, a fine ranging from One Hundred Thousand Pesos (Php100,000.00) to Two Hundred Thousand Pesos (Php200,000.00) shall be imposed. In cases where driving under the influence results in homicide, the fine shall range from Three Hundred Thousand Pesos (Php300,000.00) to Five Hundred Thousand Pesos (Php500,000.00). Non-professional license holders will have their license confiscated and suspended for a period of twelve (12) months for the first conviction and perpetually revoked for the second conviction. Professional license holders will have their license confiscated and perpetually revoked for the first conviction.",1.0,0.8587180418601263
What is the rule about overtaking another vehicle on a curved road?,"[""the driver of such other vehicles of the intention to make such movement. Source: Canva Photos 121 Before Starting and Driving on the Road OVERTAKING AND PASSING RESTRICTIONS 1. The driver of a vehicle shall not drive to the left side of the centerline of a highway in overtaking or passing another vehicle proceeding in the same direction, unless such left side is clearly visible, and is free of oncoming traffic for a sufficient distance ahead to permit such overtaking or passing to be made in safety. 2. The driver of a vehicle shall not overtake or pass another vehicle proceeding in the same direction, when approaching the crest of a grade, not upon a curve in the highway, where the driver's view along the highway is obstructed within a distance of five hundred feet ahead, except on a highway having two or more lanes for movement of traffic in one direction where the driver of a vehicle may overtake or pass another vehicle: Provided, that on a highway within a business or residential"", 'where the driver of a vehicle may overtake or pass another vehicle on the right. Nothing in this section shall be construed to prohibit a driver overtaking or passing upon the right another vehicle which is making or about to make a left turn. 4. The driver of a vehicle shall not overtake or pass, or attempt to pass, any other vehicle, proceeding in the same direction, between any points indicated by the placing of official temporary warning or caution signs indicating that men are working on the highway. 5. The driver of a vehicle shall not overtake or pass, or attempt to overtake or pass, any other vehicle proceeding in the same direction in any ""no-passing or overtaking zone For Motorcycle Riders  Never overtake on a curve especially on an uphill or downhill road.  Overtake only at a safe and manageable speed.  Always consider the quality of rear tires when overtaking on a curve. Inferior tires will cause the motorcycle to skid. 123 Before Starting and Driving', ""oncoming traffic - driving to the left side of the center line of a highway in overtaking or passing another vehicle proceeding in the same direction where the left side is not clearly visible and is not free of oncoming traffic for a sufficient distance to pass in safely. 17. Overtaking upon a crest of a grade - overtaking or passing another vehicle proceeding in the same direction when approaching the crest of a grade. 18. Overtaking upon a curve - overtaking or passing another vehicle proceeding in the same direction upon a curve in a highway where the driver's view along the highway is obstructed within a distance of 500 feet ahead. 77 19. Overtaking at any railway grade crossing - overtaking or passing another vehicle proceeding in the same direction at any railway grade crossing. 20. Overtaking at an intersection - overtaking or passing another vehicle in the same direction at any intersection of highways except on a highway having two or more lanes for movement of traffic in one direction where the driver"", 'the movement of traffic in one direction, the driver of a vehicle may overtake and pass another vehicle on the right. Nothing in this section shall be construed to prohibit a driver overtaking and passing, upon the right, another vehicle which is making or about to make a left turn. SEC. 40. Driver to give way to overtaking vehicle.The driver of a vehicle about to be overtaken and passed by another vehicle approaching from the rear shall give way to the overtaking vehicle on suitable and audible signal being given by the driver of the overtaking vehicle, and shall not increase the speed of his vehicle until completely passed by the overtaking vehicle. SEC. 41. Restrictions on overtaking and passing. a. The driver of a vehicle shall not drive to the left side of the center line of a highway in overtaking or passing another vehicle proceeding in the same direction, unless such left side is clearly visible, and is free of oncoming traffic for a sufficient distance ahead to permit', ""center line of a highway in overtaking or passing another vehicle proceeding in the same direction, unless such left side is clearly visible, and is free of oncoming traffic for a sufficient distance ahead to permit such overtaking or passing to be made in safety. b. The driver of a vehicle shall not overtake or pass another vehicle proceeding in the same direction, when approaching the crest of a grade, nor upon a curve in the highway, where the driver's view along the highway is obstructed within a distance of five hundred feet ahead except on a highway having two or more lanes for movement of traffic in one direction where the driver of a vehicle may overtake or pass another vehicle: Provided, That on a highway within a business or residential district, having two or more lanes for movement of traffic in one E-Library - Information At Your Fingertips: Printer Friendly"", 'and said provincial board, municipal board or city council shall provide appropriate signs therefor, subject to the approval of the Commissioner. It shall be the duty of every provincial, city and municipal secretary to certify to the Commissioner the names, locations, and limits of all ""through streets"" designated as such by the provincial board, municipal board or council. ARTICLE II.Overtaking and Passing a Vehicle, and Turning at Intersections SEC. 39. Overtaking a vehicle.The driver of any motor vehicle overtaking another vehicle proceeding in the same direction shall pass at a safe distance to the left thereof, and shall not again drive to the right side of the highway until safely clear of such overtaken vehicle except that on a highway, within a business or residential district, having two or more lanes for the movement of traffic in one direction, the driver of a vehicle may overtake and pass another vehicle on the right. Nothing in this section shall be construed to prohibit a driver overtaking and', 'on a highway having two or more lanes for movement of traffic in one direction where the driver of a vehicle may overtake or pass another vehicle: Provided, that on a highway within a business or residential district, having two or more lanes for movement of traffic in one direction, the driver of a vehicle may overtake or pass another vehicle on the right. Source: Canva Photos 122 Before Starting and Driving on the Road 3. The driver of a vehicle shall not overtake or pass any other vehicle proceeding in the same direction, at any railway grade crossing, not at any intersection of highways unless such intersection or crossing is controlled by traffic signal, or unless permitted to do so by a watchman or a peace officer, except on a highway having two or more lanes for movement of traffic in one direction where the driver of a vehicle may overtake or pass another vehicle on the right. Nothing in this section shall be construed to prohibit a driver overtaking or passing upon the right another vehicle which', 'going to the same direction except when there are two or more lanes for the movement of traffic in one direction. 12. Overtaking at unsafe distance - failure to pass at a safe distance to the left of another motor vehicle when overtaking that vehicle. 13. Cutting an overtaken vehicle - driving to the right side of the highway after overtaking before his motor vehicle is safely clear of such overtaken vehicle. 14. Failure to give way to an overtaking vehicle - failure to give way to another vehicle approaching from the rear that wishes to overtake his vehicle when the former has given suitable and audible signal. 15. Increasing speed when being overtaken - increasing the speed of the motor vehicle before the overtaking vehicle has completely passed. 16. Overtaking when left side is not visible or clear of oncoming traffic - driving to the left side of the center line of a highway in overtaking or passing another vehicle proceeding in the same direction where the left side is not clearly visible and is not free', 'Overtaking at an intersection - overtaking or passing another vehicle in the same direction at any intersection of highways except on a highway having two or more lanes for movement of traffic in one direction where the driver of a vehicle may overtake another vehicle on the right. 21. Overtaking on ""men working"" or ""caution"" signs - overtaking or passing or attempting to overtake or pass another vehicle proceeding in the same direction between warning or caution signs indicating that men are working on a highway. 22. Overtaking at no overtaking zone - overtaking or passing or attempting to overtake or pass another vehicle proceeding in the same direction in any ""no passing or overtaking zone. 23. Failure to yield the right of way - failure of a vehicle on the left to yield the right of way to the vehicle on the right when these vehicles approach or enter an intersection at approximately the same time. 24. Failure to yield the right of way - failure of the vehicle approaching but not having entered an', 'is allowed but no overtaking a. DOUBLE SOLID YELLOW LINES No overtaking and no crossing c. SINGLE YELLOW LINE WITH BROKEN WHITE LINE No overtaking but crossing is allowed on the side of the solid yellow line Overtaking and crossing is allowed on the side of the broken white line Source: Canva Photos Source: Canva Photos Source: Canva Photos 90 Pavement Markings 4. EDGE LINE  used to separate the outside edge of the road from the shoulder d. BROKEN YELLOW LINE Crossing and overtaking is allowed with necessary precaution e. BROKEN AND SOLID YELLOW LINE Crossing and overtaking is allowed on the side of the broken line with caution but overtaking is not allowed on the side of the solid line Source: Canva Photos Source: Canva Photos Source: Canva Photos 91 Pavement Markings 5. CONTINUITY LINE  continuity line on the left side means the lane is ending or exiting and that the driver must change lanes if the driver wants to continue in the current direction. Continuity lines on the right means', 'for traffic nearest to be right hand side of the highway and, in turning, to keep as close as possible to the right hand curve or edge of highway * Overtaking when left side is not visible or clear of incoming traffic * Failure to yield right of way to ambulance, police or fire department vehicles1/ * Overtaking upon a curve * Failure to yield right of way at a ""through highway"" or a ""Stop intersection"" * Overtaking at an intersection * Failure to stop motor and notch handbrake or motor vehicle when unattended * Unsafe towing * Overtaking at no overtaking zone * Overcharging/undercharging of fare * Failure to yield right of way to the vehicle on the right when these vehicles approach or enter an intersection at approximately the same time * Failure to attach or improper attachment/tampering of authorized motor vehicle license plates and/or third plate sticker *No Franchise / Certificate of Public Convenience carried inside MV *Loading extending beyond projected width', 'or freight of trucks requiring the same. 5. Permitting passenger to ride on running board, step board or mudguard of MV while the same in motion. 6. Failure to dim headlights when approaching another motor vehicle. 7. Driving in a place not intended for traffic or into place not allowed for parking. 76 8. Hitching or permitting a person or a bicycle, motorcycle, tricycle or skate roller to hitch to a motor vehicle. 9. Driving against traffic - failure to pass to the right when meeting persons or vehicles coming towards him. 10. Illegal turn - failure to conduct the motor vehicle to the right of the intersection of the highway when turning to the left in going from one highway to another. 11. Illegal overtaking - failure to pass to the left when overtaking person or vehicles going to the same direction except when there are two or more lanes for the movement of traffic in one direction. 12. Overtaking at unsafe distance - failure to pass at a safe distance to the left', 'or pass another vehicle: Provided, That on a highway within a business or residential district, having two or more lanes for movement of traffic in one E-Library - Information At Your Fingertips: Printer Friendly https://elibrary.judiciary.gov.ph/thebookshelf/showdocsfriendly/2/26188 23 of 31 10/17/2025, 11:21 PM direction, the driver of a vehicle may overtake or pass another vehicle on the right. c. The driver of a vehicle shall not overtake or pass any other vehicle proceeding in the same direction, at any railway grade crossing, nor at any intersection of highways unless such intersection or crossing is controlled by traffic signal, or unless permitted to do so by a watchman or a peace officer, except on a highway having two or more lanes for movement of traffic in one direction where the driver of a vehicle may overtake or pass another vehicle on the right. Nothing in this section', 'Be extra cautious when approaching and passing such vehicles. Do not overtake the vehicle unless there is enough time and distance to safely complete the maneuver. Leave extra space if going uphill and stopping behind a large vehicle. There is a tendency that it may roll back when the driver releases the brake or clutch. LARGE VEHICLES Never overtake a large hauling truck that is turning left or right. Said vehicle may block all or some of the lanes. Long vehicles may straddle lanes while turning. Source: Canva Photos 141 Attitude and Behavior EMERGENCY VEHICLES Give the priority right-of-way to emergency vehicles Upon the approach of any police or fire department vehicle, or of an ambulance giving audible signal, the driver of every other vehicle shall immediately drive the same to a position as near as possible and parallel to the right-hand edge or curb of the highway, clear of any intersection of highway, and shall stop and remain in such position, unless otherwise directed by a peace officer, until such vehicle shall have', 'lanes 9. Turning and lane changing 10. Interaction with various road users (riders, cyclists, pedestrians, and other vehicles) - Passing stationary vehicles and pedestrians - Meeting oncoming traffic - Riding ahead of or behind other motorists - Riding side by side 11. Overtaking 12. ABCs of passing junctions - riding in different kinds of junctions (straight through, turning left or right), with or without obligation to give the right-of-way 13. Riding in dark unlighted road, wet and slippery road, sandy and loose road, steep slope, and sharp curvatures 14. Approaching, riding in, and leaving roundabouts 15. Stopping and parking 16. Riding with back ride 17. Emergency situations (tire blowout, fire, rolling over, engine overheating) 42 Course Content of Driving School  Light Vehicles COURSE CONTENT OF DRIVING SCHOOL MODULE FOR LIGHT VEHICLES PART I: THEORETICAL DRIVING COURSE I. INTRODUCTION TO DRIVING 1) Organization and mandate of LTO, LTFRB,', 'the driver of any vehicle being operated on a ""through highway"" from the duty of driving with due regard for the safety of vehicles entering such ""through highway"" nor as protecting the said driver from the consequence of an arbitrary exercise off such right-of-way. Source: Canva Photos Source: Canva Photos Source: Canva Photos 116 Before Starting and Driving on the Road DRIVING ON THE RIGHT SIDE OF THE HIGHWAY Unless a different course of action is required in the interest of the safety and the security of life, person, or property, or because of unreasonable difficulty of operation in compliance herewith, every person operating a motor vehicle or an animal-drawn vehicle on a highway shall pass to the right when meeting persons or vehicles coming toward him/her, and to the left when overtaking persons or vehicles going the same direction, and when turning to the left in going from one highway to another, every vehicle shall be conducted to the right of the center of the intersection of the highway. CLASSIFICATION', 'nearest to be right hand side of the highway and, in turning, to keep as close as possible to the right hand curve or edge of highway * Reckless driving for 3rd and succeeding offenses * Submission of fake documents in relation to the application for a driver\'s license (New/Renewal) * Failure to yield the right to way to a pedestrian crossing such highway within a crosswalk except at intersection where the movement of traffic is regulated by a peace officer or by traffic signal1/ * Disregarding Traffic Signs - include other traffic violations not mentioned in the other categories but fall under this violation * Failure to stop before traversing a ""through highway"" or railroad crossing * Illegal turn - Failure of the driver of a motor vehicle intending to run to the right at an intersection to approach such intersection in the lane for traffic nearest to be right hand side of the highway and, in turning, to keep as close as possible to the right hand curve or edge of highway * Overtaking when left side is not visible', 'lane PAVEMENT ARROWS  used for lane control and in white color SPEED LIMIT AT 60KPH  a speed limit on pavement to supplement the speed limit posted on the roadside Source: Google images Source: Google images 99  Checking Motor Vehicle and Documents A. BLOWBAGETS B. Essential Parts of Air supply System for Heavy and Articulated Vehicles C. Documents  Before Starting and Driving on the Road A. Before Starting the Engine B. Starting to Drive - Steering - Backing Up / Reversing - Helpful Backing Tips to Avoid Road Crash  Driving on the Road A. Traffic Lights and Signals B. Braking C. Following Distance D. Speed Restrictions E. Exception to Speed Restrictions F. Right-of-Way Rules G. Exception to the Right-of-Way Rules H. Driving on the Right Side of the Highway I. Classification of Roads J. Turning at Intersections K. Making a U-turn L. Roundabout Rules M. Starting, Stopping or Turning Using Hand Signals N. Overtaking and Passing Restrictions O. Proper Parking', 'driver of the vehicle turning left has given a plainly visible signal of intention to turn as required in this Act. n The driver of any vehicle upon a highway within a business or residential district shall yield the right-of-way to a pedestrian crossing such highway within a crosswalk, except at intersections where the movement of traffic is being regulated by a peace officer or by traffic signal. Every pedestrian crossing a highway within a business or residential district, at any point other than a crosswalk shall yield the right-of- way to vehicles upon the highway. 115 Before Starting and Driving on the Road The driver of a vehicle upon a highway shall bring to a full stop such vehicle before traversing any ""through highway"" or railroad crossing: Provided, that when it is apparent that no hazard exists, the vehicle may be slowed down to five miles per hour instead of bringing it to a full stop. F The driver of a vehicle entering a highway from a private road or drive shall yield the', 'Before Starting and Driving on the Road RIGHT-OF-WAY RULES Republic Act No. 4136 enumerates and expressly defines the Right- of-Way as: When two vehicles approach or enter an intersection at approximately the same time, the driver of the vehicle on the left shall yield the right of way to the vehicle on the right, except as otherwise hereinafter provided. The driver of any vehicle travelling at an unlawful speed shall forfeit any right of way which he/she might otherwise have hereunder. The driver of a vehicle (Vehicle B) approaching but not having entered an intersection, shall yield the right- of-way to a vehicle within such intersection or turning therein to the left across the line of travel of such first-mentioned vehicle, provided the driver of the vehicle turning left has given a plainly visible signal of intention to turn as required in this Act. n The driver of any vehicle upon a highway within a business or residential district shall yield the', 'exists, the vehicle may be slowed down to five miles per hour instead of bringing it to a full stop. F The driver of a vehicle entering a highway from a private road or drive shall yield the right-of-way to all vehicles approaching on such highway. EXCEPTION TO THE RIGHT-OF-WAY RULE The driver of a vehicle upon a highway shall yield the right-of-way to police or fire department vehicles and ambulances when such vehicles are operated on official business and the drivers thereof sound audible signal of their approach. The driver of a vehicle entering a ""through highway"" or a ""stop intersection"" shall yield the right-of- way to all vehicles approaching to either direction on such ""through highway"": Provided, that nothing in this subsection shall be construed as relieving the driver of any vehicle being operated on a ""through highway"" from the duty of driving with due regard for the safety of vehicles entering such ""through highway"" nor as protecting the said driver', 'vehicle from one point to another 2) DRIVING ON THE ROAD A. Starting off, driving ahead, and stopping B. Driving in different environments and situations C. Choice of speed in different situations D. Driving uphill and downhill E. Driving through bends F. Approaching and crossing railway G. Lane shifting and choices of lanes H. Making a U-Turn I. Meeting oncoming traffic J. Overtaking and passing K. Driving in different kinds of junction with or without signals and with or without restricted view L. Stopping M. Dealing with pedestrians, motorcyclists, cyclists, trucks, buses, jeepneys and other motor vehicles N. Rush hour and heavy traffic techniques O. Merging with traffic and driving off from a heavy traffic 3) PARKING ON LEVEL GROUND, DOWNHILL AND UPHILL (WITH CURB AND WITHOUT CURB) 59 Road Traffic Signs ROAD TRAFFIC SIGNS OUTLINE: A. REGULATORY SIGNS 1. Priority 2. Directional 3. Prohibitive / Restrictive 4. Speed 5. Parking and Stopping', 'MODEL TEST TRACK/ROUTE A. Name parts of the model test track/route B. Explain the direction arrows C. State the importance of road markings D. Safe moving of vehicle from one point to another 2) DRIVING ON THE ROAD A. Starting off, driving ahead, and stopping B. Driving in different environments and situations C. Choice of speed in different situations D. Driving uphill and downhill E. Driving through bends F. Approaching and crossing railway G. Lane shifting and choice of lanes H. Making a U-Turn I. Meeting oncoming traffic J. Overtaking and passing K. Driving in different kinds of junction with or without signals and with or without restricted view L. Stopping M. Dealing with pedestrians, motorcyclists, cyclists, trucks, buses, jeepneys and other motor vehicles N. Rush hour and heavy traffic techniques O. Merging with traffic and driving off from a heavy traffic 3) PARKING ON LEVEL GROUND, DOWNHILL AND UPHILL (WITH CURB AND WITHOUT', 'peace officer, except on a highway having two or more lanes for movement of traffic in one direction where the driver of a vehicle may overtake or pass another vehicle on the right. Nothing in this section shall be construed to prohibit a driver overtaking or passing upon the right another vehicle which is making or about to make a left turn. d. The driver of a vehicle shall not overtake or pass, or attempt to pass, any other vehicle, proceeding in the same direction, between any points indicated by the placing of official temporary warning or caution signs indicating that men are working on the highway. e. The driver of a vehicle shall not overtake or pass, or attempt to overtake or pass, any other vehicle proceeding in the same direction in any ""no-passing or overtaking zone."" ARTICLE III.Right of Way and Signals SEC. 42. Right of way. a. When two vehicles approach or enter an intersection at approximately the same time, the driver of the vehicle', 'Traffic Rules SEC. 48. Reckless driving.No person shall operate a motor vehicle on any highway recklessly or without reasonable caution considering the width, traffic, grades, crossing, curvatures, visibility and other conditions of the highway and the conditions of the atmosphere and weather, or so as to endanger the property or the safety or rights of any person or so as to cause excessive or unreasonable damage to the highway. SEC. 49. Right of way for police and other emergency vehicles.Upon the approach of any police or fire department vehicle, or of an ambulance giving audible signal, the driver of every other vehicle shall immediately drive the same to a position as near as possible and parallel to the right-hand edge or curb of the highway, clear of any intersection of highways, and shall stop and remain in such position, unless otherwise directed by a peace officer, until such vehicle shall have passed. SEC. 50. Tampering with vehicles.No unauthorized person shall sound the horn, handle the', 'can wait until the rear-end of the vehicle in front passes any distinct and fixed or stationary object on the roadway  e.g., a road sign, mailbox, lamp post. When the car in front of you passes the object, you may begin to count (up to three seconds) until you reach the same object. The allotted time is a safety buffer to allow the following driver time to respond and may be adjusted based on the vehicle size, load, speed, drivers reflexes, etc. 112 Before Starting and Driving on the Road SPEED RESTRICTIONS Prescribed Rate of Speed as per Section 35 (B) of R.A. No. 4136 Note: Speed Limit posted on the road shall prevail National Roads Prescribed Rate of as per Joint Memorandum Circular 2018-001 dated 17 January 2018 of DOTr, DPWH and DILG Recommended design speed under DPWH design, guidelines, standards and criteria, volume IV (2015 ED) NATIONAL ROADS PRIMARY Flat Topography 80 kph', 'While driving downhill, you can preserve your brake by using the: engine brake 28. What are the usual causes of flat tires? Improper tire inflation, overloading and excessive use of tires (tread wear) 29. Where do you usually see a directional traffic sign? Before the junction 181 Professional  Light (B, B1, B2) QUESTION ANSWER 30. In what instances will speed restrictions NOT apply? When drivers of ambulance, fire trucks, police cars, physicians, armed forces, and traffic enforcers are responding to emergency, and when any driver is bringing wounded or sick person for emergency treatment to hospitals Pursuant to R.A. No. 4136 31. Aside from the monetary fine, what is the additional penalty of a driver apprehended for NOT wearing a seatbelt for the third offense? Suspension of drivers license for one (1) week Pursuant to Joint Administrative Order No. 2014-01 32. The maximum speed limit for light vehicles in expressways is: 100 kph 33.', '24 of 31 10/17/2025, 11:21 PM SEC. 43. Exception to the right of way rule. a. The driver of a vehicle entering a highway from a private road or drive shall yield the right of way to all vehicles-approaching on such highway. b. The driver of a vehicle upon a highway shall yield the right of way to police or fire department vehicles and ambulances when such vehicles are operated on official business and the drivers thereof sound audible signal of their approach. c. The driver of a vehicle entering a ""through high way"" or a ""stop intersection"" shall yield the right of way to all vehicles approaching in either direction on such ""through highway"": Provided, That nothing in this sub section shall be construed as relieving the driver of any vehicle being operated on a ""through highway"" from the duty of driving with due regard for the safety of vehicles entering such ""through highway"" nor as protecting the said driver from the consequence of', ""of R.A. 8794) * Hitching or permitting a person or a bicycle, motorcycle, tricycle or skate roller to hitch to a motor vehicle increasing speed when being overtaken * Failure to yield right of way - failure of a vehicle entering a highway from private road or driver upon a highway to yield the right of way to all vehicles approaching in such highway * Driving an unregistered MV * Illegal turn - failure to pass to conduct the motor vehicle to the right of the intersection of the highway when turning to the left in going from one highway to another *Failure to give proper sign * Driving without valid driver's license * Illegal turn - Failure of the driver of a motor vehicle intending to run to the right at an intersection to approach such intersection in the lane for traffic nearest to be right hand side of the highway and, in turning, to keep as close as possible to the right hand curve or edge of highway * Reckless driving for 3rd and succeeding offenses * Submission of"", 'Overtake only at a safe and manageable speed.  Always consider the quality of rear tires when overtaking on a curve. Inferior tires will cause the motorcycle to skid. 123 Before Starting and Driving on the Road PROPER PARKING DOWNHILL AND UPHILL PARKING With a curb - When parking downhill or uphill, turn the front wheels into the curb or toward the sidewalk. When parking on a sloped driveway, turn the wheels so that the vehicle will not roll into the street if the parking brake fails. Always engage the parking brakes. If possible, leave the vehicle in gear position. Without a curb  The main purpose of parking is to avoid road crashes. Park your vehicle in such a way that whenever the parking brake is inadvertently released, the vehicle will roll out off the road and not into the road. ANGLE PARKING Where angle parking is required, vehicles shall be parked at an angle of about forty- five degrees (45) to the curb and with one of the front wheels touching or within one foot of', '""through highway"" or a ""stop intersection"" to yield right of way to all vehicles approaching in either direction on such ""through highway"". 30. Failure to give proper signal - failure to give the appropriate signal before starting, stopping or turning from a direct line. 31. Illegal turn - failure of the driver of a motor vehicle intending to run to the right at an intersection to approach such intersection in the lane for traffic nearest to be right-hand side of the highway and, in turning, to keep as close as possible to right-hand curve or edge of the highway. 32. Illegal turn - failure of the driver of a vehicle intending to turn to the left, to approach such intersection in the lane for traffic to the right of and nearest to the center line of the highway, and in, turning to pass to the left of the center of the intersection except upon highway laned for traffic and upon one-way highway. 33. Failure to stop motor and notch handbrake of', 'c. The driver of any vehicle upon a highway within a business or residential district shall yield the right of way to a pedestrian crossing such highway within a cross walk, except at intersections where the movement of traffic is being regulated by a peace officer or by traffic signal. Every pedestrian crossing a highway within a business or residential district, at any point other than a crosswalk shall yield the right of way to vehicles upon the highway. d. The driver of a vehicle upon a highway shall bring to a full stop such vehicle before traversing any ""through highway"" or railroad crossing: Provided, That when it is apparent that no hazard exists, the vehicle may be slowed down to five miles per hour instead of bringing it to a full stop. E-Library - Information At Your Fingertips: Printer Friendly https://elibrary.judiciary.gov.ph/thebookshelf/showdocsfriendly/2/26188 24 of 31 10/17/2025,', 'without delay. No person shall make repairs on the travel way; ---.--.-:-.-.-----."".------ ... . ""~.. -2- (f) Drive a vehicle at a speed more than the prescribed maximum of 100kph or less than 60kph, except when necessary to make a turn or avoid conflict with other traffic or in compliance with law or directions of a police officer or traffic control device, or when accelerating or decelerating lanes. Slow moving vehicles shall always keep the right lane and shall use the left lane only when passing. The maximum and minimum speed limits herein prescribed or to be prescribed may, however be changed by the Secretary of Public Works and Communications upon recommendation of the Commissioner of Public Highways if after a thorough traffic and engineering study such a change is necessary; (g) Jaywalk, loiter, litter, or travel by foot, drive or', '- Information At Your Fingertips: Printer Friendly https://elibrary.judiciary.gov.ph/thebookshelf/showdocsfriendly/2/26188 22 of 31 10/17/2025, 11:21 PM operating a motor vehicle or an animal-drawn vehicle on a highway shall pass to the right when meeting persons or vehicles coming toward him, and to the left when overtaking persons or vehicles going the same direction, and when turning to the left in going from one highway to another, every vehicle shall be conducted to the right of the center of the intersection of the highway. SEC. 38. Classification of highways.Public highways shall be properly classified for traffic purposes by the provincial board, municipal board or city council having jurisdiction over them, and said provincial board, municipal board or city council shall provide appropriate signs therefor, subject to the approval of the Commissioner. It shall be the duty of every provincial, city and municipal secretary to', 'to endanger the life, limb and property of any person, nor at a speed greater than will permit him to bring the vehicle to a stop within the assured clear distance ahead. b. Subject to the provisions of the preceding paragraph, the rate of speed of any motor vehicle shall not exceed the following: MAXIMUM ALLOWABLE SPEEDS 1. On open country roads, with no ""blind corners"" not closely bordered by habitations. 80 km. per hour 50 km. per hour 2. On ""through streets"" or boulevards, clear of traffic, with no ""blind corners,"" when so designated. 40 km. per hour 30 km. per hour 3. On city and municipal streets, with light traffic, when not designated ""through streets."" 30 km. per hour 30 km. per hour 4. Through crowded streets, approaching intersections at ""blind corners,"" passing school zones, passing other vehicles which are stationary, or for similar dangerous circumstances. 20 km. per hour 20 km.', 'to the vehicle on the right when these vehicles approach or enter an intersection at approximately the same time. 24. Failure to yield the right of way - failure of the vehicle approaching but not having entered an intersection to yield the right of way to a vehicle within such intersection or turning therein to the left across the line of travel of the first mentioned vehicle when such vehicle has given a plainly visible signal of intention to turn. 25. Failure to yield the right of way - failure of the driver of any vehicle upon a highway within a business or residential district to yield the right of way to a pedestrian crossing such highway within a crosswalk except at intersection where the movement of traffic is regulated by a peace officer or by traffic signal. 26. Failure to stop before traversing a ""through highway"" or railroad crossing - failure of the driver of a vehicle upon a highway to bring to a full stop such vehicle before traversing any ""through highway"" or railroad crossing. 78 27. Failure to yield right way', '8750, the Seat Belt Law Be aware of pedestrian crossing 67 Road Traffic Signs B. Warning Signs Signs used to warn motorists of potentially hazardous conditions on or adjacent to the road. It advises motorists of road conditions that require caution and may call for a reduction in speed, in the interest of safety and that of other road users 1. Horizontal Signs These signs are used to indicate the type of road curve ahead of the motorist SHARP TURN DOUBLE SHARP TURN CURVE DOUBLE CURVE WINDING ROAD HAIRPIN BEND 68 Road Traffic Signs 2. Intersection Signs Signs installed before intersection or junctions Intersection ahead T-Junction ahead Y-Junction ahead Roundabout ahead (Rotunda) Side road junction ahead Approach to Intersection Approach to intersection side road Approach to intersection merging traffic 69 Road Traffic Signs 3. Advance Warning / Traffic Control Device Signs Used to indicate signalized intersection and to warn the presence of STOP and GIVE WAY signs 4. Road Width Signs Traffic Lights Ahead  driver must not park or stop within six (6) meters of this sign', 'of a barangay with an ideal width of more than 4.50 meters. 5. Farm-to-Market Road - access road from farm to transport of products to the market outlet with an ideal width of more than 4.50 meters. Source: Canva Photos 117 Before Starting and Driving on the Road TURNING AT INTERSECTIONS MAKING THE RIGHT TURN 1. Proceed to the right lane well in advance. 2. Reduce to a safe speed and signal your intention to turn. 3. Check the traffic approaching from the left and pedestrian or any other obstruction. 4. At the turn position, keep your rear right wheel nearest to the curb or edge of the highway. MAKING THE LEFT TURN 1. Vehicle B - Drive your vehicle to the lane, advance to the intersection where you intend to make a turn. 2. Vehicles A and B - Reduce to a safe speed and signal your intention to turn. 3. Vehicle B - If stopped, keep your wheels pointed straight ahead and wait to cross the intersection.', 'b. The signal herein required shall be given by means of extending the hand and arm beyond the left side of the vehicle, or by an approved mechanical or electrical signal device. ARTICLE IV.Turning and Parking SEC. 45. Turning at intersections. a. The driver of a vehicle intending to run to the right at an intersection shall approach such intersection in the lane for traffic nearest to the right-hand side of the highway and, in turning, shall keep as close as possible to the right-hand curb or edge of the highway. b. The driver of a vehicle intending to turn to the left shall approach such intersection in the lane for traffic to the right of and nearest to the center line of the highway, and, in turning, shall pass to the left of the center of the intersection, except that, upon highways laned for traffic and upon one-way highways, a left turn shall be made from the left lane of traffic in the direction in which the vehicle E-Library -', 'Certificate of Registration, and current Official Receipt (OR/CR) 7. On the assumption that your motorcycle is in good running condition, what can cause you to skid and lose control when making an abrupt movement especially on a wet and slippery road? Improper braking 8. Are you allowed to use the shoulder of the road to pass on the right side of a car ahead? NO, it is against the law Pursuant to R.A. No. 4136 163 Nonprofessional  Motorcycle (A, A1) QUESTION ANSWER 9. What is the meaning of an inverted triangle sign? Give way 10. What do double yellow solid lines mean? No crossing or overtaking 11. What should you do when you are crossing a railroad and there are NO warning devices? Slow down, check both sides of the road then proceed with caution if clear (stop, look and listen) 12. When do you have to make a complete/full stop? At a red traffic light 13. To protect motorcycle']","According to Document FDM-Vol.-1-2nd-Edition.pdf, the driver of a vehicle shall not overtake or pass another vehicle proceeding in the same direction upon a curve in a highway where the driver's view along the highway is obstructed within a distance of 500 feet ahead.

Additionally, Document FDM-vol.-2-2nd-Edition.pdf states that motorcycle riders should never overtake on a curve, especially on an uphill or downhill road.

Document REPUBLIC ACT NO. 4136.pdf also states that the driver of a vehicle shall not overtake or pass another vehicle proceeding in the same direction, when approaching the crest of a grade, nor upon a curve in the highway, where the driver's view along the highway is obstructed within a distance of five hundred feet ahead, except on a highway having two or more lanes for movement of traffic in one direction where the driver of a vehicle may overtake or pass another vehicle.","Drivers must not overtake on curves, hills, or areas with poor visibility. Doing so endangers other motorists and may result in fines or suspension of the driver’s license.",1.0,0.8940616545529754
What happens if I refuse to pay a traffic citation on time?,"['to be released by a regular court of competent jurisdiction after payment of appropriate fines and penalties. Php 10,000.00 In addition, the drivers license shall be confiscated, and revoked upon conviction for the crime. The driver shall be disqualified from being granted a drivers license for a period of 5 years counted from the date of payment of appropriate fines and penalties The motor vehicle driven by the violator shall likewise be impounded until ordered to be released by a regular court of competent jurisdiction after payment of appropriate fines and penalties. 74 D. Refer to R.A. No. 10586 E. RECKLESS DRIVING No person shall operate a motor vehicle on any highway recklessly or without reasonable caution considering the width, traffic, grades, crossing, curvatures, visibility and other conditions of the highway and the conditions of the atmosphere and weather, or so to endanger the property of the safety or rights of any person or so as to cause excessive or unreasonable damage to the highway. This includes driving with an improperly', 'or incapacity to work for more than ninety (90) days, the license of the offending driver shall be revoked for a period of four (4) years, after a finding by the court that such driver was negligent or at fault. Notwithstanding the non-filing of an action in court or the amicable settlement of the dispute, the Assistant Secretary may still exercise his authority to suspend or revoke the license of the driver who has caused such death or serious physical injury after his determination that the driver is an improper person to operate motor vehicles. Section 21. Review of Penalties. - The Secretary of the DOTr, upon the recommendation of the LTO, after due hearing and publication, shall have the power to increase or adjust the fine herein imposed once every five (5) years. Provided, That in no case shall be increase be more than five percent (5%) of the fine sought to be increased. RULE V - RESPONSIBILITIES OF IMPLEMENTING AGENCIES Section 22. Repository', ""driver may be held answerable while operating motor vehicles. SEC. 29. Confiscation of driver's licenses.Law enforce-met and peace officers duly designated by the Commissioner shall, in apprehending any driver for violations of this Act or of any regulations issued pursuant thereto, or of local traffic rules and regulations, confiscate the license of the driver concerned and issue a receipt prescribed and issued by the Commission therefor which shall authorize the driver to operate a motor vehicle for a period not exceeding seventy-two hours from the time and date of issue of said receipt. The period so fixed in the receipt shall not be extended, and shall become invalid thereafter. Failure of the driver to settle his case within fifteen days from the date of apprehension will cause suspension and revocation of his license. E-Library - Information At Your Fingertips: Printer Friendly"", 'penalty within fifteen (15) days from the date of apprehension shall cause automatic suspension of his drivers license for a period of thirty (30) days from the date of apprehension, in addition to the fines and penalties prescribed hereunder. The LTO shall resolve a contested case within five (5) days from receipt of said written contest. The imposition of the fines and penalties shall be without prejudice to any criminal action that may be instituted under existing laws, rules and regulations. VIOLATIONS IN CONNECTION WITH LICENSING A. DRIVING WITHOUT A VALID DRIVERS LICENSE / CONDUCTORS PERMIT This includes driving within an expired, revoked, suspended, inappropriate drivers license restriction code, inappropriate drivers license classification, fake drivers license, tourist driving a motor vehicle with a valid foreign driving license beyond the 90-day maximum allowable period and a student driver driving without being accompanied by a duly licensed driver. Php 3,000.00 In addition, the unlicensed or improperly licensed driver shall be disqualified from being granted a drivers license and driving', ""payment of fine and revocation of drivers license on the succeeding offense. A revoked non-professional driver shall be disqualified from being granted a drivers license for a period of two (2) years counted from date of revocation. A revoked professional driver shall be perpetually disqualified from getting any drivers license. Php 3,000.00 In addition, the drivers license shall be put on alarm, revoked and the driver shall be disqualified from being granted a drivers license and driving a motor vehicle for a period of one (1) year from the payment of the fine without prejudice to the filing of appropriate criminal charges. 75 G. Refer to R.A. No. 8750 H. Refer to R.A No. 10054 I. FAILURE TO CARRY DRIVER'S LICENSE, CERTIFICATE OF REGISTRATION OR OFFICIAL RECEIPT WHILE DRIVING A MOTOR VEHICLE J. ALL OTHER VIOLATIONS OF TRAFFIC RULES AND REGULATIONS Seat Belts Use Act of 1999 Motorcycle Helmet Act of 2009 Php 1,000.00 Php 1,000.00 This"", 'the atmosphere and weather, or so to endanger the property of the safety or rights of any person or so as to cause excessive or unreasonable damage to the highway. This includes driving with an improperly registered motor vehicle or a motor vehicle with expired, revoked, suspended, or invalid registration, unregistered of fake substitute or replacement engine, engine block or chassis. F. SUBMISSION OF FAKE DOCUMENTS IN RELATION TO THE APPLICATION FOR A DRIVERS LICENSE (NEW/RENEWAL) Anti-Drunk and Drugged Driving Act of 2013 First offense Php 2,000.00 Second offense Php 3,000.00 Subsequent offense Php10,000.00 In addition, the drivers license shall be suspended for a period of three (3) months for the second offense and six (6) months for the third offense from payment of fine and revocation of drivers license on the succeeding offense. A revoked non-professional driver shall be disqualified from being granted a drivers license for a period of two (2) years counted from', 'reverse or modify the action taken by such deputy. b. Whenever during any twelve-month period a driver shall have been convicted at least three times for the violations of any provisions of this Act or of any regulation issued by the Commissioner or any municipal or city ordinance relating to motor vehicle traffic not in, conflict with any of the provisions of this Act, the Com-missioner may, in his discretion, revoke or suspend the license of such driver for a period not exceeding two years. c. The license suspended or revoked under the provisions of subsections (a) and (b) of this section shall not be reinstated unless the driver has furnished a bond in accordance with Section twenty-nine of this Act and only after the Commissioner has satisfied himself that such driver may again safely be permitted to operate a motor vehicle. d. A decision of the Commissioner revoking or refusing the reinstatement of a license under the provisions of this Section may be appealed to the Secretary of Public Works and', '2 of 4 10/17/2025, 11:17 PM rules and regulations of this Act within sixty (60) days upon the effectivity of this Act. SEC. 9. Fines/Penalties.  (a) The driver who operates a motor vehicle covered by this Act or the owner or operator who allows such driver to operate without the speed limiter herein required shall suffer a fine in the amount of fifty thousand pesos (P50.000.00). (b) The same fine shall be imposed upon the driver, owner or operator who operates or allows a person to operate a motor vehicle with a nonfunctioning or tampered speed limiter. In addition to the above fines, a suspension of the drivers license for a period of one (1) month or franchise of a motor vehicle for a period of three (3) months, as the case may be, shall be imposed upon the offender who commits the abovementioned violations for the first time. For', ""prejudice to the penalties provided under the Revised Penal Code and other applicable laws, the penalties corresponding to the following acts shall be imposed by the appropriate agency or officer: a. Any officer who, in any manner, issues a driver's license without the necessary examination, connives with the applicant for the irregular issuance of a license, or who, by gross negligence, issues a driver's license, or who, by gross negligence, issues a E-Library - Information At Your Fingertips: Printer Friendly https://elibrary.judiciary.gov.ph/thebookshelf/showdocsfriendly/2/96764 5 of 14 10/17/2025, 10:17 PM driver's license to an unqualified applicant shall suffer a penalty of removal from the service with all the accessory penalties attached thereto; b. A fine in the amount of Twenty thousand pesos (P20,000.00) shall be imposed upon an"", 'date of issuance of the order of suspension. Provided, that period of suspension will subsist if the fine has not been paid within one (1) year from the order of suspension. Vehicles operating without a speed limiter or a malfunctioning or tampered speed limiter shall be impounded immediately and shall only release upon payment of the appropriate fines. ENFORCEMENT AND ADJUDICATION Inspection of Covered Vehicles Law - LTO and LTFRB Law Enforcement Officer (LEO) and its duly deputized agents shall have the authority to inspect apprehended vehicles for violating traffic rules and regulations and any other law, for non-compliance with this Act. The LTFRB shall have the authority to inspect and apprehend covered PUVs committing violations or failing to comply with the provisions of this Act. Non-installation and tampering of the speed limiter shall be liable to the penalty provisions thereof. Enforcement Procedure - The driver, upon lawful demand by the LTO', ""for every day of violation against the owner or operator of a stationary source until such time that the standards have been complied with. For purposes of the application of the fines, the PAB shall prepare a fine rating system to adjust the maximum fine based on the violator's ability to pay, degree of willfulness, degree of negligence, history of noncompliance and degree of recalcitrance: Provided, That in case of negligence, the first time offender's ability to pay may likewise be considered by the Pollution Adjudication Board: Provided, further, That in the absence of any extenuating or aggravating circumstances, the amount of fine for negligence shall be equivalent to one-half of the fine for willful violation. The fines herein prescribed shall be increased by at least ten percent (10%) every three (3) years to compensate for inflation and to maintain the deterrent function of such fines. In addition to the fines, the PAB shall order"", 'use thereof, insanity, imbecility, impotence or blindness, or incapacity to work for more than ninety (90) days, the license of the offending driver shall be revoked for a period of four (4) years, after a finding by the court that such driver was negligent or at fault. ""The Department of Transportation (DOTr) and the LTO shall, in coordination with the Land Transportation Franchising and regulatory Board (LTFRB) and other concerned agencies and private stakeholders, aggressively and regularly conduct a nationwide information, education and communication (IEC) campaign on road safety, including the list of measures implemented pursuant to and violations punishable under this Act."" SEC. 5. Review of Penalties.- The secretary of the DOTr. upon the recommendation of the LTO, after due hearing and publication, shall have the power to increase or adjust the fine herein imposed once every five (5) years: Provided, That in no', ""license of erring applicant, if one is granted by reason of such misrepresentation, connivance, falsification or cheating, shall be revoked, and the applicant shall be prohibited from applying for a period of two (2) years. The repetition of such offense shall warrant the perpetual disqualification from being granted driver's license in addition to the fine above-stated; and c. A holder of the driver's license who acts in violation of the provisions of Republic Act No. 4136 and other existing traffic laws shall suffer corresponding penalties as may be provided by law and other issuances. In case of death or physical injuries resulting in the loss of any part of the victim's body or the use thereof, insanity, imbecility, impotence or blindness, or incapacity to work for more than ninety (90) days, the license of the offending driver shall be revoked for a period of four (4) years, after a finding by"", 'the abovementioned fine, the driver\'s license of an erring applicant, if one is granted by reason of such misrepresentation, connivance, falsification or cheating, shall be revoked, and the applicant shall be prohibited from applying for a period of two (2) years. The repetition as such offense shall warrant the perpetual disqualification from being granted a driver\'s license in addition to the fine above-stated; and ""(c) A holder of a driver\'s license who acts in violation of the provisions of Republic Act No. 4136 and other existing traffic laws shall suffer corresponding penalties as may be provided by law and other issuances. ""In case of death or physical injuries resulting in the loss of any part of the victim\'s body or the use thereof, insanity, imbecility, impotence or blindness, or incapacity to work for more than ninety (90) days, the license of the offending driver shall be', 'of twelve (12) months for the first conviction and perpetually revoked for the second conviction. The professional drivers license of any person found to have violated Section 5 of this Act shall also be confiscated and perpetually revoked for the first conviction. The perpetual revocation of a drivers license shall disqualify the person from being granted any kind of drivers license thereafter. The prosecution for any violation of this Act shall be without prejudice to criminal prosecution for violation of the Revised Penal Code, Republic Act No. 9165 and other special laws and existing local ordinances, whenever applicable. SEC. 13. Direct Liability of Operator and/or Owner of the Offending Vehicle.  The owner and/or operator of the vehicle driven by the offender shall be directly and principally held liable together with the offender for the fine and the award against the offender for civil damages unless he or she is able to convincingly prove that he or she has exercised extraordinary diligence in the selection and supervision of his or her drivers in', ""back to zero upon the renewal of his/her driver's license. However, the history of committed traffic violations from which previous demerit points were incurred shall be archived and shall form part of the driver's permanent records with the end view of preserving and disclosing such records to public officers and private persons for a legitimate purpose. Provided, That for contested apprehension by implementing agencies other than the LTO which remain unresolved until the expiry date of the driver's license of the contesting apprehended violator, demerit points attributable to violations still under contest shall accrue only on the subsequent accumulation period or when such contest is resolved with finality. RULE IV - PENALTIES Section 20. Unlawful Acts and Corresponding Penalties. - Without prejudice to the penalties provided under the Revised Penal Code and other applicable laws, the penalties corresponding to the following acts shall be imposed by the appropriate agency or officer: a. Any officer who, in any"", ""license of a person who has accumulated at least forty (40) demerit points, even if confiscated by, and/or in the possession of, any other law enforcement agencies, shall be revoked immediately without need for any proceeding for a period of two (2) years reckoned from the date of settlement of fines and penalties. Upon the revocation of any driver's license, the Land Transportation Office shall serve a notice of such revocation to the subject driver at his/her address as registered in the LTO database by E-Library - Information At Your Fingertips: Printer Friendly https://elibrary.judiciary.gov.ph/thebookshelf/showdocsfriendly/2/96764 4 of 14 10/17/2025, 10:17 PM registered mail. If no registry service is available in the locality of either the sender or the addressee, service may be done by ordinary mail which shall likewise constitute presumptive notice"", ""the fine above-stated; and A holder of a driver's license who acts in violation of the provisions of Republic Act No. 4136 and other existing traffic laws shall suffer corresponding penalties as may be provided by law and other issuances. 58 Republic Act No. 10930 In case of death or physical injuries resulting in the loss of any part of the victim's body or the use thereof, insanity, imbecility impotence or blindness, or incapacity to work for more than ninety (90) days, the license of the offending driver shall be revoked for a period of (4) years, after a finding by the court that such driver was negligent or at fault The Department of Transportation (DOTr) and the LTO shall, in coordination with the Land Transportation Franchising and Regulatory Board (LTFRB) and other concerned agencies and private stakeholders, aggressively and regularly conduct a nationwide information, education and communication (IEC) campaign on road"", ""and Implementing Rules and Regulations I RA 10586 10 d. The non-professional driver's license of any person found to have violated the law shall also be confiscated and suspended for a period of twelve (12) months for the first conviction and perpetually revoked for the second conviction. The professional driver's license shall also be confiscated and perpetually revoked for the first conviction. The perpetual revocation of a driver's license shall disqualify the person from being granted any kind of driver's license thereafter. Section 2. The prosecution for any violation of this Act shall be without prejudice to criminal prosecution for violation of the Revised Penal Code, Republic Act No. 9165 and other special laws and existing local ordinances, whenever applicable. Section 3. Direct Liability of Operator and/or Owner of the Offending Vehicle The owner and/or operator of the motor vehicle driven by the offender shall be directly and principally held liable together with the offender for the fine and the award against the offender"", ""hereof, an offender operating a conveyance or machinery which do not require a driver's license, the penalty shall be impoundment of the conveyance or machinery in lieu of the confiscation of the driver's license. Provided, further, that in the event the fine imposed is not settled within six (6) months from the date of apprehension, the implementing agency shall exhaust all available legal remedies to implement this Section. The foregoing penalties shall be imposed without prejudice to other liabilities under the Revised Penal Code or any special law, arising out or on occasion of the herein prohibited acts. The implementing agency may increase the amount of fine herein imposed once every five (5) years in the amount not exceeding ten percent (10%) of the existing rates sought to be increased which shall take effect only upon publication in at least two (2) newspapers of general circulation. Section 9. Liability of Owner and/or Operator of the Vehicle Driven by the Offender"", ""/ undercharging of fare* 4. Failure to provide proper body markings 5. No franchise / Certificate of Public Convenience or evidence of franchise presented during apprehension or carried inside the motor vehicle* 6. Fraud and falsities such as presentation of fake and spurious CPC, OR/CR, plates, stickers and tags* 7. Employing reckless, insolent, discourteous or arrogant drivers 8. Allowing an unauthorized driver to drive PUV or allowing a driver to drive PUV without bringing his/her driver's license 1st Offense  Php 5,000.00 2nd Offense  Php 10,000.00 and impounding of unit for thirty (30) days 3rd and Subsequent Offenses - Php 15,000.00 and cancellation of CPC where the unit is authorized Revocation/Cancellation of the franchise/Certificate of Public Convenience, after due notice of hearing pursuant to LTFRB Memorandum Circular No. 2013-003 1st Offense - Php 5,000.00 2nd Offense -"", 'reckless or unreasonable fast driving, any accident occurs resulting in death or injury of any person, the motor vehicle operator at fault shall, upon conviction, be punished under the provisions of the Revised Penal Code. SEC. 57. Punishment for other offenses.The conviction of any person for any offense under this Act shall not bar his prosecution for any other offense which may have been committed by such person concurrently with the commission of the offense of which he was convicted or in doing the act or series of acts which constituted the offense of which he was convicted. SEC. 58. Duty of clerks of court.It is hereby made the duty of clerks of the Court of First Instance, the City Court or Municipal Court trying traffic violation cases to certify to the Commission the result of any case, whether criminal or civil, involving violations of any provision of this Act or of other laws and ordinances relating to motor vehicles. Said certificate shall specifically contain the name of the driver or owner of the vehicle involved, his', '23-B. Penalties.- Without prejudice to the penalties provided under the Revised Penal Code and other applicable laws, the penalties corresponding to the following acts shall be imposed by the appropriate agency or officer: ""(a) Any officer who, in any manner, issues a driver\'s license without the necessary examinations, connives with the applicant for the irregular issuance of a license, or who, by gross negligence, issues a driver\'s license to an unqualified applicant shall suffer a penalty of removal from the service with all the accessory penalties attached thereto; E-Library - Information At Your Fingertips: Printer Friendly https://elibrary.judiciary.gov.ph/thebookshelf/showdocsfriendly/2/78456 2 of 5 10/17/2025, 10:21 PM ""(b) A fine in the amount of Twenty thousand pesos (P20,000.00) shall be imposed upon an applicant for', ""of conditions for driver's license renewal, prohibition from the availment of certain transactions and revocation of a driver's license. It has as its basic element a graduated scale of points giving relative values or weights to the various traffic violations depending on their gravity. f. Demerit Point - an arithmetical value, specified by integer numbers, assigned to and accumulated by a driver-violator for every corresponding traffic violation committed as used in the Point System. g. Traffic Violation - acts and omissions, whether intentional or unintentional, prohibited and penalized by traffic laws, rules and regulations and local ordinances which are classified as follows: i. Grave Violation - a traffic violation committed in willful or wanton disregard for the rights or safety of persons which poses a real threat of serious injury to the driver, his/ her passengers or the general public, or which may cause undue ruin or substantial damage to property as listed in the Violation Demerit Point Schedule"", 'period of one (1) month. Violation of these provisions beyond the third time shall result to automatic revocation of the offenders drivers license. SEC. 7. Review of Penalties.  The Land Transportation Office (LTO) is hereby empowered to increase or adjust the amounts of fines herein imposed: Provided, That: (a) The increase or adjustment is made after public consultation once every three (3) years from the effectivity of this Act and in the amount not exceeding twenty percent (20%) of the amounts sought to be increased or adjusted; (b) A thorough study has been conducted indicating that the existing amounts are no longer an effective deterrent; (c) Current relevant economic indices, such as the Consumer Price Index (CPI), have been considered in the determination of the increase or adjustment; and (d) The increases or adjustment shall only become effective fifteen (15) days after its publication in two (2) newspapers of general circulation. SEC. 8. Qualifying', ""penalty of removal from the service with all the accessory penalties attached thereto; b. A fine in the amount of Twenty thousand pesos (P20,000.00) shall be imposed upon an applicant for a driver's license found to have committed any of the following acts: 1. Willful misrepresentation with respect to material information in one's application; 2. Connivance with the officer in the irregular conduct of examination or issuance of license; 3. Falsification of documents; or 4. Cheating during examinations. Any or all the acts abovementioned shall be punished whether or not a license was granted by reason of such misrepresentation, connivance, and falsification or cheating. In addition to the abovementioned fine, the driver's license of erring applicant, if one is granted by reason of such misrepresentation, connivance, falsification or cheating, shall be revoked, and the applicant shall be"", ""violation is committed for at least three (3) times during the validity of the driver's license. Provided, further, That in addition to the foregoing reorientation course, a public utility vehicle driver who has committed any franchise-related violation shall undergo the training seminar conducted by the PUV Driver's Academy of the LTFRB. Failure of the driver to complete the said intervention program within thirty (30) days from the date of the last apprehension shall cause the suspension of the driver's license upon prior notice until the required attendance to the course is complied with. Section 16. Outright Revocation. - Without prejudice to the authority of the court in appropriate cases and except as otherwise provided in Republic Act No. 4136 as amended and other laws and issuances, the driver's license of a person who has accumulated at least forty (40) demerit points, even if confiscated by, and/or in the possession of, any other law enforcement agencies, shall"", ""suspension of driver's license for three (3) months, for the third offense; and d. A fine of twenty thousand pesos (P20,000.00) for the fourth offense and succeeding offenses, and revocation of driver's license. Provided, that a driver of a public utility vehicle, a school bus, a school service vehicle, a common carrier hauling volatile, flammable or toxic material, or a driver who commits an act classified herein as distracted driving within a fifty (50)-meter radius from the school premises shall be subject to a penalty of thirty thousand pesos (P30,000.00) and suspension of one's driver's license for three (3) months. Provided, that the implementation of Section 8(c) hereof, an offender operating a conveyance or machinery which do not require a driver's license, the penalty shall be impoundment of the conveyance or machinery in lieu of the"", '10/17/2025, 10:21 PM ""(b) A fine in the amount of Twenty thousand pesos (P20,000.00) shall be imposed upon an applicant for a driver\'s license found to have committed any of the following acts: ""(1) Willful misrepresentation with respect to material information in one\'s application; ""(2) Connivance with the officer in the irregular conduct of examinations or issuance of license; ""(3) Falsification of documents; or ""(4) Cheating during examinations. ""Any or all of the acts abovementioned shall be punished whether or not a license was granted by reason of such misrepresentation, connivance, falsification or cheating. ""In addition to the abovementioned fine, the driver\'s license of an erring applicant, if one is granted by reason of such misrepresentation, connivance, falsification or cheating,', ""month's suspension of the registration for each subsequent conviction. l. For violation of any provisions of this Act or regulations promulgated pursuant hereto, not hereinbefore specifically punished, a fine of not less than ten or more than fifty pesos shall be imposed. m. In the event an offender cannot pay any fine imposed pursuant to the provisions E-Library - Information At Your Fingertips: Printer Friendly https://elibrary.judiciary.gov.ph/thebookshelf/showdocsfriendly/2/26188 28 of 31 10/17/2025, 11:21 PM of this Act, he shall be made to undergo subsidiary imprisonment as provided for in the Revised Penal Code. n. If, as the result of negligence or reckless or unreasonable fast driving, any accident occurs resulting in death or injury of any person, the motor vehicle operator at fault shall, upon conviction, be punished under the provisions of the Revised Penal Code."", 'Connivance with the officer in the irregular conduct of examinations or issuance of license; ""(3) Falsification of documents; or ""(4) Cheating during examinations. Any or all of the acts abovementioned shall be punished whether or not a license was granted by reason of such misrepresentation, connivance, falsification or cheating. In addition to the abovementioned fine, the driver\'s license of an erring applicant, if one is granted by reason of such misrepresentation, connivance, falsification or cheating shall be revoked, and the applicant shall be prohibited from applying for a period of two (2) years. The repetition of such offense shall warrant the perpetual disqualification from being granted a driver\'s license in addition to the fine above-stated; and A holder of a driver\'s license who acts in violation of the provisions of Republic Act No. 4136 and other existing traffic laws shall suffer corresponding penalties as may', 'other traffic laws, rules and regulations during the five (5)-year period shall be entitled to a renewal of such license for ten (10) years, subject to the restrictions as may be imposed by the LTO. ""The local government units (LGUs), the Metropolitan Manila Development Authority (MMDA) or other agencies lawfully issuing traffic violation receipts shall report within a reasonable time, to be determined in the implementing rules and regulations (IRR), the details of the traffic violation to the LTO, which shall serve as the repository of all traffic violation records."" SEC. 3. A new section is hereby added after Section 23 of the same Act and numbered as Section 23-A, to read as follows: ""SEC. 23-A. Establishment of Stricter Rules Before the Issuance of Driver\'s License.- The LTO shall promulgate prerequisites and guidelines before the grant of driver\'s licenses to ensure that these are issued only', 'vehicle, a common carrier hauling volatile, flammable or toxic material, or a driver who commits an act classified herein as distracted driving within a fifty (50)-meter radius from the school premises shall be subject to a penalty of thirty thousand pesos (P30,000.00) and suspension of ones drivers license for three (3) months. The foregoing penalties shall be imposed without prejudice to other liabilities under the Revised Penal Code or any special law, arising out or on occasion of the herein prohibited acts. SEC. 9. Liability of Owner and/or Operator of the Vehicle Driven by the Offender.  The owner and/or operator of the vehicle driven by the offender shall be directly and principally held liable together with the offender for the fine unless he or she is able to convincingly prove that he or she has exercised extraordinary diligence in the selection and supervision of his or her drivers in general and the offending driver in particular. This section shall principally apply to', 'driver driving without being accompanied by a duly licensed driver. Php 3,000.00 In addition, the unlicensed or improperly licensed driver shall be disqualified from being granted a drivers license and driving a motor vehicle for a period of one (1) year from the payment of the fine. 73 B. DRIVING A MOTOR VEHICLE USED IN THE COMMISSION OF A CRIME UPON CONVICTION BY A REGULAR COURT OF COMPETENT JURISDICTION C. COMMISSION OF A CRIME IN THE COURSE OF APPREHENSION UPON CONVICTION BY A REGULAR COURT OF COMPETENT JURISDICTION Php 10,000.00 In addition, the drivers license shall be confiscated and upon conviction for the crime, revoked and the driver shall be perpetually disqualified from being granted a drivers license and driving a motor vehicle. The motor vehicle driven by the violator shall likewise be impounded until ordered to be released by a regular court of competent jurisdiction after payment of appropriate fines and penalties. Php 10,000.00 In addition, the drivers license shall be confiscated, and revoked upon conviction for the', ""the provisions of this Act. Non-installation and tampering of the speed limiter shall be liable to the penalty provisions thereof. Enforcement Procedure - The driver, upon lawful demand by the LTO LEO, shall surrender his/her driver's license and present the Certificate of Registration (CR), current Official Receipt (OR) of registration, and certificate of conformity. In the event of a violation, the LTO LEO shall immediately impound the vehicle in the designated impoundment area of the LTO. The impounded vehicle shall only be released upon payment of fines as provided in the penalty provisions hereof and installation or recalibration of the tampered speed limiter device. 55 REPUBLIC ACT NO. 10930 AN ACT RATIONALIZING AND STRENGTHENING THE POLICY REGARDING DRIVER'S LICENSE BY EXTENDING THE VALIDITY PERIOD OF DRIVERS LICENSES, AND PENALIZING ACTS IN VIOLATION OF ITS ISSUANCE AND APPLICATION, AMENDING FOR THOSE PURPOSES SECTION 23 OF REPUBLIC ACT NO. 4136, AS"", ""certified by the DTI installed and set in the vehicle. SETTING OF STANDARDS The DOTr shall, in accordance with acceptable international standards, determine the specifications of the speed limiters that may be allowed to be installed in the covered vehicles. The LTO or the LTFRB, shall supervise and inspect the setting of speed limiter corresponding to the maximum allowed in the route plied by a particular covered vehicle. 53 Republic Act No. 10916 FINES and PENALTIES A Driver who operates a Motor Vehicle without speed limiter or the owner/operator who allows such driver to operate an MV without speed limiter. A driver, owner or operator who operates or allows a person to operate a motor vehicle with a nonfunctioning or tampered speed limiter. First Offense - Fifty Thousand Pesos (Php 50,000.00) Plus, a one (1) month suspension of driver's license or three (3) months suspension of MV franchise Second Offense - Fifty Thousand Pesos (Php"", ""a period of not less than one year nor more than three years: Provided, however, That upon written application to the Commissioner for release from such a bond, the Commissioner may after revoking or suspending the driver's license, authorize the release of the bondsmen from further responsibility thereunder: Provided, further, That should the Commissioner decide not to revoke the license of a driver who has been convicted of homicide through reckless imprudence, or of the violation of the speed limit or of reckless driving at least three times within a twelve-month period, the said driver shall post a bond in the sum of not less than two thousand pesos, conditioned upon the payment of any claim which may be filed or any execution which may be issued against him in any case wherein said driver may be held answerable while operating motor vehicles. SEC. 29. Confiscation of driver's licenses.Law enforce-met and peace officers duly designated by the Commissioner shall, in"", ""50,000.00) Plus, a one (1) month suspension of driver's license or three (3) months suspension of MV franchise Second Offense - Fifty Thousand Pesos (Php 50,000.00) Revocation of driver's license or six (6) months suspension of MV franchise Third Offense - Fifty Thousand Pesos (Php 50,000.00) Revocation of driver's license or one (1) year suspension of MV franchise ANY PERSON FOUND GUILTY OF TAMPERING A SPEED LIMITER - Thirty Thousand Pesos (Php 30,000.00) Imprisonment of not less than six (6) months but not more than three (3) years 54 Republic Act No. 10916 The suspension of the franchise of the covered vehicle shall be effective immediately upon the date of issuance of the order of suspension. Provided, that period of suspension will subsist if the fine has not been paid within one (1) year from the order of suspension. Vehicles"", ""him whenever he has reason to believe that the holder thereof is an improper person to operate motor vehicles, or in operating or using a motor vehicle in, or as an accessory to, the commission of any crime or act which endangers the public. Any deputy of the Commissioner may, for the same cause, suspend for a period not exceeding three months any E-Library - Information At Your Fingertips: Printer Friendly https://elibrary.judiciary.gov.ph/thebookshelf/showdocsfriendly/2/26188 16 of 31 10/17/2025, 11:21 PM driver's license issued under the provisions of this Act: Provided, That such suspension may be appealed to the Commissioner who may, after reviewing the case, confirm, reverse or modify the action taken by such deputy. b. Whenever during any twelve-month period a driver shall have been convicted at least three times for the violations of any provisions of this Act or of"", 'toll fees be charged or collected until and unless the approved schedule of tolls has been posted legibly in a conspicuous place at such toll station. E-Library - Information At Your Fingertips: Printer Friendly https://elibrary.judiciary.gov.ph/thebookshelf/showdocsfriendly/2/26188 29 of 31 10/17/2025, 11:21 PM SEC. 60. The lien upon motor vehicles.Any balance of fees for registration, re- registration or delinquent registration of a motor vehicle, remaining unpaid and all fines imposed upon any vehicle owner, shall constitute a first lien upon the motor vehicle concerned. The Commission is hereby vested with authority to issue a warrant of constructive or actual distraint or and levy to any owner of motor vehicle who has any balance of fees for registration, re-registration or delinquent registration of a motor vehicle remaining unpaid, which upon demand by the Commissioner of the Land']","According to the provided context, if you refuse to pay a traffic citation on time, the fine and penalties will still be imposed. However, the exact consequences are not specified in the provided context. 

However, it is mentioned in the context that if the fine has not been paid within one (1) year from the order of suspension, the period of suspension will subsist (Section 9, Republic Act No. 10916).","Ignoring or refusing to pay a traffic citation can result in additional fines, license suspension, or being unable to renew your vehicle registration until all violations are settled.",0.3333333333333333,0.0
What happens if a driver fails to renew their license before it expires?,"['the atmosphere and weather, or so to endanger the property of the safety or rights of any person or so as to cause excessive or unreasonable damage to the highway. This includes driving with an improperly registered motor vehicle or a motor vehicle with expired, revoked, suspended, or invalid registration, unregistered of fake substitute or replacement engine, engine block or chassis. F. SUBMISSION OF FAKE DOCUMENTS IN RELATION TO THE APPLICATION FOR A DRIVERS LICENSE (NEW/RENEWAL) Anti-Drunk and Drugged Driving Act of 2013 First offense Php 2,000.00 Second offense Php 3,000.00 Subsequent offense Php10,000.00 In addition, the drivers license shall be suspended for a period of three (3) months for the second offense and six (6) months for the third offense from payment of fine and revocation of drivers license on the succeeding offense. A revoked non-professional driver shall be disqualified from being granted a drivers license for a period of two (2) years counted from', ""driver may be held answerable while operating motor vehicles. SEC. 29. Confiscation of driver's licenses.Law enforce-met and peace officers duly designated by the Commissioner shall, in apprehending any driver for violations of this Act or of any regulations issued pursuant thereto, or of local traffic rules and regulations, confiscate the license of the driver concerned and issue a receipt prescribed and issued by the Commission therefor which shall authorize the driver to operate a motor vehicle for a period not exceeding seventy-two hours from the time and date of issue of said receipt. The period so fixed in the receipt shall not be extended, and shall become invalid thereafter. Failure of the driver to settle his case within fifteen days from the date of apprehension will cause suspension and revocation of his license. E-Library - Information At Your Fingertips: Printer Friendly"", 'reverse or modify the action taken by such deputy. b. Whenever during any twelve-month period a driver shall have been convicted at least three times for the violations of any provisions of this Act or of any regulation issued by the Commissioner or any municipal or city ordinance relating to motor vehicle traffic not in, conflict with any of the provisions of this Act, the Com-missioner may, in his discretion, revoke or suspend the license of such driver for a period not exceeding two years. c. The license suspended or revoked under the provisions of subsections (a) and (b) of this section shall not be reinstated unless the driver has furnished a bond in accordance with Section twenty-nine of this Act and only after the Commissioner has satisfied himself that such driver may again safely be permitted to operate a motor vehicle. d. A decision of the Commissioner revoking or refusing the reinstatement of a license under the provisions of this Section may be appealed to the Secretary of Public Works and', 'the abovementioned fine, the driver\'s license of an erring applicant, if one is granted by reason of such misrepresentation, connivance, falsification or cheating, shall be revoked, and the applicant shall be prohibited from applying for a period of two (2) years. The repetition as such offense shall warrant the perpetual disqualification from being granted a driver\'s license in addition to the fine above-stated; and ""(c) A holder of a driver\'s license who acts in violation of the provisions of Republic Act No. 4136 and other existing traffic laws shall suffer corresponding penalties as may be provided by law and other issuances. ""In case of death or physical injuries resulting in the loss of any part of the victim\'s body or the use thereof, insanity, imbecility, impotence or blindness, or incapacity to work for more than ninety (90) days, the license of the offending driver shall be', ""license of erring applicant, if one is granted by reason of such misrepresentation, connivance, falsification or cheating, shall be revoked, and the applicant shall be prohibited from applying for a period of two (2) years. The repetition of such offense shall warrant the perpetual disqualification from being granted driver's license in addition to the fine above-stated; and c. A holder of the driver's license who acts in violation of the provisions of Republic Act No. 4136 and other existing traffic laws shall suffer corresponding penalties as may be provided by law and other issuances. In case of death or physical injuries resulting in the loss of any part of the victim's body or the use thereof, insanity, imbecility, impotence or blindness, or incapacity to work for more than ninety (90) days, the license of the offending driver shall be revoked for a period of four (4) years, after a finding by"", ""Except for the student-driver's permits, all drivers' licenses shall be valid for five (5) years reckoned from the birthdate of the licensee, unless sooner E-Library - Information At Your Fingertips: Printer Friendly https://elibrary.judiciary.gov.ph/thebookshelf/showdocsfriendly/2/96764 2 of 14 10/17/2025, 10:17 PM revoked or suspended. Provided, however, That subject to Section 26 of Republic Act No. 4136, as amended by Batas Pambansa Blg. 398, any holder of a professional or nonprofessional driver's license who has not committed any violation of Republic Act No. 4136 and other traffic laws, rules and regulations shall be entitled to a renewal of such license for ten (10) years. Section 7. Safeguards against Falsities and Forgeries. - In the issuance of"", '- Information At Your Fingertips: Printer Friendly https://elibrary.judiciary.gov.ph/thebookshelf/showdocsfriendly/2/78456 1 of 5 10/17/2025, 10:21 PM create an online process for the renewal of professional and nonprofessional licenses within one (1) year from the effectivity of this Act. ""Except for student permits, all drivers\' licenses shall be valid for five (5) years reckoned from the birthdate of the licensee, unless sooner revoked or suspended: Provided, however, That subject to Section 26 hereof, any holder of a professional or nonprofessional driver\'s license who has not committed any violation of Republic Act No. 4136 and other traffic laws, rules and regulations during the five (5)-year period shall be entitled to a renewal of such license for ten (10) years, subject to the restrictions as may be imposed', '(CL) - A new CL is valid for five (5) years reckoned from the date of birth of the licensee, unless sooner revoked or suspended. A holder of CL who has not committed any violation/s during the five (5) year period preceding its expiration is entitled to renewal of such license valid for ten (10) years. - Renewal of CL after two (2) years from the expiry date shall require the holder to take and pass the written examination and pay the corresponding penalty in addition to the basic fee. 4 Permits and Licenses DRIVERS LICENSE (DL) An authority in the form prescribed by the LTO granted to a person to operate motor vehicle that is either nonprofessional or professional drivers license. NONPROFESSIONAL DL (NPDL)  an authority in the form prescribed by the LTO granted to a person to operate a private motor vehicle. PROFESSIONAL DL (PDL)  an authority in the form prescribed by the LTO granted to', ""laws, rules and regulations shall be entitled to a renewal of such license for ten (10) years. Section 7. Safeguards against Falsities and Forgeries. - In the issuance of licenses, the LTO shall use such process or adopt such measures as will prevent any alteration or falsification of a license or will enable the LTO to detect any unauthorized license. RULE III - PREREQUISITES AND GUIDELINES FOR THE ISSUANCE OF DRIVER'S LICENSES Section 8. Establishment of Stricter Rules Before the Issuance of Driver's License. - Pursuant to Section 23-A of Republic Act No. 4136, as amended by Republic Act No. 10930, the Land Transportation Office shall promulgate prerequisites and guidelines to ensure that driver's licenses are issued only to deserving applicants with sufficient driving skills and knowledge on road safety and proper road courtesy. The conduct of theoretical and practical examinations, among others, shall be designed to sufficiently measure the competency"", ""the fee prescribed in accordance with law but prior to the issuance of said license. The applicant shall present himself/herself in person and have his/her photograph taken by the LTO. All drivers licenses issued shall be signed in the presence of the LTO Head or his/her deputies and shall bear, among others, the full name, date of birth, height, weight, sex, color of eyes, blood type, complete current address, biometrics, license number, and its date of issue and expiration. 56 Republic Act No. 10930 All drivers' licenses shall be valid for five (5) years reckoned from the birthdate of the licensee, unless sooner revoked or suspended However, any holder of a professional or nonprofessional driver's license who has not committed any violation of Republic Act No. 4136 and other traffic laws, rules and regulations shall be entitled to a renewal of such license for ten (10) years. The LTO shall"", 'payment of the delinquency fees. The fee for renewal of delinquent license shall be five pesos in addition to the basic fee as hereinabove prescribed. Every applicant for renewal of license to operate any motor vehicle shall present to the Commissioner, in person or by mail or messenger, the license issued to the applicant for the previous year, together with the proper fee of five pesos and, in the case of professional chauffeurs, three copies of a readily-recognized photograph of the applicant, which photograph shall have been taken not exceeding three years prior to the date of application for renewal. Lost license.In case the license for the previous year has been lost or cannot be produced, the applicant shall obtain a duplicate in accord with Section eleven of this Act, on penalty of refusal, by the Commissioner or his deputies, to renew the license: Provided, however, That the Commissioner or his deputies may, in their discretion accept in lieu of the previous years license, the', ""of a motor vehicle shall engage, employ, or hire any person to operate such motor vehicle, unless the person sought to be employed is a duly licensed professional driver. SEC. 25. Driver's records.Any driver who changes his address shall, within fifteen days, notify the Commissioner in writing of his new address, name and address of his new employer, the number of the motor vehicle he is employed to operate, and such other information as the Commissioner may require. SEC. 26. Renewal of license.Any license not renewed on or before the last working day of the month when the applicant was born shall become delinquent and invalid, except when the license is surrendered to the Com-missioner or his deputies before the last working day of the month of his birth in order to avoid payment of the delinquency fees. The fee for renewal of delinquent license shall be five pesos in addition to the basic fee as hereinabove prescribed. Every applicant for renewal"", 'or incapacity to work for more than ninety (90) days, the license of the offending driver shall be revoked for a period of four (4) years, after a finding by the court that such driver was negligent or at fault. Notwithstanding the non-filing of an action in court or the amicable settlement of the dispute, the Assistant Secretary may still exercise his authority to suspend or revoke the license of the driver who has caused such death or serious physical injury after his determination that the driver is an improper person to operate motor vehicles. Section 21. Review of Penalties. - The Secretary of the DOTr, upon the recommendation of the LTO, after due hearing and publication, shall have the power to increase or adjust the fine herein imposed once every five (5) years. Provided, That in no case shall be increase be more than five percent (5%) of the fine sought to be increased. RULE V - RESPONSIBILITIES OF IMPLEMENTING AGENCIES Section 22. Repository', 'Penalty if expired 1 day to 1 year 75.00 1 year and 1 day to 2 years 150.00 2 years and 1 day to 10 years 225.00 If with Additional Restriction Code (ARC) 100.00 / RC FEES and OTHER CHARGES APPLICATION FOR ADDITIONAL RESTRICTION CODE PARTICULARS VALID PROFESSIONAL VALID NON-PROFESSIONAL DUE TO RENEWAL Application Fee 100.00 100.00 100.00 Computer Fee 67.63 67.63 67.63 Replacement Fee 225.00 225.00 -- Renewal Fee -- -- 585.00 Additional Restriction Fee 100.00 / RC 100.00 / RC 100.00 / RC Computer Fee 67.63 67.63 67.63 TOTAL 560.26 560.26 920.26 Note: In case of the conflict in text of the manual and LTO Citizens Charter, the latter shall prevail. 31 Fees and Other Charges FEES and OTHER CHARGES APPLICATION FOR REPLACEMENT LICENSE (Valid license) PARTICULARS NON- PROFESSIONAL /PROFESSIONAL CONDUCTORS', ""of refusal, by the Commissioner or his deputies, to renew the license: Provided, however, That the Commissioner or his deputies may, in their discretion accept in lieu of the previous years license, the duly-signed and sworn statement of an operator to the effect that he has not operated any motor vehicle in the Philippines during the year or years to which no license was issued in his name. The Commissioner and his deputies are hereby author-zed to administer the oath in connection with such affidavit. SEC. 27. Suspension, revocation of driver's license. a. The Commissioner may suspend for a period not exceeding three months or, after hearing, revoke any driver's license issued under the provisions of this Act, and may order any such license to be delivered to him whenever he has reason to believe that the holder thereof is an improper person to operate motor vehicles, or in operating or using a motor vehicle in, or as an accessory to, the commission of any"", 'is valid for five (5) years reckoned from the date of birth of the licensee, unless sooner revoked or suspended. A DL holder who has not committed any violation/s during the five (5) year period preceding its expiration is entitled to a renewal of such license valid for ten (10) years. 14 Qualifications and Documentary Requirements RENEWAL OF DRIVERS LICENSE Item Qualifications Requirements NPDL PDL PDL A, A1, B, B1, B2 C, CE, D, BE 1 Holder of DL Drivers License    2 Physically and Mentally Fit to drive Medical Certificate from Accredited Medical Clinic    3 No unsettled Traffic Violation    4 DL not renewed for more than two (2) years after the expiry date - Passed the Automated Theoretical Examination and Practical Driving Test    5 Completed the Driving Enhancement Program (DEP) prior to initial renewal of the five (5) year DL    6 Other Requirements: Duly accomplished APL Form    7 Foreigners - Valid Working Visa n/a   8 Completed training in the operation', 'of twelve (12) months for the first conviction and perpetually revoked for the second conviction. The professional drivers license of any person found to have violated Section 5 of this Act shall also be confiscated and perpetually revoked for the first conviction. The perpetual revocation of a drivers license shall disqualify the person from being granted any kind of drivers license thereafter. The prosecution for any violation of this Act shall be without prejudice to criminal prosecution for violation of the Revised Penal Code, Republic Act No. 9165 and other special laws and existing local ordinances, whenever applicable. SEC. 13. Direct Liability of Operator and/or Owner of the Offending Vehicle.  The owner and/or operator of the vehicle driven by the offender shall be directly and principally held liable together with the offender for the fine and the award against the offender for civil damages unless he or she is able to convincingly prove that he or she has exercised extraordinary diligence in the selection and supervision of his or her drivers in', 'penalty within fifteen (15) days from the date of apprehension shall cause automatic suspension of his drivers license for a period of thirty (30) days from the date of apprehension, in addition to the fines and penalties prescribed hereunder. The LTO shall resolve a contested case within five (5) days from receipt of said written contest. The imposition of the fines and penalties shall be without prejudice to any criminal action that may be instituted under existing laws, rules and regulations. VIOLATIONS IN CONNECTION WITH LICENSING A. DRIVING WITHOUT A VALID DRIVERS LICENSE / CONDUCTORS PERMIT This includes driving within an expired, revoked, suspended, inappropriate drivers license restriction code, inappropriate drivers license classification, fake drivers license, tourist driving a motor vehicle with a valid foreign driving license beyond the 90-day maximum allowable period and a student driver driving without being accompanied by a duly licensed driver. Php 3,000.00 In addition, the unlicensed or improperly licensed driver shall be disqualified from being granted a drivers license and driving', ""and Implementing Rules and Regulations I RA 10586 10 d. The non-professional driver's license of any person found to have violated the law shall also be confiscated and suspended for a period of twelve (12) months for the first conviction and perpetually revoked for the second conviction. The professional driver's license shall also be confiscated and perpetually revoked for the first conviction. The perpetual revocation of a driver's license shall disqualify the person from being granted any kind of driver's license thereafter. Section 2. The prosecution for any violation of this Act shall be without prejudice to criminal prosecution for violation of the Revised Penal Code, Republic Act No. 9165 and other special laws and existing local ordinances, whenever applicable. Section 3. Direct Liability of Operator and/or Owner of the Offending Vehicle The owner and/or operator of the motor vehicle driven by the offender shall be directly and principally held liable together with the offender for the fine and the award against the offender"", 'Connivance with the officer in the irregular conduct of examinations or issuance of license; ""(3) Falsification of documents; or ""(4) Cheating during examinations. Any or all of the acts abovementioned shall be punished whether or not a license was granted by reason of such misrepresentation, connivance, falsification or cheating. In addition to the abovementioned fine, the driver\'s license of an erring applicant, if one is granted by reason of such misrepresentation, connivance, falsification or cheating shall be revoked, and the applicant shall be prohibited from applying for a period of two (2) years. The repetition of such offense shall warrant the perpetual disqualification from being granted a driver\'s license in addition to the fine above-stated; and A holder of a driver\'s license who acts in violation of the provisions of Republic Act No. 4136 and other existing traffic laws shall suffer corresponding penalties as may', 'to be released by a regular court of competent jurisdiction after payment of appropriate fines and penalties. Php 10,000.00 In addition, the drivers license shall be confiscated, and revoked upon conviction for the crime. The driver shall be disqualified from being granted a drivers license for a period of 5 years counted from the date of payment of appropriate fines and penalties The motor vehicle driven by the violator shall likewise be impounded until ordered to be released by a regular court of competent jurisdiction after payment of appropriate fines and penalties. 74 D. Refer to R.A. No. 10586 E. RECKLESS DRIVING No person shall operate a motor vehicle on any highway recklessly or without reasonable caution considering the width, traffic, grades, crossing, curvatures, visibility and other conditions of the highway and the conditions of the atmosphere and weather, or so to endanger the property of the safety or rights of any person or so as to cause excessive or unreasonable damage to the highway. This includes driving with an improperly', 'the desired type of motor vehicle. VALIDITY OF STUDENT-DRIVERS PERMIT (SP) - The SP is valid for one (1) year from the date of its issuance. After one (1) year, it cannot be used for purposes of the practical driving course. However, it can be used to apply for NPDL if the practical driving course has been completed within the one (1) year validity period. - After two (2) years from the date of issuance of SP, the holder is required to acquire a new SP bearing the same SP number and undergo the required apprenticeship period reckoned from the date of issuance of the new SP. All records of training courses are retained. - SP may be renewed on or before the expiry date if the holder is not ready to apply for DL. Except for settlement of penalties due to traffic violations, only the basic fee is to be collected for the renewal of SP after the expiry date. The holder must be accompanied by', 'apply for DL. Except for settlement of penalties due to traffic violations, only the basic fee is to be collected for the renewal of SP after the expiry date. The holder must be accompanied by a duly licensed driver, accredited by LTO as driving instructor, possessing the appropriate license codes with respect to the motor vehicle category applied for. Prior to application of DL, the holder shall present a Certification that he/she has undergone the Driving Course conducted by LTO Accredited TESDA Training Center or Driving School. 3 Permits and Licenses CONDUCTORS LICENSE (CL) An authority granted by the LTO to a qualified person to assist the driver of a public utility vehicle in fare collection and/or ensuring the safety of the passengers and/or cargo while the said vehicle is in operation. VALIDITY OF CONDUCTORS LICENSE (CL) - A new CL is valid for five (5) years reckoned from the date of birth of the licensee, unless sooner revoked or suspended. A holder of CL who has not', ""Information, Education and Communication Campaign. - The Department of Transportation (DOTr) and the LTO shall, in coordination with the Land Transportation Franchising and Regulatory Board (LTFRB) and other concerned agencies and private stakeholders, aggressively and regularly conduct a nationwide information, education and communication (IEC) campaign on road safety, including the list of measures implemented pursuant to and violations punishable under Republic Act No. 4136 and other existing traffic laws. Section 26. Research and Development. - The LTO shall conduct continuing research and development to ensure the efficient administration of the driver's licensing system. RULE VI - TRANSITORY AND FINAL PROVISIONS Section 27. Transitory Provisions. - After the effectivity of this IRR, all driver's licenses with a validity of three (3) years shall be entitled to a renewal valid for five (5) years. All holders of driver's licenses with 5-year validity shall undergo comprehensive driver's education on road safety and proper road courtesy"", ""prejudice to the penalties provided under the Revised Penal Code and other applicable laws, the penalties corresponding to the following acts shall be imposed by the appropriate agency or officer: a. Any officer who, in any manner, issues a driver's license without the necessary examination, connives with the applicant for the irregular issuance of a license, or who, by gross negligence, issues a driver's license, or who, by gross negligence, issues a E-Library - Information At Your Fingertips: Printer Friendly https://elibrary.judiciary.gov.ph/thebookshelf/showdocsfriendly/2/96764 5 of 14 10/17/2025, 10:17 PM driver's license to an unqualified applicant shall suffer a penalty of removal from the service with all the accessory penalties attached thereto; b. A fine in the amount of Twenty thousand pesos (P20,000.00) shall be imposed upon an"", 'theoretical examination shall be according to DL Classification, and DL Code and Vehicle Description which the applicant intends to operate. Vehicle General Description DL Code Nonprofessional Professional Motorcycle/Tricycle A, A1 A, A1 Light Vehicles B, B1, B2 B Light Vehicles - B1 Light Vehicles - B2 Light or Heavy/ Articulated Vehicles - BE, C, CE Heavy Passenger Vehicles - D The LTO personnel or its accredited assessor shall conduct the Practical Driving Test which shall be done within the LTO authorized test route. Any test conducted outside of the designated test route shall be declared null and void. Failed applicants may re-apply after seven (7) calendar days. OTHER PROVISIONS All licenses may be applied for renewal on or before but not earlier than sixty (60) days from the expiry date. However, a DL may be renewed one (1) year in advance upon presentation of a valid transportation ticket as proof of imminent travel. 28 General Procedure in Securing Licenses and Permits CLIENT', ""shall be entitled to a renewal valid for five (5) years. All holders of driver's licenses with 5-year validity shall undergo comprehensive driver's education on road safety and proper road courtesy upon the holder's first renewal of driver's license after the effectivity of this IRR. Section 28. Separability Clause. - If any provision or part hereof is held invalid or unconstitutional, the remainder of the IRR or provisions not otherwise affected shall remain valid and subsisting. Section 29. Repealing Clause. - All laws, rules and regulations, issuances or parts thereof inconsistent with this IRR are hereby revoked, repealed, amended or modified accordingly. Section 30. Effectivity. - This IRR shall take effect upon its publication in the Official Gazette or in a newspaper of general circulation, and upon registration with the Office of the National Administrative Register at the University of the Philippines Law Center, U.P. Diliman, Quezon City."", ""violation is committed for at least three (3) times during the validity of the driver's license. Provided, further, That in addition to the foregoing reorientation course, a public utility vehicle driver who has committed any franchise-related violation shall undergo the training seminar conducted by the PUV Driver's Academy of the LTFRB. Failure of the driver to complete the said intervention program within thirty (30) days from the date of the last apprehension shall cause the suspension of the driver's license upon prior notice until the required attendance to the course is complied with. Section 16. Outright Revocation. - Without prejudice to the authority of the court in appropriate cases and except as otherwise provided in Republic Act No. 4136 as amended and other laws and issuances, the driver's license of a person who has accumulated at least forty (40) demerit points, even if confiscated by, and/or in the possession of, any other law enforcement agencies, shall"", ""payment of fine and revocation of drivers license on the succeeding offense. A revoked non-professional driver shall be disqualified from being granted a drivers license for a period of two (2) years counted from date of revocation. A revoked professional driver shall be perpetually disqualified from getting any drivers license. Php 3,000.00 In addition, the drivers license shall be put on alarm, revoked and the driver shall be disqualified from being granted a drivers license and driving a motor vehicle for a period of one (1) year from the payment of the fine without prejudice to the filing of appropriate criminal charges. 75 G. Refer to R.A. No. 8750 H. Refer to R.A No. 10054 I. FAILURE TO CARRY DRIVER'S LICENSE, CERTIFICATE OF REGISTRATION OR OFFICIAL RECEIPT WHILE DRIVING A MOTOR VEHICLE J. ALL OTHER VIOLATIONS OF TRAFFIC RULES AND REGULATIONS Seat Belts Use Act of 1999 Motorcycle Helmet Act of 2009 Php 1,000.00 Php 1,000.00 This"", ""invalid thereafter. Failure of the driver to settle his case within fifteen days from the date of apprehension will cause suspension and revocation of his license. E-Library - Information At Your Fingertips: Printer Friendly https://elibrary.judiciary.gov.ph/thebookshelf/showdocsfriendly/2/26188 17 of 31 10/17/2025, 11:21 PM SEC. 30. Student-driver's permit.Upon proper application and the payment of three pesos, the Commissioner or his deputy may issue student-driver's permits, valid for six months to persons not under eighteen years of age who desire to learn to operate motor vehicles. No application for driver's license shall be received unless the applicant has undergone instruction in the operation of motor vehicles for at least a month and has a valid student-driver's permit: Provided, however, That any person who has a license to operate motor vehicles in other countries may,"", ""license or those applying for renewal thereof shall undergo the driver's education herein stated. b. The training course for all applicants of driver's license, whether new or renewal, shall be implemented uniformly nationwide and shall include the impact of alcohol, drugs, fatigue and distracted driving on a driver's performance as well as the penalties attached for violation thereof. c. The driver's license written examination shall include questions concerning the effects of alcohol and drug intoxication on the ability of a person to operate a motor vehicle and the legal and pecuniary consequences resulting from violation of the provisions of this Act. For this purpose, the L TO shall cause the revision of all modules on the effects of alcohol and drug intoxication while driving. RULE Ill - PROCEDURE FOR APPREHENSION Section 1. Probable Cause Probable cause shall mean that the LEO has reasonable ground to believe that the person driving the motor vehicle is under the influence of alcohol, dangerous drugs and/or other similar substances upon personally witnessing a"", '(DEP) prior to initial renewal of the five (5) year DL    6 Other Requirements: Duly accomplished APL Form    7 Foreigners - Valid Working Visa n/a   8 Completed training in the operation of Special-purpose Vehicle (SV) Certificate of Completion (COC) issued by an office, association or institution recognized by the govt. to issue said COC. n/a   15 Qualifications and Documentary Requirements Renewal of Drivers License - Renewal of DL after two (2) years from the expiry date shall require the holder to take and pass the theoretical and practical examination and pay the corresponding penalty in addition to the basic fee. - Filipinos working/living abroad may renew their DL on-line or through their authorized representative upon presentation of necessary documents. The licensee shall present him/herself to LTO upon arrival in the Philippines for capture of photo and presentation of Official Receipt and submission of medical certificate. - Renewal of Philippine DL after two (2) years from the expiry date', ""license of a person who has accumulated at least forty (40) demerit points, even if confiscated by, and/or in the possession of, any other law enforcement agencies, shall be revoked immediately without need for any proceeding for a period of two (2) years reckoned from the date of settlement of fines and penalties. Upon the revocation of any driver's license, the Land Transportation Office shall serve a notice of such revocation to the subject driver at his/her address as registered in the LTO database by E-Library - Information At Your Fingertips: Printer Friendly https://elibrary.judiciary.gov.ph/thebookshelf/showdocsfriendly/2/96764 4 of 14 10/17/2025, 10:17 PM registered mail. If no registry service is available in the locality of either the sender or the addressee, service may be done by ordinary mail which shall likewise constitute presumptive notice"", ""a period of not less than one year nor more than three years: Provided, however, That upon written application to the Commissioner for release from such a bond, the Commissioner may after revoking or suspending the driver's license, authorize the release of the bondsmen from further responsibility thereunder: Provided, further, That should the Commissioner decide not to revoke the license of a driver who has been convicted of homicide through reckless imprudence, or of the violation of the speed limit or of reckless driving at least three times within a twelve-month period, the said driver shall post a bond in the sum of not less than two thousand pesos, conditioned upon the payment of any claim which may be filed or any execution which may be issued against him in any case wherein said driver may be held answerable while operating motor vehicles. SEC. 29. Confiscation of driver's licenses.Law enforce-met and peace officers duly designated by the Commissioner shall, in"", ""payment of the fee prescribed in accordance with law but prior to the issuance of said license, the applicant shall present himself/herself in person and have his/her photograph taken by the LTO. All driver's licenses issued shall be signed in the presence of the PTO head or his/her deputies and shall bear, among others, the full name, date of birth, height, weight, sex, color of eyes, blood type, complete current address, biometrics, license number, and its date of issue and expiration. Section 5. Prescribed Fees. - The LTO shall collect reasonable fees to cover the cost and expenses of regulation. However, such fees shall not cost more than the government's procurement expense. Section 6. Validity of Driver's License. - Except for the student-driver's permits, all drivers' licenses shall be valid for five (5) years reckoned from the birthdate of the licensee, unless sooner E-Library -"", 'capability to bear and showcase a readable number plate required under section 5 of this IRR. Owners of existing motorcycle units which do not have space for front plate are required to provide a bracket or any other provision where the same shall be installed. 71  Violations in Connection with Licensing  Violations in Connection with Motor Vehicle Registration / Renewal / Operation  Violations in Connection with Dimensions, Specifications, Weight and Load Limits  Violations in Connection with Franchise 72 Chapter III Fines and Penalties for Violations of Laws, Rules and Regulations Governing Land Transportation TEMPORARY OPERATORS PERMIT (TOP) Serves as a permit to operate a motor vehicle for a period of seventy- two (72) hours only. All apprehensions are deemed admitted unless contested by filling a written contest within five (5) days from date of apprehension. Failure of the driver to pay the corresponding penalty within fifteen (15) days from the date of apprehension shall cause automatic suspension of his drivers license for a period of thirty (30) days from the date of apprehension, in addition to the fines', ""operate a motor vehicle. d. A decision of the Commissioner revoking or refusing the reinstatement of a license under the provisions of this Section may be appealed to the Secretary of Public Works and Communications. SEC. 28. Driver's bond.The Commissioner before reinstating any driver's license which has been suspended or revoked under the provisions of the preceding section or of any provisions of this Act, may require such driver to post a bond in the sum of one thousand pesos conditioned upon the satisfaction and payment of any claim which may be filed or of any execution which may be issued against such driver in any case wherein said driver may be held answerable while operating motor vehicles. The bond required in this section shall be in such form as to render sureties liable at least for a period of not less than one year nor more than three years: Provided, however, That upon written application to the Commissioner for release from such a bond, the Commissioner may after revoking or"", 'the accident; 2. If he reports the accident to the nearest officer of the law; or 3. If he has to summon a physician or nurse to aid the victim. CHAPTER V.PENAL AND OTHER PROVISIONS ARTICLE I.Penalties SEC. 56. Penalty for violation.The following penalties shall be imposed for violations of this Act: a. For registering later than seven days after acquiring title to an unregistered motor vehicle or after conversion of a registered motor vehicle requiring larger registration fee than that for which it was originally registered, or for renewal of a E-Library - Information At Your Fingertips: Printer Friendly https://elibrary.judiciary.gov.ph/thebookshelf/showdocsfriendly/2/26188 27 of 31 10/17/2025, 11:21 PM delinquent registration, the penalty shall be a fine fifty per cent of the registration fees corresponding to the portion of the year for which the vehicle is registered for', ""him whenever he has reason to believe that the holder thereof is an improper person to operate motor vehicles, or in operating or using a motor vehicle in, or as an accessory to, the commission of any crime or act which endangers the public. Any deputy of the Commissioner may, for the same cause, suspend for a period not exceeding three months any E-Library - Information At Your Fingertips: Printer Friendly https://elibrary.judiciary.gov.ph/thebookshelf/showdocsfriendly/2/26188 16 of 31 10/17/2025, 11:21 PM driver's license issued under the provisions of this Act: Provided, That such suspension may be appealed to the Commissioner who may, after reviewing the case, confirm, reverse or modify the action taken by such deputy. b. Whenever during any twelve-month period a driver shall have been convicted at least three times for the violations of any provisions of this Act or of"", ""back to zero upon the renewal of his/her driver's license. However, the history of committed traffic violations from which previous demerit points were incurred shall be archived and shall form part of the driver's permanent records with the end view of preserving and disclosing such records to public officers and private persons for a legitimate purpose. Provided, That for contested apprehension by implementing agencies other than the LTO which remain unresolved until the expiry date of the driver's license of the contesting apprehended violator, demerit points attributable to violations still under contest shall accrue only on the subsequent accumulation period or when such contest is resolved with finality. RULE IV - PENALTIES Section 20. Unlawful Acts and Corresponding Penalties. - Without prejudice to the penalties provided under the Revised Penal Code and other applicable laws, the penalties corresponding to the following acts shall be imposed by the appropriate agency or officer: a. Any officer who, in any""]","According to the provided context, if a driver fails to renew their license before it expires, their license becomes delinquent and invalid. However, if the driver surrenders their license to the Commissioner or his deputies before the last working day of the month of their birth, they can avoid paying the delinquency fees.

If the driver fails to renew their license on or before the last working day of the month when the applicant was born, the license becomes delinquent and invalid. The fee for renewal of a delinquent license is five pesos in addition to the basic fee as prescribed.

(Section 26 of Republic Act No. 4136)","If a driver fails to renew their license after expiration, penalties and additional fees. Driving with an expired license is also a separate violation subject to fines.",0.6,0.8810872496384429
